subreddit,body
AskDocs,No.
theNetherlandsFree,"Ik heb recht tegenover een bouwput gewoond. Was niet echt top want ze beginnen om 7 uur s ochtend al met klussen. En het intrillen van damwanden was vet kut. Ze hebben me ook twee nachten wakker gehouden met vlinderen van de betonvloer van de parkeergarage onder het complex. 
Hele klus duurde anderhalf jaar 

Disclaimer: ik ben vrij gevoelig voor geluid."
ShitMomGroupsSay,Yes!
Mommit,"Netherlands. Swaddling is discouraged here for routine use. Only for problem cryers. Here it's a tightly made bed with a blanket (At the feet end of the bed, short) or a sleep sack."
ShitMomGroupsSay,"That's false. Babies have lungs by 11-12 weeks. They just don't function outside the womb yet (That's where the 24-26 week viability date comes from). 

Vaccines are also indeed created with a cell line that was once created from lung tissue of an aborted fetus. You need human cells to infect with the virus you want to create a vaccine for. The cell line is still used today, but the fetus was not aborted with the purpose of becoming a vaccine, no new fetuses are aborted for this purpose and the fetal cells do not actually end up in the vaccine

So the woman is still misinformed"
AskDocs,I like the rules of the House of god. The book is fiction but the rules are seriously good. The patient is the one with the disease. So I'm not responsive for their health behavior if they don't believe or respect my medical opinion
beyondthebump,Actually this happened today. I'm still in the middle of the fourth trimester
AskDocs,"I mostly ignore it if the issue they're seeing me for is unrelated to their beliefs. I do set boundaries and offer information if the topic comes up. For example, I've been asked by a patient to work with their homeopathic provider and refused to do so."
AskDocs,You can ask your doctor about your personal concerns. They can at least tell you where you can find answers to your questions
AskDocs,"Vitamin d is useful, the others are pointless if you're eating a healthy diet"
AskDocs,I don't see why
AskDocs,Lung pain wouldn't be your only symptom. It would also be pain related to breathing
AskDocs,You could just send them a letter. But no need to be rude
AskDocs,This needs its own thread
AskDocs,Please read our rule on claiming credentials.
AskDocs,Don't. Just upvote
AskDocs,Please read our rule on claiming credentials.
AskDocs,"Removed, irrelevant. This is a medical advice sub and you're not giving advice."
AskDocs,"Removed, this is a medical advice sub"
AskDocs,Please read our rule on claiming credentials.
beyondthebump,"I was crying from sleep deprivation and started crying even harder when my husband told me he would do the two night feeds after 3 am. 

Premature babies suck at sleeping"
AskDocs,You are severely underweight. Losing weight is dangerous to you. There is no weight loss medicine that is safe for you.
AskDocs,How do you know it's related to sex?
AskDocs,Please read our rule on claiming credentials.
AskDocs,"You need to add the test results like blood pressure, labs  etc."
AskDocs,Yes actually! They become stronger through the stress of exercise
AskDocs,Please read our rule on claiming credentials.
AskDocs,You're better off asking this at the nursing and nursing school sub.
AskDocs,Not likely if the wound isn't deep
AskDocs,Some kind of motility disorder of your esophagus.
AskDocs,"That's impossible. Clots from the skin end up in your lungs, not the brain. And spanking doesn't cause clots. It is abuse though"
AskDocs,This doesn't sound like gerd. When is the last time you were evaluated by a GI specialist? You need additional tests to find the cause so you can get treated.
AskDocs,It's not gold standard at all. This is false
AskDocs,Please read our rule on claiming credentials.
AskDocs,"No, the nerves of the lips are not connected to your neck."
AskDoctorSmeeee,Don't do anything. Time will heal it
AskDocs,"Removed, no pictures of genitals including your bum by minors. There are criminals on reddit who will do bad things with your naked pictures or harass you for more."
AskDocs,Please read our rule on claiming credentials.
AskDocs,Please read our rule on claiming credentials.
AskDocs,"You need bacteria for decomposition. Instead the immune system cleans it up before any bacteria can get a hold of it and turn it into scar tissue.

It's myocardium by the way. Pericardium is the lining around the heart"
AskDocs,"No, they don't"
AskDocs,"It's not a steroid, it's a stimulant. It's also not regulated so we have no info on the effect on humans in terms of how long it lasts."
AskDocs,This is a personal health question and needs its own thread
AskDocs,"Nope, this needs its own thread"
AskDocs,"I have colleagues with various auto immune diseases and they do just fine (IBD). That said, it is harder to keep doing a stressful job when you have a chronic illness, and you are at risk of getting infectious diseases. So a desk job like a medical secretary might be better. Our secretaries have LOTS of phone contact with the patients and you'd literally be the face of the hospital. So depending on your education you certainly have options."
AskDocs,"No, not if it's just a bit"
AskDocs,This is a personal health question and needs its own thread
AskDocs,"Please don't, just upvote."
AskDocs,"Could be dactylitis (basically inflammation of the whole digit, which is a sign of active disease) or chilblains. Time to find a rheumatologist!"
AskDocs,"Mouth yes, teeth no"
AskDocs,"Locked, we don't allow this type of speculation"
AskDocs,We don't allow pictures of genitals of minors. Please be safe and just see a doctor if you're worried.
AskDocs,"No and yes, though the latter is not your sfincter but your pelvic floor that is affected"
AskDocs,This doesn't belong here
AskDocs,You said chemo twice. What did you want to compare it to?
AskDocs,This is an inappropriate question for this thread
AskDocs,1 thread per day is our maximum
AskDocs,It's not dependence. You also risk falls and cognitive decline with long term use
AskDocs,"Removed, we don't allow ads"
AskDocs,Please read our rule on claiming credentials.
AskDocs,"Yes, many people never get outbreaks"
AskDocs,Upload somewhere else and put a link in your thread
AskDocs,You mean ephedrine caffeine? Very bad for your cardiovascular system
medicine,"Netherlands: I roughly have one block of non 8-6 shifts every four months. That block has three weekends in it. Other than that no weekends. So 3 out of 16 weekends. And never a shift longer than 10 hours, though with overtime it's sometimes 13. We don't get paid for overtime."
AskDocs,"Removed, we don't allow alternative medicine"
AskDocs,"Removed, this is a medical advice sub"
AskDocs,See an ENT. Asap
AskDocs,Did you see an ENT? What tests were done?
AskDocs,Because if someone earns their money with prescribing hormones they're never going to tell any customer they don't need the treatment if they turn out to have normal results. That is by definition bad healthcare
AskDocs,Oral temps are unreliable. I'd be surprised if you had this temp rectal
AskDocs,Please read our rule on claiming credentials.
AskDocs,"You can start at any point in your cycle. After 7 days you'd be protected against pregnancy. Make sure to read the package insert of the pill, it contains instructions."
AskDocs,"Removed, I can't believe this is legal in the US"
AskDocs,"I have no idea, I'm in Europe."
AskDocs,"No, a superspreader is an individual that infects many other people. It doesn't mean it will go far down the chain"
AskDocs,"The symptoms are actually caused by your immune system. The body senses a pathogen and launches an immune response, which in turn causes the symptoms 🎮"
AskDocs,Depends on what the claim was about. Accidents happen. Gross negligence is a different story
beyondthebump,"We had the same problem with both babies. It's partly trapped gas here, and partly lack of control of their vocal cords I think. 

I've banished baby to her own room. I even sleep with earplugs in and have husband poke me if it's my turn and I don't hear her crying."
AskDocs,Do you have a picture of your blue arms? Is it al over? Are the blue areas painful or itchy?
AskDocs,"Relevant advice given, thread locked"
AskDocs,Agreed. With the fever and joint pains perhaps even lofgren syndrome. I hope the hospital will sort you out soon
AskDocs,It's true for herpes viruses
AskDocs,One thread is enough
AskDocs,Food preferences change over time. As long as you don't lose weight unintentionally it's no problem
AskDocs,Depends on the underlying heart rhythm. If it's just extra systole: go ahead. If it's due to atrial fibrillation: better be careful
AskDocs,"Fever, severe pain, pus from the wound"
AskDocs,"Yes that's a thing. For example, I wouldn't expect someone to cry out in severe pain from a needle stick of a glucose monitor. Or not be able to walk with a small bruise on your ankle. These are of course extreme examples"
AskDocs,"Yes you first open the sub, and then use the search bar. On mobile it automatically only checks askdocs, on desktop you can use the drop down menu to narrow the search"
AskDocs,We usually start with a two week trial. Being able to wean off depends on the cause.
beyondthebump,"I wear a seamless stretchy thing. No support at all, but it just keeps the nursing pads in place"
AskDocs,"I live in a country with free access to general practitioners. We actually encourage patients with severe issues and lots of visits for minor issues to have regular scheduled visits to go over current issues. Because you never know if they someday do have a serious issue. That said, I try to let the patient draw the conclusion that it's innocent on their own, and teach them how to recognize true alarm symptoms. And I'd push them to get a therapist"
AskDocs,That is different for each disease. RA wouldn't for example
AskDocs,Start your own thread please
AskDocs,Please read our rule on claiming credentials.
AskDocs,"Removed, we don't accept this type of unscientific advice"
AskDocs,Please read our rule on claiming credentials.
AskDocs,Please read our rule on claiming credentials.
AskDocs,"Please read our rule on claiming credentials.

Also, isn't 6 months way too early for night terrors? I thought that started at 2 years"
AskDocs,"If you're asymptomatic you're no longer contagious. Loss of taste and fatigue don't count by the way, those can last weeks. We don't do negative tests because they stay positive for a long time"
AskDocs,Please refrain from claiming credentials
AskDocs,"Yes, that's possible"
AskDocs,Listen to your body. Continue training when the pain subsides
AskDocs,"Thyroid, cbc, kidney function, crp But your doctor will know what to do, it's our bread and butter"
AskDocs,Please read our rule on claiming credentials.
AskDocs,This body temp is still normal. How do you measure it? Oral? Rectal? Ear?
AskDocs,Please read our rule on claiming credentials.
AskDocs,"No, not typical"
AskDocs,"You can't win this argument by convincing her. She's made up her mind. So this is when you put your foot down and forbid her to ever mention this nonsense to your kid, and change the subject whenever she brings it up."
AskDocs,"You can't spoil a young baby. So crying it out is kind of pointless, especially if it's hunger. They learn to fall asleep on their own somewhere between 4 and 6 months, so in those months a bit of crying in bed is acceptable."
AskDocs,Please read our rule on claiming credentials. Saying you have a medical background is against this rule
AskDocs,Please read our rule on claiming credentials.
AskDocs,"No, only when severe or chronic"
AskDocs,Because in type 1 the part of the pancreas that produces insulin is destroyed. Type 2 can be reversed with dietary changes and weight loss as long as the pancreas is still capable of producing enough insulin
AskDocs,"Removed, misinformation"
AskDocs,"No point in isolating from eachother if you're all sick. You should regularly clean all surfaces you touch like door handles. Ventilation is also very important to get rid of aerosols, so open the windows regularly. Your dad sounds like he needs to see a doctor."
AskDocs,"It's safe, however prolonged use of Tylenol actually causes headaches."
AskDocs,Repost after 24 hours or see a doctor in real life
AskDocs,Start a thread.
AskDocs,Please read our rule on claiming credentials.
AskDocs,No this is false
AskDocs,Please read our rule on claiming credentials.
AskDocs,"A clinical diagnosis is based on your symptoms and physical examination. If the imaging doesn't match the symptoms, we can conclude the findings on imaging are coincidental."
AskDocs,This thread is not for personal health questions. You need to start your own thread. I highly doubt cortisol is causing your symptoms by the way
AskDocs,"You don't, unless you have cushings. Good sleep and low stress prevent elevation, but doesn't lower it"
AskDocs,Please read our rule on claiming credentials. Nurses can be flaired too!
AskDocs,"The sub is big and the laypeople far outnumber the verified health professionals. The advice by laypeople generally isn't that bad, especially for the easy cases. Harmful advice can be reported and will be removed."
AskDocs,"Don't believe a word a layperson says on a disease specific sub. It sounds harsh, but people who go to such a sub a. come from a highly selected so exceptional population with a specific disease and b. Happy patents don't talk online about their experiences. 

A radiologist is perfectly capable of judging a pituitary mri. There's a specific imaging protocol for it. 

I can't believe a neurosurgeon would operate on such a small tumor. It is brain surgery, and has risks. You don't operate unless not operating is harmful, like with large adenomas that compress the optic nerve. 

And the labs do trump the imaging. Tiny inactive adenomas that don't produce hormones or don't interfere with hormone production are asymptomatic. 

Cushings disease is an adrenal disease that comes with a specific set of tests (saliva, blood, urine). They should indeed not be skipped, you can't do just one of them, at least two are needed."
AskDocs,"It can go away, but it can also relapse. So it's highly individual."
AskDocs,No problem to be on a diet
AskDocs,"No, a local steroid doesn't cause anxiety. However, the mind is powerful. If you strongly believe it causes anxiety, then anything can cause anxiety, from a nose spray to a can of tuna"
AskDocs,"You're allowed to ask questions about your medicine here, but not advice about your personal situation. The latter does need it's own thread, and sometimes requires multiple tries to get answered due to how busy the sub is"
AskDocs,"Sound sensitivity is highly individual. So you're not abnormal, but neither are the other people"
AskDocs,"No you can't get shingles if you never had chickenpox. In theory you could get mild chickenpox, in case your vaccine doesn't provide long term protection. Then you CAN get shingles eventually, but not from someone else. (The virus lies dormant in nerve roots and can reactivate like you know from oral herpes)"
AskDocs,"Pubmed, our database of all research."
AskDocs,It should be!
thenetherlands,Hier draagt het hele gezin falke cosyshoes. Zalig.
AmItheAsshole,"ESH. This is so childish. What do you think will come out of this? You should talk and compromise, not make matters worse by proving her point. Apparently she feels overwhelmed and you feel under appreciated. Talk about that, and see how you can both help each other out."
AmItheAsshole,NTA. You're an adult and get to make your own rules now. They have no right to invade your privacy like that. You don't have to text them every day either if you don't want to.
AskDocs,"It won't harm, but I can imagine it would make you extra sore afterwards"
AskDocs,Please read our rule on claiming credentials.
AskDocs,"Never, except for std tests. Cardiovascular risk testing starts at roughly 40, depending on your lifestyle and family history"
AskDocs,This is a personal health question and needs it's own thread
AskDocs,This is a personal health question and needs it's own thread
AskDocs,You just get medication to prevent further damage
babywearing,I'm in love with my boba x. Works with my newborn and my toddler!
AskDocs,"You do it by excluding other causes, and see if it improves when treating the anxiety"
AskDocs,"I would speed things up, but I'm in Europe"
AskDocs,"No , the ED can't diagnose you unfortunately. Perhaps a psychologist has an earlier opening? You'd at least be able to start therapy"
AskDoctorSmeeee,You likely got sugar water. Certainly not something actually helpful
AskDocs,"You mean if people survive longer because they don't want to die alone? No, not significantly long."
AskDocs,Yes!
AskDocs,"Removed, this doesn't work at all. It's an old wives tale"
AskDocs,No. Bad advice
AskDocs,"Removed, you've gone down the chronic Lyme rabbit hole, which is pseudoscience and not allowed here"
AskDocs,"Please don't litter the thread, just upvote"
AmItheAsshole,"NTA. Well handled. Embarrassment is the best way to ensure he never does that again. 


Storytime: when I was 16, I was standing in line at the desk of my math teacher because I needed him to explain something to me. While I waited, standing next to the desk of a classmate (one of my friends actually), that classmate put his hand on my ass. Without thinking I turned round to him and exclaimed ""B! Stop touching my ass!"" You should have seen his face, he was mortified. It was hilarious. He also never touched me again."
AskDocs,You make a thread. We don't allow private consultations
AskDocs,Magnesium doesn't change your personality. Your kidneys are very good at balancing electrolytes and they don't need help
AskDocs,"Relatively low risk, but not zero depending on who you share your table with and if the other guests are healthy"
AskDocs,They may be concerned about how the cloth masks are cleaned at home. It could introduce other pathogens to the hospital.
AskDocs,Yes it's perfectly safe
AskDocs,This is a disguised personal health question and needs it's own thread.
AskDocs,Please don't do this. Just upvote.
AskDocs,Please read our rule on claiming credentials.
AskDocs,Please read our rule on claiming credentials.
AskDocs,Please read our rule on claiming credentials.
AskDocs,Well a one off incident with an extremely full bladder is no reason for concern.
AskDocs,Please read our rule on claiming credentials.
AskDocs,You could file a complaint
AskDocs,"Upper arm, always. Wrist cuffs are inaccurate because the result depends on how high you hold your wrist"
AskDocs,"Some parameters yes, others no"
AskDocs,Not always. They'd have to know who your first doctor is to inform them
beyondthebump,"Books, cars, puzzles, all of his food.

Ooh and a flashlight!"
AskDocs,"Nobody looks for a keychain in an emergency situation. That said, look into medical alert bracelets, and list it as allergy with the compound name in English and your local language"
AskDocs,Please read our rule on claiming credentials.
AskDocs,Please read our rule on claiming credentials.
AskDocs,"Removed, 130 is not a normal resting rate for a 10 year old."
AskDocs,Please read our rule on claiming credentials.
AskDocs,"Please read our rule on claiming credentials. It does not only apply to doctors, but all medical professions"
medicine,"I read a book and had a therapist. The book is staring into the sun, by irvin d yalom. It taught me that death can be a friend. (I used to be so scared of death that I was afraid to go to sleep alone when I was sick as a kid, and it was one of the things that drove me to go to medical school)"
AskDocs,I'm sorry for your loss
AskDocs,"If the pain is not controlled before starting the patch or if the lowest dose of the patch is higher than the current morphine dose, yes."
AskDocs,"Removed, inappropriate"
AskDocs,"Yes, schedule a regular checkup. I don't know about health insurance in the states"
AskDocs,Medical dictionaries usually tell you how to pronounce it
AskDocs,"No, but it will cause more soreness"
AskDocs,You can repost after 24 hours
AskDocs,Please don't be rude to the other users here. Even if the suggestions are wrong
AskDocs,"Please read our rule on claiming credentials. 

And the foley is needed because she had an epidural. A full bladder stalls labor and you can't go to the bathroom with an epidural, nor do you have full control of your bladder with an epidural"
beyondthebump,A reward? Sticker chart with a bigger reward after x poops on the potty?
beyondthebump,"Just go about your day and narrate. Everything is fascinating at that age. And they chew on stuff, that's life"
beyondthebump,"It's not diarrhea if she only has one bowel movement a day. If she's otherwise happy, doesn't have a fever and eats and drinks well it will pass. If it's three or more liquid bowel movements a day it is diarrhea and drinking enough is most important."
AskDocs,"Nah, at your age all you need is a regular std check"
AskDocs,"Removed, we don't allow that type of advice"
Residency,"This made my night, thank you"
AskDocs,Please read our rule on claiming credentials
AskDocs,Please read our rule on claiming credentials
AskDocs,"Yes, claiming any type of medical credential is not allowed by unverified users. And we don't verify nursing students. You may still comment, just without the claim"
AskDocs,Please refrain from claiming credentials
AskDocs,"Removed, bad advice."
AskDocs,Please read our rule on claiming credentials
AskDocs,Covid can present as a cold. Get tested
AskDocs,Removed. Bad advice. These meds have side effects
AskDocs,We'd be looking for low morning cortisol
AskDocs,Hypocortisolism. Makes you feel like shit.
AskDocs,Did they check your adrenal glands too? With two auto immune diseases I'd be alert for a third
AskDocs,You need to see a doctor today. This will make you feel quite sick in a few hours. You need mental health care my friend.
AskDocs,"Not in English no, I'm not a native speaker. But I'm sure Google knows"
AskDocs,"They're a bit like your breathing muscles. Partly automatic, partly consciously adjustable. That said, consciously relaxing is not easy when the rest tension is naturally high, that's where the PT training comes in. You can do the exercises by yourself, but if you do it wrong you can make the problem worse."
AskDocs,He should be able to get a copy of the medical file through the hospital administration. I'm not from the uk but the right to your file and the ones you're legal guardian of should be universal
AskDocs,Many cancers will become a chronic disease instead of short term deadly. Targeted therapies with your own immune cells that are programmed to attack just your cancer cells. So less toxicity from chemo. Some cancers will still be deadly though.
AskDocs,One thread per 24 hours is allowed. Time is not up yet
beyondthebump,"Don't skip 21, the size difference is too much to walk well, otherwise they trip over the long toe section. I always buy shoes on sale."
AskDocs,"Removed, no religious advice"
AskDocs,If you can't be polite we're done here. Locked.
AskDocs,I'm making this thread sticky for a day. Rest in peace Robert.
AskDocs,If you can't be polite to our verified medical professionals you will be banned. No need to be rude just because you don't like the advice. Consider this your only warning.
AskDocs,"Removed, illegal"
AskDocs,"Mental health disease sucks, and your trauma doesn't make it easier. Cognitive dysfunction is a symptom of your mental health issues. Another issue is deconditioning. If you don't use your cognitive abilities, you lose it. This can be retrained. So just as you would go to the gym for your muscles, you need to gradually build up cognitive challenges."
thenetherlands,Ik ben geen derma held.😅
AskDocs,"The skin test should be read after 3-5 days, so yes return. Your work messed up the timing!"
AskDocs,"I think she only remembers the dose right, and not the reasoning. Or maybe the doctor dumbed it down for her too much"
thenetherlands,Interne geneeskunde
AskDocs,"The British medical Journal has an open access continuous systematic review on treatments for covid, including preventative treatments. You could use that. 

Maybe she misunderstood the doctor? Adequate vitamin d levels reduce the risk of severe disease, but it does not prevent her from getting sick at all."
AskDocs,"No, quarantine would have to be 10 days at least. Test will not be positive until 2-10 days after exposure, that's why the quarantine period is so long."
beyondthebump,"Yes, we do sleep sack for naps too!"
beyondthebump,"I don't track it at all, it's pointless to me and it only gives stress. It's not like I can magically make her sleep longer. I stopped tracking feeds too, I caught myself calculating my own sleep between feeds and that number made me unhappy."
beyondthebump,7 days here. I must admit I stopped after day 5. And lowered to the preventative once a day dose once her mouth was clear.
beyondthebump,"Same dose! You can also do 0.5 ml after every feed. Mine came with a little syringe and my newborn has such a tiny mouth I didn't bother with my finger. My eldest had it when he was a bit older and he got a gel that had to be applied with a finger. Just use your pinky finger! No gloves necessary, just wash them before and after."
beyondthebump,I'd do whatever you do at nighttime for naps. My first got boob on our bed and then I'd put him in his crib while asleep. As he got older he would also go in there awake for naps. It's a familiar routine so baby will get the hang of it!
