subreddit,body
AmItheAsshole,YTA. It was her party too and you could have sucked it up for one night. Or made time for your best friend to have that talk.
AmItheAsshole,NAH. You were both polite
AskDocs,Well you've got to be exceptionally fat to have 5cm of fat on your thigh muscle.
AskDocs,"The painkillers may actually be the cause of your headaches.

There is no interaction with lexapro by the way"
AskDocs,"You're not deformed, just a bit asymmetrical. I also notice one of your shoulders is lower than the other. Could be scoliosis. 

If you have no pain moving around etc, this shouldn't be an issue."
AskDocs,"It will be a tiny bit of the nebido, but not enough to make it less effective"
AskDocs,Please refrain from claiming medical credentials.
AskDoctorSmeeee,"Do hot showers reduce the nausea? If so, then it is definitely the cannabis. It's something called cannabis hyperemesis. It will go away if you stop using"
AskDocs,"Sorry, you've seen a quack and this is what they do. Functional medicine is not evidence based medicine. You don't need those expensive supplements, and you can certainly leave them a negative review or file a complaint."
AskDocs,"Please refrain from claiming credentials, you're not a certified and verified health professional yet."
AskDocs,Please read our rule on claiming credentials
AskDocs,Please read our rule on claiming credentials
AskDocs,It's not dangerous beyond that it can cause skin irritation
AskDocs,Please read our rule on claiming credentials
AskDocs,Please read our rule on claiming credentials
beyondthebump,"Uhm, here we just bathe babies with the cord still attached? A three minute soak won't hurt. They even gave my preemie a bath with the cord still on."
beyondthebump,"My son didn't get a full head of hair until age 2. It's also super light blonde so he looked bald forever. 

My daughter was born with a full head of dark hair, I wonder what will happen to it!"
beyondthebump,Starting at 4 months is the national guideline here. It helps them learn flavors and textures and helps them learn to eat before picky behaviour sets in. And it prevents allergies if you also introduce eggs and peanut butter early
beyondthebump,"I work in a hospital, from roughly 8-1730 Daycare drop off is at 7:15. My schedule with baby one used to be:

*6 alarm, breakfast, baby on one boob, simultaneously pump the other for optimal results
*715 daycare dropoff and 45 minute commute to work
*11 pump for 15-20 minutes, takes 30 minutes total with cleaning and drying pump parts afterwards
*1330 pump
* somewhere between 15 and 16 pump
* 1800 daycare pickup and breastfeed if needed, pump if baby just ate when picking up

Rest of the day: boob as needed."
AskDocs,"It being delivered alive says very little about the condition the baby was in. Pre e can be very harmful to babies, and it can kill mothers even after delivery."
AskDocs,Depends on the cause. I suggest you start a thread with your exact circumstances
AskDocs,"No, but a wound can sting a bit as it is healing"
AskDoctorSmeeee,Call your pharmacist and ask if the antibiotic interacts with the cymbalta. You may actually have lower blood levels due to an interaction causing your symptoms
AskDocs,"Have you been to a university hospital rheumatologist? I don't know what you have, but this sounds like the puzzles a university hospital specializes in. So if your rheum runs lot of ideas, ask for a referral. Given your positive family history, it could for example be a (New) genetic abnormality. Have your ESR/CRP ever been elevated? It should be if it's an inflammatory disease."
AskDocs,"It means they found something that doesn't look like cancer, but they can't fully rule it out from just the mammogram. The next step would be ultrasound."
AskDocs,"Sounds like your back muscles cramp up when you're in those positions. 

A physical therapist can help you with those muscle problems. 


Do NOT go to a chiropractor. It is pseudoscience and in your case it can even be dangerous with such a deformed spine."
AskDocs,"Removed, we don't allow alternative medicine as advice"
AskDocs,Masturbation on its own is not harmful. Not to your body and not to your mind. However an addiction to masturbating IS harmful because it interferes with day to day life. It should be treated as part of your other mental health issues.
AskDocs,Depends on the location and severity. I'd go in if it was unbearable.
thenetherlands,Op m'n werk hebben we nog steeds piepers naast mobieltjes :(
AskDocs,Agreed! Decidual cast
AskDocs,Please read our rule on claiming credentials
AskDocs,Please read our rule on claiming credentials
AskDocs,"This is false. I still agree a 14 year old doesn't have colon cancer, but red blood can certainly come from the intestine. It can also be an inflammatory bowel disease"
AskDocs,"No, we don't allow this kind of reply"
AskDocs,"Removed, don't speculate here if you have no medical knowledge"
AskDocs,We only do personal health questions here.
AskDocs,"No, not likely. A one time value of 3.9 is no reason for concern either."
beyondthebump,"Agreed, I did it for a full year and never had issues getting him to go to bed awake. We just slowly and naturally replaced it with a story. 

We never had a big ritual either. Brush teeth, clean diaper, sleep sack on, boob. (Or story) husband had no problems on bottle nights either when I was away. 

I don't even own a white noise machine"
beyondthebump,"Same here, though my toddler has had phases in which he refused to open his mouth. I then just squish his head with his ear against my boob and brush anyway. Most of the times he now happily opens his mouth for my made up brushing song (Melody of wheels of the bus go round and round, it's now the toothbrush goes up and down/back and forth in my native language)"
beyondthebump,"My eldest would not take formula. The taste was just too different from my milk. I tasted it myself and I actually agree with him that the mainstream formula brand is disgusting. I googled a bit and found someone who had actually compared the flavors of several brands to breastmilk and my son gulped down the one she said was closest in taste. I tried it myself, and it does taste similar! 

I'm in Europe though, and it is a local supermarket brand. Perhaps you can get samples and do a tasting yourself?"
beyondthebump,There's also eats on feets. Maybe they're active in your area too.
AskDocs,"This is what lands some patients with covid in the icu. The body basically overshoots its defence against the virus, causing massive inflammation and illness. It is not a permanent auto immune disease like the rheumatic diseases you may know. We don't know exactly what causes it yet, but treatment is getting better now more research is available."
AskDocs,I can't read it either. The thing on the right says something about'left side' but that's all I can make of it.
AskDocs,We don't allow this. You need to start a thread like everyone else
AskDocs,Not typically. It also depends on the dose and how it is taken. It's more likely to increase wbc
AskDocs,Please read our rule on claiming credentials
AskDocs,Please read our rule on claiming credentials
AskDocs,Please read our rule on claiming credentials
Residency,"What the f is up with those labs? We have a dedicated team of lab personnel responsible for drawing labs. It is all they do all day, every day."
Residency,"I have a rule for calling in sick: if I cry before I reach the hospital, I call in sick. It hardly ever happens, but if it does, this rule saves my sanity. 

(I have a few more about fever and vomiting/diarrhea and when to go back after sickness but those are irrelevant here).

The hospital keeps running without you there, nobody will die. So it is ok to take care of yourself."
AskDocs,"Removed, you may only post once a day."
AskDocs,Please read our rule on claiming credentials
AskDocs,Please read our rule on claiming credentials
AskDocs,Please read our rule on claiming credentials
AskDocs,Stop posting the word bump people. An upvote does the job without burying any useful response OP may get.
AskDocs,Yes flank pain is a symptom!
AskDocs,"No, totally normal phenomenon"
AskDocs,Totally normal as long as it functions properly.
AskDocs,"Doesn't matter, whatever you prefer"
AskDocs,You're sneaking personal health questions into this thread. You should start your own thread or just see your primary care doctor about your lymph nodes.
AskDocs,"Healthy young kidneys won't be damaged by increasing your caloric intake. When in doubt, a sports dietician can help you balance your nutrients"
AskDocs,"Yes, if administered by a layperson. Professionals know what to look out for and how to reverse the sedation in time"
AskDocs,Asymptomatic bacteriuria sometimes happens. We do not treat it in absence of symptoms of an infection.
AskDocs,Call your insurance to see which doctor is in your network. Then call a practice and ask if you can become a patient there. They will do the rest!
AskDocs,"1 yes they are specific for the antigen that was isolated from this corona virus. The very nature of the test is that it can only tell you if your body is producing antibodies against said antigen. We look at two types, IgM (Only present in early and recent infection, disappears after a few weeks) and IgG (Present after a few weeks and stays long). It does not tell if you are currently contagious though. 

2. We don't know yet. So far at least several months. The memory cells that produce the antibodies should stay much longer

3. High dose prednisone mostly affects t cell function. Antibody producing cells are b cells. That said, t cells do aid the b cells in their job. So the antibody response may be less, but not zero, and should still result in the formation of memory b cells."
AskDocs,"It's to rule out dangerous conditions like an ectopic pregnancy, or a missed partial spontaneous abortion. You're right about it not having consequences for the fetus, it's all about mom."
AskDocs,Yes very much possible. Not much you can do about it afaik except try to ignore them.
AskDocs,"Removed, misinformation."
AskDocs,Thanks!
AskDocs,"ED, definitely. You may have caused severe burns on your esophagus and stomach, plus electrolyte and acid base disorders. Do not delay seeking care. I'm sorry you feel so bad."
AskDocs,"So far, the data does not show increased susceptibility to the disease when pregnant, and the babies don't seem be harmed either. Mortality rates are also equal. However, if you do catch it and get the dreaded pneumonia that hospitalizes a small fraction of the patients, you are at risk of it being more severe, especially in third trimester. That's because the big uterus basically reduces your lung capacity.

Safety at the workplace completely depends on the age of your students (the young ones seem less contagious and susceptible) and how your employer lets you protect yourself (distance, masks, ventilation of the classroom)

Personal anecdote: I just had a baby last week. I made it through without catching it so far, by wearing ppe and avoiding the actual covid patients. (Though I must add I only worked until the end of August). My risky contacts were all outside of work (like kissing and hugging relatives )"
AskDocs,Uti doesn't cause ammonia breath
AskDocs,"A granuloma is inflamed tissue. Causes can vary, so usually it is followed by an appointment with a pulmonologist"
AskDocs,It can go away depending on the cause.
AskDocs,"You can harm a nerve, but not one in your index finger"
AskDocs,"No, you won't lose all of them. You lose a small fraction and your body will just make new ones."
AskDocs,"Removed, we don't allow alternative medicine as advice"
AskDocs,Please read our rule on claiming credentials.
AskDocs,"Removed, bad advice."
AskDoctorSmeeee,"You don't have to eat, but drinking is vital. If you can't keep down fluids you need to go to the ER"
AskDocs,Thank you for coming back with an update. Since you seem to have no additional questions for us I will lock this thread. Feel free to start another thread if you have another update or follow up questions
medicine,Fun fact: dry needling isn't founded in proper science either.
AskDocs,"You should ask his cardiologist. I don't know exact statistics, but I do know many patients never need valve replacement surgery, and even if they do, we currently even do it in very elderly patients."
AskDocs,Because dead cells all look alike under a microscope. You need them alive to look at the cells and the way they are organized
AskDocs,Yes
AskDocs,"At this point it is not dangerous. The valve disease can get worse over the years though, and then cause symptoms."
AskDocs,Not that I'm aware of.
AskDocs,"Those tests are not available yet, unfortunately. Plus it would only be for this one strain of corona, and it may mutate in the future like the flu does"
AskDocs,We don't allow surveys or interview requests
AskDocs,"Mrsa is a type of staph, but not all staph is mrsa. If he has staph epidermidis it cannot become mrsa, because mrsa is always staph aureus. All bacteria have the ability of developing resistance though. You have no choice but to keep using the ointment though, the infections need treatment.

Don't forget to thoroughly wash under his (short!) nails too!"
AskDocs,"You can develop some heart disease rather quickly. Like myocarditis, or tako tsubo."
AskDocs,"Monistat kills fungus instantly, but not all of it and your body still needs time to clean up and heal. So the higher dose kills more fungus at once, but not all of it. The lower dose needs more doses to get to the same point. Healing takes a full week anyway. The itch goes away fast with either treatment"
AskDocs,It will be approved if you change f to female. This thread is NOT for personal health questions
AskDocs,Because it may be something other than bcc. And then the treatment affects the pathologist s ability to diagnose it right.
AskDocs,Cold turkey is fastest but sucks. You could also do one nostril at a time.
AskDocs,"I’m locking this thread. We all agree this is outrageous and needs medical attention TODAY. 

OP, feel free to post an update thread to share your outcome after this has been taken care of properly. I hope you’ll be well soon."
