subreddit,body
beyondthebump,"Keep nursing! It's not a bad habit, someone just made that up. She may just be going through a growth spurt and need some boob at night. It'll likely go back to normal soon"
beyondthebump,My 4 week old had thrush a week ago and it was gone within two days of the nystatin. She hated the stuff but it worked super fast. It was like it just melted off her tongue
beyondthebump,"We're doing it at home with just our little family . Nice dinner, presents, movie, etc. My sister and I will send gifts for each other's kids (we both have two). And lots of video calling."
beyondthebump,"Could be teething, or a cold, or some other virus. In my experience it never lasts more than 2 weeks and then they go back to normal as long as you stick to your routine. 

Baby's gonna baby!

My son cried when he woke up for the first almost year of his life. He just couldn't handle being hungry. My daughter at 4 weeks old is the same currently."
AskDocs,If you build up gradually you can eventually do them all day
AskDocs,"The deficiency should be gone in two months of proper supplementing the right dose. If not all symptoms disappear, they likely have a different cause"
thenetherlands,Vwo-> uni (Geneeskunde)->anios->phd-> opleiding tot medisch specialist (nu jaar 4/6)
AskDocs,"This thread is getting too hard to moderate and I don't think OP is going to read every reply. We all feel for you OP. 

Wishing you a calm and painless end."
AskDocs,"No, but this can be a sign of covid. Please get tested"
AskDocs,"Removed, we don't allow Facebook groups."
AskDocs,"No a cow was vaccinated. It has nothing to do with water dams. The vaccine contained remnants of a cell line that made antibodies against parts of cells that some calves have. In calves that is lethal. 

I'm exceptionally good at googling so don't worry. I've claimed in the past that if I can't find medical stuff online, it doesn't exist 😅"
AskDocs,"Here you go: https://www.vetstream.com/treat/bovis/diseases/bovine-neonatal-pancytopenia

I'm not a vet but I got lucky on my first Google search"
AskDocs,"Neither is optimal. Ibuprofen is not good on an irritated stomach, paracetamol not good for the liver. That said, in someone otherwise healthy a one day treatment won't cause significant harm for either drug"
Groningen,"I can't really help either, I finished med school in 2012. I'm happy to answer questions about the medical homework though!"
AskDocs,"Just keep taking it, you'll pee out the excess"
AskDocs,If you don't mind the scar yes.
AskDocs,"We don't really know why some people are asymptomatic. It likely has something to do with how their immune system handles the virus within their nose. So I can't tell if Bobby's risk if asymptomatic covid is also increased, or lower."
AskDocs,I had to Google it. They're stretches for people with nerve issues. No threads involved!
AskDocs,"Perhaps, but only if it was put into your left arm"
AskDocs,I can't tell from a distance. Plus I'm not a gastroenterologist
AskDocs,Pelvic floor therapy could help. Botox will also lower the sphincter tension. A GI doctor would do the latter if necessary
AskDocs,"No, AKI has criteria beyond creatinine change. They wouldn't lie to you"
AskDocs,I would like to add that you should take the iron every other day instead of daily. It actually increases the total amount of iron taken up by your body. It's due to a protein that regulates how much iron is absorbed from your bowels.
AskDocs,"Nope, splinting would just make it stiff. The joint was affected with this fracture and you can't fix that unfortunately."
AskDocs,That your body has more than one.
beyondthebump,"I have a 2,5 year old and a 4 week old. The toddler has cranked up his toddler behavior ever since I'm home, and especially if I'm stuck with his sister on my boob. 

I try to keep everything the same for him, with the change that he now sometimes has to wait. I also tell baby to wait when I'm busy with toddler to let him know she has to wait too. 

The rules are also the same. I tell him to stop, then warn him with a predictable punishment and follow through. I hardly have to execute the punishment (2,5 minute time out in the hall). 

If he doesn't want to go somewhere I play into his competitive side. Mommy will be outside/upstairs /downstairs first!!!!  Or play hide and seek. And he'll usually come running with a smile.

He still drives me mad sometimes though. I don't want to be angry mommy all the time, and I tell him that too."
beyondthebump,"My 2,5 year old tries to squeeze my boob while I'm feeding his baby sister. He thinks that's helping"
AskDocs,I'm done having this discussion. Do not advise anyone here to try homeopathy again or you will be banned.
AskDocs,You can wait a week. Cancer usually doesn't hurt. Painful lumps are usually an infection of sorts
AskDocs,That's not good practice. Most cases are caused by viruses.
AskDocs,"No, that's called placebo effect and doesn't prove anything. Scientifically it's been debunked decades ago. They might as well try a rain dance."
AskDocs,I'm locking this thread. OP needs to contact their OB. I've been having to remove lots of bad and potentially harmful advice
AskDocs,No problem at all. Just realize it takes time to earn back your sacrifice.
AskDocs,"Removed, homeopathy is quackery"
AskDocs,Please read our rule on claiming credentials
AskReddit,Yes! Love love loved these games
AskDocs,"Yes, they usually specifically guide patients with medical issues."
AskDocs,That depends on the affected sphincter
AskDocs,"Wow, you've got some nerve to tell someone with a phd in internal medicine, the area that deals with sodium on a daily basis, to 'do their research'

I suggest you look up the dunning Kruger effect and realize that you are very much on the left side of the curve."
AskDocs,"Removed, this is 90% bogus advice. This is not a sub for grandmothers advice"
AskDocs,"No, there is Tylenol in that tea, which OP was already taken too much"
AskDocs,No problem! We have an anonimized verification process but it is not mandatory. Not saying you're a medical professional is a fine solution.
medicine,"Jeez, so you can actually die from not being able to see your penis!"
AskDocs,"While I agree that you can't force your roommate to go to the hospital, I must add that the roommate should be at the hospital, because she does not have a diagnosis and thus we don't know if this is a life threatening disease."
AskDocs,"Removed, we do not allow this type of unscientific advice"
AskDocs,Please read our rule on claiming credentials
AskDocs,Please read our rule on claiming credentials
AskDocs,A one time use of nitrous isn't going to cause significant b12 deficiency. You'd have to use it regularly for it to have such profound effects.
AskDocs,"Allright. Go to scholar.google.com and type in the search terms handedness change and combine with the term creativity or coordination or any other outcome. 

I did a fast skim but didn't find anything yet on forced change of handedness"
AskDocs,"Yes, but they may be less effective"
AskDocs,"I think you need to specify the impact on body and brain, because I have no idea what you mean with this broad term. Pubmed is our database with all medical research on it."
AskDocs,"Locking this thread. Good reasons given, but also a LOT of misinformation and pointless anecdotes"
AskDocs,The body cleans it up!
AskDocs,"Depending on the location of the stroke yes, they can lose consciousness. More common with massive brain bleeds. The agonal breathing (that's the weird breathing you described) is typical for cardiac arrest. It could also have been a massive heart attack leading to cardiac arrest. 

I'm sorry for your loss, and please don't beat yourself up over not doing cpr. If you're sick enough to go into cardiac arrest, there are only a few treatable causes."
AskDocs,"Removed, misinformation"
AskDocs,Don't. Just upvote.
AskDocs,Stop doing this. Upvoting the thread will do it without littering the thread with a useless comment
AskDocs,"Removed, quackery"
AskDocs,"Can you post your actual lab results? Not everyone has the same definition of severe. 

And have you seen an internal medicine specialist? They deal with issues such as yours"
AskDocs,"Hi, please read our rule on claiming credentials"
AskDocs,Euthanasia and advanced care planning are popular topics
AskDocs,I would be very uncomfortable.
AskDocs,Please read our rule on claiming credentials
beyondthebump,"This is not a habit, you're not doing anything wrong! . This is unfortunately normal for a 6 week old because it sounds like purple crying (And has nothing to do with the color purple). It peaks at 6 weeks and is gone by week 12 usually. 

If you Google the term you'll find resources on how to handle it. In my experience it's just waiting until it passes..."
AskDocs,"No way for me to tell without a physical examination, sorry."
AmItheAsshole,"NTA, at all. You don't have to tell them about your sexual orientation at all. You can wait until you're an adult and no longer depend on your grandparents. Or never tell them, whatever works best."
AskDocs,"No, this is against our rules."
AskDocs,"Don't, it's bad advice"
AskDocs,Because it basically is an open wound in an area with lots of nerves. Lidocain oral gel helps
AskDocs,Please refrain from claiming credentials
AskDocs,"Removed, bad advice. External hemorrhoids truly are external."
AskDocs,Please read our rule on claiming credentials
AskDocs,Only if it's hormonally active/interfering with normal hormonal production
beyondthebump,"This too shall pass. And now you know what to expect, you can make a game plan to keep keep your sanity. Like a deal with your spouse on who gets to sleep when, some kind of reward for surviving a particularly shitty night (haircut? Expensive coffee? Takeout?), anything that gives you energy or at least less crappy. 

I console myself with the thought that I never have to do this again, as this baby is my last"
AskDocs,"Yes, but it can't have been present for long, otherwise cbc would change."
AskDoctorSmeeee,Yes this is positive. A line is a line!
AskDocs,"The baby is not at increased risk of covid. They lack the ace2 receptors that make adults and the obese so susceptible. But in general you obviously want to keep them away from pathogens. Whether you want no visitors or some is a personal choice. 

I currently have a newborn myself and don't have anyone over with symptoms (and I have family I can trust), and anyone within 6 feet of the baby wears a mask. And no kissing or hugging etc. It's also to protect myself because I don't want to have a cold with a fresh c section wound."
AskDocs,"Yes, it's important for the statistics and so you can warn whoever you've been in contact with in the days leading up to the positive test. You're contagious before you show symptoms"
AskDocs,"If they're not on a vent then yes they're conscious and yes they experience shortness of breath. Not to the extent of panic though, that's why they're being supported in the icu, for example with high flow oxygen."
AskDocs,That's enough off topic conversation
AmItheAsshole,NTA. You don't have to put up with rude and mean behavior just because you're related.
AskDocs,"Whoever can see you first: rheumatologist, general physician, ophthalmologist"
AskDocs,Not in a 17 year old!
AskDocs,"Removed, please don't play dr Google here. This diagnosis would have been found easily on the blood counts that OP had done."
beyondthebump,"Redirect redirect and repeat. At nearly two they know the rules, but don't have the impulse control to listen. My son would test every boundary. If I'm not allowed to touch the soil of this plant, I should try my other hand! Super annoying. Just know they don't do it to annoy you. My son gets time outs as long as his age after a two warnings (and the time out is explicitly mentioned in the final warning). I hardy ever have to execute it because now at 2,5 he knows I follow through. Here he gets strapped in his high chair and put in the hallway with the door to the living room shut. I don't punish tantrums though, that's not bad behavior, it's raw emotion. I tell him I see he's mad about not getting x, and then let him work through it. Offer a cuddle if he looks like he wants one. 

But I think I'm lucky with a calm boy, because here the tantrums last 2 minutes. My sisters toddler can go nuclear for 15 minutes 😅"
beyondthebump,"No of course that's not ok. It's a human, not a toy. Even at home nobody gets to pick up my kids without permission, especially when they're asleep, and even more with covid"
AskDocs,Yeah that's just marketing.
AskDocs,"The risk is that you don't take it long enough, not eliminating the bacteria and then making them resistant to the antibiotic. So no, not harmless."
AskDocs,"It can affect appetite in general, so I wouldn't be surprised if it also affects food preferences"
AskDocs,A one time accident won't harm your eye. You shouldn't use oxymethazoline longer than a week.
AskDocs,"It's not dangerous to eat a teaspoon of salt, but it can make you gag. Why not put your salt on an egg or something?"
AskDocs,Please refrain from claiming credentials
beyondthebump,"Wonder weeks are BS. There's no science backing it up with regards to the timing of the leaps. (The authors actually refused to do the science because they already make good money this way)

My son usually was super fussy and hungry for a day, then super sleepy for a day and then boom his clothes suddenly didn't fit and he had learned something new. But he never read the book so the timing was way different"
beyondthebump,"You're not terrible for letting him cry. If he's fed, clean and just tired a bit of crying will not harm. We have a 15 minute rule and we even use a timer for it. After 15 minutes of crying we go in and soothe, and then restart the clock. No nap is not an option. Kiddo knows you're not gone forever, they just have FOMO. 

Our toddler hardly every makes it the full 15 minutes by the way. He calms down long before that most of the time"
beyondthebump,I've never had smells escape our tommee tippee sangenic tec. The bags are kind of expensive but we always get them on sale. And the no smell thing was more important to me.
beyondthebump,"Yes, 1 sleep with one ear plug in to dampen the noise. My first sounded like a goat, I had to ban him to his own bedroom at four weeks because even with earplugs I couldn't sleep. My second is much quieter so far. But she's a preemie, so perhaps she'll get louder in the coming weeks. I hope not."
AskDocs,"You can, but you shouldn't. physiologically it makes no sense"
AskDocs,Please read our rule on claiming credentials
AskDoctorSmeeee,"This test is negative. When in doubt, take another one next week."
AmItheAsshole,YTA. Son and fiancee should pay for their own wedding. If fiancee doesn't want to postpone she can pay for the rest. I would be very very pissed if my dad used my college fund for something as unnecessary as a wedding.
AmItheAsshole,"NTA. Your mom's house, so her rules"
AskDocs,Once a week is fine!
AskDocs,You contact a doctor irl. We're volunteers doing this for free in our spare time
AskDocs,This is explicitly prohibited in our rules
AskDocs,"I personally think it is an unnecessary intervention. In my country only babies from certain religions get it done, otherwise only at later age for medical reasons."
AskDocs,"2-14 days, most get sick after 5 days"
AskDocs,Please read our rule on claiming credentials
AskDocs,"Removed, please stop advising everyone to have all these labs checked. 90% are not indicated"
AskDocs,"Removed, 3 out of 4 tests are not indicated here"
AskDocs,"No, you made a common error. Elevated tsh is a sign of hypothyroidism."
Groningen,Sawadee. Van 1 gerecht kan ik twee dagen heerlijk eten. Zo jammer dat ze niet buiten de stad bezorgen
AskDocs,This warrants a visit to the doctor.
AskDocs,No way for us to tell unfortunately
AskDocs,"Removed, we don't allow unfounded supplement advice"
AskDocs,Please read our rule on claiming credentials
AskDocs,OP was already tested for a UTI. Oh and UTIs aren't caused by being cold or having cold feet. That's an old wives tale
AskDocs,"If you want to use marihuana, do it in a way that does not involve smoking. No doctor will ever approve smoking"
AskDocs,"No, your diagnosis and treatment advice was bad. Seeing a doctor is always our advice."
AskDocs,"Removed, bad advice"
AskDocs,"Removed, fear mongering. This is not a lethal blood pressure"
AskDocs,"Removed, please don't post here if you have no medical knowledge. There is no such thing as a detox (unless you mean from drugs/alcohol)"
AskDocs,At least until the wound is fully closed and healed
AskDocs,Please read our rule on claiming credentials
AskDocs,"Ah but the meds for pots aren't addictive at all. You should go talk about your options, nobody can force you to take any meds, but it would be nice to have your life back right?"
AskDocs,"No, the physician told them to get tested for this condition, you told them to get treated blindly. That is a significant difference"
AskDocs,"I don't know how long you've been together, but you were likely already exposed to the virus."
AskDocs,"Which drugs are you referring to? I wouldn't try illicit drugs, but regular medicine guided by a doctor should be safe"
AskDocs,"Yes family history does add to the risk, especially if multiple family members are affected."
AskDocs,"A one a day vitamin d supplement is best yes. the rest is pointless unless you have issues like bowel disease, end stage renal disease or a very bad diet"
AskDocs,"We're taught a mnemonic in med school for gall bladder issue risk factors: female, fair (so caucasian), fat, forty (but 50 still counts). 

If you tick those boxes you're at an increased risk compared to others. Gall bladders in general just often mess up their one job"
AskDocs,"Early morning urine albumin/creatinine ratio is an excellent screening tool for protein loss. It does not miss heavy cases, so we prefer it over 24 hour urine as a screening tool. 

For all ages the ratio should be below 3/30, depending on whether your country uses SI or standard units. 
For urine  portions there is no normal value for creatinine and albumin, it is the ratio that matters."
AskDocs,"Because they can, because it sounds good, and because you just pee out the excess of water soluble vitamins. 

But you're absolutely right. We strive for 100% and for vitamin C that is super easy with regular food. Most people only need a bit of vitamin D."
AskDocs,"Removed, there is no such thing as thick blood. (well actually there is, but it comes with very different and severe symptoms)"
AskDocs,"Removed, bad advice"
AskDocs,"400-800 IU a day is enough. I usually give my deficient patients a 6 week course of 25.000 IU once a week, followed by the first dose, or once a week 5600 IU."
AskDocs,How is your elbow? Can you still bend and extend it without pain or trouble? You caused bruising and irritation of your ulnar nerve. Nerve function will come back when the swelling goes down.
AskDocs,"Core body temperature is regulated in the brain. It has one set point for the whole body. Areas closer to the surface will be colder due to heat loss. This is why rectal temperature is considered the gold standard, and why oral and axillary temp is unreliable. Inflamed areas will feel warmer, but never warmer than the set core temperature."
AskDocs,"Two pages is too much. A short list with your symptoms + date of onset per symptom is way better. Don't list more than 5-ish symptoms, and you can end the note with the questions you might have for your doctor. Stick to the stuff that bothers you most."
AskDocs,"Removed, unfounded advice. The link you provided in your other post does not say fasting is a treatment for skin conditions."
AskDocs,Please refrain from claiming credentials
AskDocs,"Depends on how abnormal it is. A ratio of 50 is very suspicious. A ratio of 2,8 not so much. 

The latter depends on your country and how busy the practice is. I'm in Europe so I can't be more specific"
AskDocs,"A cyst is a tumor. Any growth is called tumor. I assume you mean the difference between benign cyst and cancer? Because a cyst feels squishy. However in some organs cysts can be cancerous, so your question depends on the location. If you need personal advice, please start a thread"
AskDocs,"This is a notorious troll/ban evader people, do not engage"
AskDocs,You need proof to back up your autism diagnosis if you want benefits. If you're an adult you can call local hospitals and psychiatry clinics to see if they have a file on you and request a copy. They're required to keep your files for years.
AskDocs,"No, the antihistamine is different and thus 25 mg of one is not the same as 25 mg of the other. You should follow the dosing guideline on the hydroxyzine. You can still combine it work acetaminophen by the way"
AskDocs,Please read our rule on claiming credentials
AskDocs,"Actually height of fever says nothing about disease severity and isn't dangerous. Most recent scientific insights on fever in general is to let it run its course because it has a function for our immune system, even if it reaches 40 degrees."
AskDocs,Removed due to the unfounded medication advice
AskDocs,"Removed, we don't accept this type of unscientific advice"
AskDocs,Please read our rule on claiming credentials
AskDocs,Where I live we call them direct and indirect contact
AskDocs,Why not just take the pill with breakfast? Pills can dissolve in moisture yes
AskDocs,Chance is very slim but never zero
AskDocs,"Nah, CK has to be very high to cause kidney damage. And egfr is not reliable in those with lots of muscle mass. It is calculated using creatinine levels, and if you are muscular you will always have higher creatinine levels. So if there was never any change in your creatinine levels when you have myoglobinuria, you did not suffer any kidney damage"
AskDocs,"I don't think you have a tumor at all. The symptoms you describe come from stuff that is handled by parts of the brain that are anatomically so far apart that they can't physically be caused by a single tumor. You'd be dead if that were the case. Your symptoms also wouldn't come and go as you describe. Same goes for multiple smaller tumors: you'd be way sicker, and it wouldn't come and go. If you were in my country, you wouldn't even be able to get the mri unless you went to a private scanning facility abroad. Regular doctors would refuse."
AskDocs,"Incubation is 2-12 days for a primary infection, which would not present like this. It takes 2-4 weeks to go away"
AskDocs,"Alright, but make a very clear deal with your mum that it ends with the mri. Health anxiety makes you doubt everything, even when every test in the world is normal. So if the MRI is normal, do not pursue further or repeat testing. There will always be a voice in the back of your head that makes you doubt the normal results. You need therapy to learn that that voice is not telling you the truth and should be ignored."
AskDocs,"Well if all your tests were normal, it can very well all be the physical symptoms of anxiety. Anxiety can mimic many diseases. You need to find a therapist to improve your symptoms. You're not abnormal or crazy by the way, anxiety is pretty common and it just sucks."
AskDocs,No with normal tsh and t4 there is no thyroid issue. They shouldn't have drawn Tg antibodies.
AskDocs,"I don't see any blisters, so hsv is unlikely. Plus it wouldn't fit a primary infection."
AskDocs,"Yes, tell your doctor and anesthesia team you're scared! They can talk you through the procedure, give you anti anxiety meds and make it a better experience for you. And don't forget that the mortality rate in humans is much much lower for surgeries."
AskDocs,"It can take weeks to months to test negative, even though you stop being contagious long before that."
AskDocs,You don't inflame your brain by studying. How long you can do it without causing harm is highly individual. And by harm I mostly mean symptoms of strain such as fatigue and headache. And if the perceived work load is to high it will also cause psychological issues
AskDocs,Seek medical care if you start vomiting or if you become disoriented (the latter would be noticed by someone else). Since you didn't lose consciousness you're likely fine.
AskDocs,"If your overall diet is not calorie deficient and you're getting all your nutrients, there is nothing wrong with fasting between meals."
AskDocs,"No, if the tube has been open for a year it is expired regardless of what the date on the tube says"
AskDocs,"I only see one post 80 days ago from this account, and a reply of yours to a thread you apparently removed yourself. Not all threads get answers, the sub is big and the doctors are volunteers"
AmItheAsshole,NTA and red flags all over. Does he show more of this behaviour?
AskDocs,"I see a regular sinus rhythm with two suptraventricular extra beats. With just an apple watch lead that's all I can say about it. You probably feel the beat after the compensatory pause after the extra beat. Annoying, but not an emergency. If your cardiologist has trouble catching your problem you should get a holter monitor, or if it doesn't happen every day a loop recorder."
AskDocs,"No, daily painkillers actually cause headaches."
AskDoctorSmeeee,"Thrush can be scraped off, makes everything taste foul and hurts when you eat. It also usually isn't just on the tongue but spreads to your cheeks and palate"
AskDocs,"Safe with regards to not getting stuck inside like solid items could. Not safe regarding the chance of infections, depending on how clean the cook is"
AskDocs,"Yes, though it is rare and would not last long"
