subreddit,title
CHART_BOT,chart me!
pics,Millenium Bridge
space,"One of the best ""space scenes"" in any movie ever"
movies,This has to be one of my favorite scenes in recent times . . .
pics,"These are not photographs, they are paintings . . ."
circlejerk,The whole jury system is broken.  DAE think only redditors should be able to server on juries? 
circlejerk,"Is everyone else sick of how obsessed everyone is with Apple? I just spent 7 hours reading articles and comments about Apple, and I can't believe how much people care about this company."
AskReddit,"Redditors 18 and under, do you feel you have a firm grasp of what it felt like when we were attacked on 9/11?  When I was 6, I remember seeing a tank on tv, and that was the extent of my knowledge of the gulf war.  How much do you remember of your day when we were attacked? And how did you feel?"
learnpython,WebBot routinely gets logged out. Could use some assistance with regards to cookies and mechanize.  
funny,r/politics.
mildlyinteresting,Well Played Google . . . Well Played
funny,Well Played Google . . . Well Played
BoardwalkEmpire,On the Set of Boardwalk Empire with Terence Winter [Vice]
tablets,What do you use your tablet for that you find superior over using your laptop or phone?
casualiama,I'm currently killing time in an airport. AMA
videos,Some scumbags buried a cat alive in concrete up to its neck.  Video is rescue effort [x-post r/morbidreality]
EngineeringPorn,"Working Model Steam Engine made entirely out of glass [x-post from r/geek]
"
mildlyinteresting,"I got to 60% full with one ball in reddit's ""fill up"" game."
funny,Fox News
geek,Working Model Steam Engine made entirely out of glass
RoomPorn,Simple Dining Room with a View [804 x 1024]
humor,"Well, this is awkward . . ."
trees,Still among my favorite scenes from the Simpsons '◡'
gaming,Born into Servitude :(
explainlikeimfive,"What exactly is ""half-life, what does it imply, etc . ."
bestof,mb38 explains the tech behind a steadicam shot
videos,"This bizarre, lawless land in the California desert is inhabited by drug addicts, eccentrics, army vets, hippies and just plain old weirdos. Slab City is referred to by its residents as ""the last free place in America."
mildlyinteresting,This is the 100% natural (no manipulation) email count in my inbox
pics,My perception of politics on reddit
technology,FBI Fears Bitcoin’s Popularity with Criminals
space,The size of the universe [infographic]
pics,Top Ten Stunning Infrared Space Pictures
videos,The best Japanese acoustic trio playing super mario brothers I've ever seen
offbeat,Domino’s testing out pizza ordering through Facebook O_O
technology,Password Protection Act: Ban bosses asking for Facebook passwords
offbeat,TSA breaks teen diabetics insulin pump
pics,Seaside Amusement
pics,"Majora's Mask, anyone?"
aww,The Schnauzer Smirk
technology,DOJ: Requiring warrant for cell phone tracking would 'cripple' law enforcement
Android,Android Developers Can't Get Paid And It's Killing The Platform - Here's Why
technology,Google+ comments to appear in Gmail (am I the only one annoyed by this?)
offbeat,The most alien-looking caterpillar you'll ever see
technology,10 Tech Rumors That Proved Wrong
videos,MIT Student Builds Awesome Working Mario Kart
offbeat,Arthur C. Clarke predicting the internet and modern computing almost perfectly - in 1974
geek,Princess Leia hoodie...
funny,Jon Stewart Has Some Questions for France
videos,Iraq Lobster
TrueReddit,Psychology Of Fraud: Why Good People Do Bad Things
geek,"Soo, I kinda want to buy this art piece . . ."
offbeat,The new invention that makes wheelchairs obsolete
pics,This is not a photograph. It's a painting.
atheism,Another facebook post on jesus
funny,The number one rule of parenting . . .
atheism,"Be Responsible, Jesus"
AskReddit,"What happens if you donate your hair to charity, but the person that receives it commits a crime and leaves your dna at the scene?"
enthouse,Court of Exo is now in session
enthouse,Exoendo in Space!
space,Edges of Mercury's Poles May Harbor Water Ice
videos,Jon Stewart Slams Florida’s Stand Your Ground Law [~1:00]
WTF,This guy REALLY hates his job . . .
offbeat,8-year-old boy uses tracking app to catch the person that robbed his family 
funny,Diagnosis
funny,Surprise Party
WTF,Man charged with jury tampering for advocating Jury Nullification
bestof,Every Popular Science Article Ever
pics,Fireball
offbeat,How to create an ant spiral of death
Music,Judge Rules Pi-Based Music Is Non-Copyrightable
offbeat,"The NSA is building a new Facility. Its purpose: to intercept, decipher, analyze, and store vast swaths of the world’s communication"
technology,Judge Rules Pi-Based Music Is Non-Copyrightable
pics,*Gasp*
offbeat,How to Piss off a Frog
technology,How MIT's Laser Camera Can See Around Corners
madmen,"Mad Men Recap: Before Season 5, Let's Remember Season 4"
videos,"Choose your own adventure in ""Mad Men: The Game"""
aww,Tra la la I'm a Gecko
offbeat,"""I'm proud of you,"" deaf man signs to Obama in ASL. ""Thank you,"" president signs back."
offbeat,Reddit's Guide to Controversial Judicial Rulings
funny,Misogynistic TV Guide Writer
offbeat,Possible Supernova in Nearby Galaxy
videos,Mister Rogers Acceptance Speech for his Lifetime Achievement Award
atheism,Faith healing event ends in one death and 16 injuries.
funny,If Airplane Safety Instructions Were Honest
offbeat,Man Successfully Flies With Custom-Built Bird Wings
WTF,"NYPD and Bloomberg vs. Occupy Wall Street: ""Just hit them"" [xpost]"
aww,Plushy Primate
pics,Miniature London
offbeat,How One Response to a Reddit Query Became a Big Budget Movie
pics,The Big Picture - Afghanistan 2012
space,Aurora
pics,Fishing at Dawn
technology,Guy makes his own augmented reality heads-up display
WTF,I am Skeleton Jelly
offbeat,"""What the Space Shuttle booster Saw"" - Some of the most amazing launch footage you'll ever see"
trees,Illegal.
WTF,Officer Accused Of Using Taser On 9-Year-Old Boy
videos,"Lawrence Krauss: ""A Universe From Nothing"""
TrueReddit,The Dark Side of Money in American Politics
pics,National Geographic's Top Pictures of 2011
WTF,Redheads apparently feel pain differently than the rest of the human population
atheism,TRUTH.
funny,There once was an old lady . . .
TheoryOfReddit,What if comment Upvote/Downvotes were capped?
enthouse,Enthouse Burning Man Meetup
funny,Redditors Guide to Judicial Rulings
enthouse,Would it be worth making a PvP arena?
enthouse,Meow is a BAMF
enthouse,Few quick screens of creative + water shader mod
videos,Thomas Jefferson - Time Traveler
BoardwalkEmpire,Inside the Episode: To The Lost
enthouse,Some random pictures from the last month or so
enthouse,"Well guys, entcrater didn't last very long . . ."
videos,Julia Stiles is a Leet Hacker
trees,I never get tired of this comic
Music,Animal Collective - Grass
videos,Who else had one of these?
poker,FTP Finally sold? *Fingers Crossed*
pics,Zombie Apocalypse Good Guy Greg
trees,I have ALSO discovered a secret message in The Last Supper . . 
poker,Pocket Fives is reporting there is an investor committed to purchasing FTP - but a revoking of the license by the AGCC could hamper the deal. I need you guys to sign a petition and get informed. . .
TrueReddit,NYT: The Cyborg in Us All
pics,"A classic ""whodunit"""
WTF,Police in shock as 66 children found crammed into an eight-seater van in China
videos,Coolest Water Fountain Ever
reddit.com,Top 10 Ways to Turn Your Retired Gadgetry into the Technology of the Future
offbeat,This has Reddits name all over it: How to make Bacon Infused Vodka
funny,The good ol' days . . .
reddit.com,"Judge worries recording police will lead to excessive ""snooping around"" (If only our government could see the irony in this . .)"
space,"The Southern Lights, as Seen From the International Space Station"
fffffffuuuuuuuuuuuu,Common Redditor Reactions to TSA Taking their Razorblades
TrueReddit,"Why do teenagers act the way they do? Viewed through the eyes of evolution, their most exasperating traits may be the key to success as adults."
atheism,This is child abuse
pics,I guess I'm going to hell for laughing at this . . .
pics,Whoa.
politics,Pennsylvania Electoral College Plan Could Backfire on G.O.P.
pics,Awkward Gift
pics,Poor Snowman :(
pics,This would explain a lot . . .
pics,Scumbag Iama Creator
pics,So watcha thinking about? 
pics,I would definitely watch this movie . . .
pics,How I feel when reddit doesn't have new content on the weekends
TrueReddit,Stealing Mona Lisa
TrueReddit,The Debt Crisis at American Colleges
reddit.com,Can the Middle Class Be saved?
funny,Shark Rider [Comic]
AskReddit,Are there any redditors that have fired guns and felt more competent at it due to playing first person shooters?
bestof,wavefunction84 comments on Korean culture
funny,Bert has made a huge mistake . . .
funny,This might hit a little close to home for some of us O_O
pics,This is just sad [PIC]
Music,MTV decides to have a show about music - Brings back 120 minutes
