subreddit,title
mediagallerytest,"Hi, cats and chats"
SeattleSecrets,[Question] Any secret places to hang out or things to do when it starts to get a bit… gloomy out?
SeattleSecrets,El Taco Loco inside Ballard Liquor Store
JARTEM,No messages
JARTEM,This is a text post with a lot of body text
pan_media,CHOOSE WHICH DIRECTION I TURN AT INTERSECTIONS
pan_media,CAT
modnews,Chat Mod Tools: Account Age Verification & New Member Muting
modnews,More Chat Mod Tools: Regex Filters and Links
blog,"What I learned from chatting with 7,000 strangers on the internet"
kd_chat_test_2,First
FortNiteLFG,New Reddit Chat LFG Rooms!
slaythespire,Slay the Spire has chat rooms
community_chat,Subreddit chat rooms are coming to beta Wednesday 4/25
community_chat,Known bugs. Found a bug? Check here first before you post :)
community_chat,Know someone who wants to join the private beta? Add them to this list!
community_chat,Welcome to r/community_chat!
teefies,Mondaaaaay
