subreddit,title
AdviceAnimals,Gave the recently fed baby to my dad who proceeded to hold the baby above his head and make faces at her while she burped at him
TalesFromRetail,"Uhhh, did you sell a bench?"
nosleep,Unlocked
TalesFromRetail,"""Ya'll sell dope here?"""
nosleep,I wanted to buy a used bike from Craigslist...got more than I bargained for
funny,Easiest April Fools' trick I know. Still works every time.
AdviceAnimals,To all those planning some terribly elaborate cruel prank on their SO today
AdviceAnimals,To the guy who nearly killed me this morning
cycling,Knee pain question & my first century!
AdviceAnimals,If you're browsing Reddit and haven't seen the last episode of How I Met Your Mother yet...
nosleep,War is hell
nosleep,Thank you for reading
nosleep,Never go near the tree
nosleep,I found a tape on my property. Now something else lives here too.
AdviceAnimals,Whenever I open a new bag of chips I have zero self control...
AdviceAnimals,"Reddit and pets, today? Fish."
AdviceAnimals,Goldfish PSA
nosleep,Please Stop
nosleep,We were just looking for an extinct species of reptile possibly still living in the Amazon
cycling,Buying a used road bike; looking for tips
nosleep,"Warnings are there for a reason, Jay - 2014"
AdviceAnimals,Think of this the next time someone cuts you off and you decide to get out of your car and yell at them in the middle of traffic
AdviceAnimals,"It's spring break in my area, and my commute has been so much more enjoyable this past week"
nosleep,Beneath the ice
AskReddit,"Reddit, if you were an eccentric billionaire, what would be your eccentricity?"
AdviceAnimals,I think this every damn time I sweep the back porch off
funny,"I play Jenga every morning in the shower (yes, only one of those is mine)"
nosleep,The Loch
nosleep,Cottage in the woods (Part 4)
nosleep,Cottage in the woods (Part 3)
running,Day 1 IT rolling
nosleep,He was waiting for her
AskReddit,"Redditors who are or have been in a cult, what was your experience? [Serious]"
nosleep,Along the dirt road
nosleep,Medical testing on animals
cycling,Buying a new bike
nosleep,Cottage in the woods (Part 2)
running,IT band advice
nosleep,Cottage in the woods (Part 1)
nfl,"Brett Farve tells USA Today that Johnny Manziel reminds him of a ""young Brett Farve"""
nosleep,Unknown Cargo
pics,Max Scherzer of the Detroit Tigers has very pronounced Heterochromia
nosleep,I was going to a party...and well...hindsight is always 20/20
nosleep,I don't go upstairs anymore
nfl,What's happening?
nosleep,The fires beneath Centralia Pennsylvania
nfl,Roger Goodell admits NFL made a mistake with how it handled playoff ticket sales
nfl,NFL says concussions decreased 13% from 2012 to 2013
nfl,Pete Carroll voted coach most would like to play for by 320 NFL players
nfl,Anonymous survey of 320 NFL players shows that 85% would play in the Super Bowl with a concussion
nosleep,My great grandfather's friend
nfl,"Percy Harvin says he's ""ready to go,"" and will play in the Superbowl"
nfl,Adrian Peterson has groin surgery; full recovery expected in six weeks
nfl,Vince Young files for Chapter 11 bankruptcy
nfl,Adrian Peterson voted by players as the player they'd most like to see in the Superbowl that hasn't been there yet
nosleep,Uncharted Cave Dive (Part 2)
nfl,Saints will use franchise tag on Jimmy Graham if needed
nosleep,Uncharted Cave Dive (Part 1)
nfl,"X-ray's negative for Knowshon Moreno's ribs. John fox says ""he's day to day"""
funny,"I had both kids at home by myself this past weekend, my wife asked me how I was doing. I sent her this as a reply"
nfl,"Pete Carroll on 710 am speaking about Richard Sherman ""We aren't perfect and we all make mistakes,"""
AskReddit,"Reddit, what's the highest (altitude) you've ever been?"
nfl,Onside kick question
nfl,Superbowl XLVIII will be the first since Superbowl XLIV to feature two #1 seeds. Peyton Manning will have been in both.
pics,Cross section of an ice core from Greenland
funny,This would be a really crappy prank to play on someone
nfl,Peyton Manning voted most respected NFL player
nosleep,"It said ""hello"" (final)"
AdviceAnimals,Every time the power goes out I become a goldfish
running,"Everything hurts...but,"
nosleep,"It said ""hello"" (Part 2)"
nfl,"Tom Brady says a victory over the Broncos in the AFC championship game would be ""as satisfying a victory as we've ever had"""
AdviceAnimals,Surge protector blew at the end of the street and our house grew very dark
nfl,"Packers T David Bakhtiari, and Saints CB Keenan Lewis violated NFL concussion protocol in wild-card games"
nfl,Lions DT Ndamukong Suh voted most feared player in the NFL
steelers,"Art Rooney wants Roethlisberger to remain a Steeler, indicating a contract extension this offseason"
nosleep,"It said ""hello"""
funny,And so the exodus begins
AdviceAnimals,First World Florida Problems
nosleep,Driving to sleep
todayilearned,"TIL of the Ourang Medan a ghost ship that sent out two transmissions “All officers including captain are dead lying in chartroom and bridge. Possibly whole crew dead,"" and ""I die,"" before being discovered. The entire crew was dead and before the ship could be towed to shore it exploded and sank."
nfl,Steelers fire Offensive line coach after one season [X-post from Steelers]
nfl,Jerry Jones in favor of expanding NFL playoffs
nfl,"TIL in the original ""Ice Bowl"" the metal whistles froze to referees lips, the marching band couldn't play because the woodwind instruments literally froze, and one elderly fan died of exposure"
AskReddit,"Reddit, what band has gone downhill the most, but is still together releasing music?"
nosleep,The Gold Club
steelers,Do we really want a picture of Ryan Succop as the top post of all time here?
AdviceAnimals,"I'm 26, and this is why I'm among the top 5 of most awkward people ever inside the liquor store"
AdviceAnimals,Around the holiday season I always think of this when I hear a certain Christmas song
funny,Around the holiday season I always think of this when I hear a certain Christmas song
nfl,Mike Tomlin: NFL must asses refs
nfl,NFL admits missed illegal formation on Chiefs FG attempt
nfl,NFL admits Chargers should have been penalized on FG attempt by Chiefs.
DenverBroncos,Steelers fan chiming in
steelers,Ryan Succop everyone
steelers,"Well, it's over. That sucks...but there is some good to come from this"
steelers,Desperate times.
AdviceAnimals,Never trust a toddler. Even if it is lunch time...
nfl,Polamalu wants to honor his contract with Pittsburgh.
nfl,Steve Smith out vs. Falcons
nfl,Clay Matthews undergoes second thumb surgery
nfl,Adrian Peterson doubtful for Sunday with groin injury
AdviceAnimals,Had to explain this one to my wife this morning after we got signed up for a $100 monthly trial
funny,"Running my first marathon in January, got this shirt for Christmas"
pics,"Running my first marathon in January, got this shirt for Christmas"
AdviceAnimals,Cleaned out my wife's shower drain this morning...had a sad thought
nfl,Jerry Jones refuses to rule Tony Romo out despite having a herniated disk in the lumbar region.
nfl,Peyton Manning Ties Tom Brady's 2007 touchdown record
steelers,How I feel going into today's games
videos,Water balloon filled with mercury
nfl,Just wanted to note how far the Chiefs have come; from last in the league in scoring differential (-13.4 points/game in 2012) to a 11-3 record in 2013 and 1 game out of #1 seed in the AFC.
AskReddit,"Doctors and nurses of Reddit, do doctors and nurses generally make the worst patients? What is the worst kind of patient?"
nfl,Stabbings at Denver sparked by near fender-bender
steelers,After finding out that the last lateral by Ben to Brown was legal the pain came right back...
running,Disney Marathon Training
nfl,Redskins owner Daniel Snyder won't intervene if Mike Shanahan decides to sit RGIII
nosleep,Why I don't like mirrors
nfl,Ben Roethlisberger has no issue with Todd Haley's play calls
AdviceAnimals,The guy just stared me down like it was my fault
nfl,Adrian Peterson MRI reveals no ligament tears or Lisfranc injury
funny,PSA: This needs to stop.
steelers,My sentiments on the up and down season
AdviceAnimals,The snowball effect of commuting
nfl,Has a team ever lost draft picks before? Or had a draft modification the way the Steelers may face due to Tomlin's actions last week?
nfl,"William Gay fined $15,750 for hit on Jason Campbell"
nfl,NFL will review Mike Tomlin stepping on the field
AskReddit,"Reddit, what's your favorite line/passage from a book?"
nosleep,The woods of Pennsylvania
todayilearned,TIL of goats that will scale a near vertical dam wall
todayilearned,TIL of the goats that will climb a nearly vertical dam wall simply for a salt lick
running,"Knee pain (hard to describe, both sides and middle of knee)"
nfl,Steelers NT Steve McLendon out for Thursday's game against Baltimore
AdviceAnimals,"If you wear glasses, then this has probably happened to you"
AdviceAnimals,This meme as of late
AdviceAnimals,And then I still need to get back into that lane one way or the other
AdviceAnimals,And they probably get gold for theirs too.
AdviceAnimals,Learned a good lesson taking notes today
running,Marathon Training
running,Breakfast ideas before a long run
AdviceAnimals,I always have to Google it first to see how it's supposed to work...even then I'm wrong
AskReddit,"Reddit, what's the most interesting thing you have someone tagged as?"
TalesFromRetail,What is he looking for again?
