subreddit,title
reddit.com,Lawsuit questioning Taco Bell's beef is dropped
politics,House passes Rep. Paul Ryan's budget plan
nyc,"9/11 Trial at Gitmo, Not NYC"
bestof,The physics of semen [NSFW?]
reddit.com,Track US flights on a map in real time
listentothis,Thought Industry - The Waitress In The Bar Orbiting Io [Alt. Rock]
politics,Protest Begin To Form Outside Wisconsin State Capitol [Video]
worldnews,"US, allies edge toward military options for Libya"
worldnews,Fresh Anti-Government Protests in Yemen
reddit.com,Supreme Court sides with Westboro Baptist Church
listentothis,Thought Industry - Lovers in Flames [Alt. Rock]
reddit.com,Last living U.S. World War I veteran dies
dwarffortress,Dwarf Fortress 0.31.19 Released!
humor,I got oral on Valentine's day.
worldnews,Feb. 4 declared the 'Friday of departure' in Egypt.
worldnews,Egypt shuts down Internet ahead of protests
nyc,Next MTA Fare Hike Could Dwarf Last Fare Hike
reddit.com,Arkansas officials stumped as thousands of birds fall from sky
fffffffuuuuuuuuuuuu,A Friendly Reminder
todayilearned,"TIL that the United States' inflation rate was, on average, negative in 2009. The first time in 54 years."
politics,"'Don't Ask, Don't Tell' Repeal Clears Vital Hurdle"
listentothis,Sevendust - Praise [Alt. Metal]
reddit.com,Former WikiLeaks worker: Rival site under way
dwarffortress,DAE think dwarfs need to eat more?
reddit.com,PayPal says it blocked WikiLeaks after U.S. government request. Go figure.
fffffffuuuuuuuuuuuu,I opened the lid and...
gaming,Portal 2 Delayed To April
fffffffuuuuuuuuuuuu,Until death...
gaming,"Codemasters: ""...sell half a game in shops and the other half as downloadable content."""
humor,What a delicious road!
politics,WNBC: Republicans projected to control House
fffffffuuuuuuuuuuuu,Period week... EWBTE!
listentothis,Blinker the Star - The Star Behind The Star [Alt. Rock]
dwarffortress,This should be FUN.
todayilearned,TIL there are about 2.5 billion text messages sent per day in the US. That's near 29000 per second!
nyc,NWS: 2 Tornadoes and a Macroburst!
nyc,September 16th Storm: Everyone okay?
starcraft,Blizzard Prepares To Ban StarCraft II Cheaters
gaming,All 50 Playboy Centerfolds Of Mafia II
nyc,"Seeing as 9/11 is approaching yet again, here's an archive of all the news broadcasts that day."
starcraft,"Blizzard Details Upcoming StarCraft 2 Balance Changes: Nerfs, nerfs, and more nerfs!"
gaming,Enjoy Agricola? Play it online here!
gaming,Space Empires + EVE + Sim City + Spore = Shores of Hazeron
reddit.com,AFP: WHO chief says swine flu pandemic is over
offbeat,Mexican Drug Cartel Allegedly Puts a Price on Arizona Sheriff's Head
dwarffortress,Soldier (Cannot Follow Order)
funny,Youtube Poop: Hank Hill Is A Dick
reddit.com,AP takes over Helen Thomas' White House briefing room seat
dwarffortress,"So, no migrants for almost 1 and a half years now...."
fffffffuuuuuuuuuuuu,Knees
fffffffuuuuuuuuuuuu,Special
science,Giant whale-eating whale discovered!
pics,"""They [have] adapted their feeding pattern to the hazard the prey might pose to them. For wasps, they retreat after applying the venom to give it time to take effect."""
nyc,WWII nurse in iconic Times Square kissing photo dies
politics,"General McCrystal, US Commander for Afghanistan, has resigned."
tf2,Chat text no longer auto-scrolls
science,Impact simulator: What would happen if an object collides with earth?
reddit.com,"Gary Coleman, 'Diff'rent Strokes' Star, 'Unconscious, on Life Support'"
worldnews,North Korea Ends Non-Aggression Pact with South Korea
reddit.com,"A Guide to Facebook's New, Simpler Privacy Controls"
offbeat,Taco Bell to debut $2 combo meal
technology,Internet approaches addressing limit (IPv4 almost dead)
pics,How does that work again?
gaming,Bungie Partners With Activision
Pets,Tenant's poodle doesn't like me?
fffffffuuuuuuuuuuuu,Silk... silk... silk...
dwarffortress,Dwarf Fortress 2010: April 2nd?
dwarffortress,Looks like DF2010 is about to drop!
gaming,"EA follows Ubisoft, will sell titles with 'always on' DRM"
worldnews,Powerful 7.0-magnitude earthquake strikes Indonesia
funny,"Nice try, ThinkGeek."
fffffffuuuuuuuuuuuu,Nickname FUUUU-?
gaming,You want Draconian DRM? Here's your Draconian DRM. 
reddit.com,Toy Story 3 - Trailer #2
reddit.com,How does your reaction time stack up against others?
science,NASA - Hubble Sees Suspected Asteroid Collision
science,"""When the Moon emerged from behind a passing cloud, the land was transformed into an intense white spectacle..."""
tf2,Kiss me... (part 3)
relationship_advice,"From dating to friendship, now a conflict of interests on both sides"
gaming,Are there ANY commendable sports games for PC?
happy,Puppy Hates Winter Weather
WTF,Brainless Baby Is Now One Year Old
science,Higgs Strikes Again! LHC Knocked Out By FutureBird-Caused Power Failure 
fffffffuuuuuuuuuuuu,Happy Thanks-for-nothing!
fffffffuuuuuuuuuuuu,Kristen Stewart FFFFFFFUUUUUUUUUUUU
fffffffuuuuuuuuuuuu,Stomach flu...
gaming,Dr. Sniper
WTF,Afghan girl killed in leaflet drop
todayilearned,TIL there's a specific position in American Football made to tackle the kick/punt returner
reddit.com,Arrr! There be quite a lack of a pirate Reddit alien today...
gaming,Tropico 3 PC Demo released!
gaming,Tropico 3 Demo Releases Tomorrow
gaming,Reminder: Tropico 3 demo is out tomorrow!
gaming,"Bethesda Have ""No Plans"" For More Elder Scrolls"
WTF,"""Hi, Spongebob."" [PIC]"
gaming,Arma 2 Demo Released
happy,Puppy survives being flushed down a toilet
WTF,This is the one thing we had... AND THEY HAD TO TAKE IT AWAY...
reddit.com,"NYC Heath Department: 75 kids sickened at 1 school, being tested for Swine Flu"
reddit.com,H1N1 Swine Flu Map
reddit.com,CDC says too late to contain U.S. flu outbreak
technology,Time Warner Cancels Bandwidth Cap Tests
reddit.com,"Google Redesigns YouTube, Copies Hulu"
happy,YouTube - Peeper the Talking Parakeet
gaming,"Reddit Makes It on Kotaku With ""Mario Explains It"""
happy,YouTube - Matis the Lynx Cub
technology,Senate passes bill to delay digital TV switch
politics,AP: Obama to order Gitmo prison closed within a year
politics,Is Bush Out Of Office Yet?
gaming,"First Spore Expansion, ""Galactic Adventures"" Due In Spring"
science,"Chocolate, Wine And Tea Improve Brain Performance"
politics,"Nixon source, Mark 'Deep throat' Felt, dies aged 95"
politics,Auto Industry Bailout Dies in US Senate
happy,Cute kitten passes out
gaming,EA to Defile Dungeon Keeper Series
science,Vast frozen water reserves on Mars
politics,Fear Tactics: McCain warns against Democratic takeover
politics,San Francisco weighs decriminalizing prostitution
worldnews,Here We Go Again: Israel stocks plummet 7.68% after delayed opening
gaming,Nostalgia Blast: Uniracers
politics,Legislative panel: Palin abused authority
politics,White House dismisses idea of market suspension
politics,Senate to vote on Bailout Bill tomorrow
