subreddit,body
suggestmeabook,Very under rated movie. The end shook me.
Games,Skyrim: spreadsheet edition
Games,"But in a round about way, there was an EA partnership formed.... EA's subscription/library is available with Game Pass Ultimate at no additional cost."
Games,Xbox confirmed and announced the price of the Series S at 330 am eastern time.
Games,He tweeted WB games was going to be apart of the event
Games,The awards they are giving out are the Gamescom awards that are awarded during the convention.kinda like the e3 awards.
NoMansSkyXbox,Does travel to the center warp ya to the next galaxy?
NoMansSkyTheGame,!5flair
NoMansSkyTheGame,"So what does it mean by going to the galaxy center, does that warp me to the next galaxy?"
Games,"Please review the rules. Low effort comments are not permitted.

https://www.reddit.com/r/Games/wiki/rules"
interestingasfuck,Also known as a lowhead dam
news,Greencastle indiana terre haute indiana
Minneapolis,Just wanted to add on there's also the possibility of the pilot using NVGS which lasers will literally white wash the eyes.
shittyfoodporn,The taste was subpar. The pancakes in eventful. Eggs over cooked. Susage Cold. The sugar free syrup added a unique dynamic
nostalgia,"One of my co-workers was on the show. The stories he told about the production are incredible. Basically they hire people to portray the victims. Rent houses. Do establishing shots with the police fire ems and dispatch centers, and of course, ham the story up."
fo76,"What was some lore/places/activities did you want to add in game, but just couldn't make it fit or work?"
fo76,"Also want to point out she has a very scripted line of ""the last thing he said was to get the paperwork for the cars ready, because he has to leave early early early."" Leading up to the disappearance he filed a restraining order against her for death threats, it was deemed by the judge to be un-creditable and denied the request 

There is also the fact her brother was a sheriff's deputy on the agency that was investigating the disappearance. There is also a weird situation where the police okayed the van to be removed from it was found, BEFORE, it was processed. 

After they processed it, they litterally only found one pair of prints belonging to the mechanic who recently did work."
FoodPorn,Bk
HumansBeingBros,Checking in!
metaldetecting,"Ugh. I'm so envious. This is a hobby I've always have wanted to try, but, atlas, no cool places near me."
mildlyinteresting,/u/trippy88 I work for a PART 1 affiliate of metro. Feel free to DM me. Would love to learn more about what y'all do. We hear about you all the time. In fact I think you have one of my birds rn
mildlyinteresting,I work for a PART 1 affiliate of metro. Feel free to DM me. Would love to learn more about what y'all do. We hear about you all the time. In fact I think you have one of my birds rn
mildlyinteresting,Metro avaition?
oddlysatisfying,Nice
gaming,"The insult not from Fallout 76: "" wanna hear a joke? Dead vault dwellers"""
suggestmeabook,Don't stop the carnival
interestingasfuck,Sugar factory
AbandonedPorn,Care to message me with the approximate location? I do a lot of shooting in the area
interestingasfuck,"Quick, Turkmenistan needs more White Marble"
interestingasfuck,/r/quityourbullshit
suggestmeabook,Hitchhickers Guide to the Galaxy
worldnews,One thing you might incorporate is the crash scene is a consistent with a near vertical impact.
xbox,I'd keep it. You never know when you will go on a nostalgia trip.
suggestmeabook,Second the Longmire Series. Absolutely amazing series.
gaming,At least this golden shower won't burn the eyes.
gaming,I can't see gold but I can smell it
RedDeadOnline,Is anyone else having issues with changing their appearance? I've tried to do it several times I've the last 24 hours and I seem to get stuck in the black and white photo loading screen. Any workarounds?
millionairemakers,May the odds forever be in your favor.
Games,"If you have Amazon prime, sign up for twitch prime. You can get free stuff for rdo through it. Right now you can start the collector trade for free and I believe you get free stuff for moonshiners."
xboxone,Show me de way
AbandonedPorn,No problem man. Most Rick houses are much longer and wider. The circular silos have corn chutes.
AbandonedPorn,"Don't mean to be a Debbie downer, but that's a grain elevator."
todayilearned,Mikhando
funny,"Do you think he screamed ""aréééé as he dives in?"
chemicalreactiongifs,Yep.
chemicalreactiongifs,Drink milk. Calcium binds to zinc and lessons the effect of galvonic poisoning. Follow up with calcium supplements for a few days and you'll be as good as new.
theouterworlds,Lost all credibility when they said obsedian made fallout 3.
Games,"In your opinion, what was the most hyped game ever advertised that failed to meet it's own hype?

What's the craziest fanbase you've encountered?"
DnD,Beautiful
gaming,"Hey man, I work for IU Health which operates Riley's Children's Hospital. I'd love to get you in touch with some one to make this happen!"
AbandonedPorn,"I realized after I posted that you meant the place over by the speedway, not the old junkyard"
AbandonedPorn,It's an old general store.
AbandonedPorn,If it's the place I think you're talking about it's been cleaned out.
AskReddit,Yes and it's glorious.
gaming,Why are your pants unziped. . .
gaming,Works fine for me 🤷‍♂️
news,"I did infact listen to the audio. Maybe I was trained wrong, but it's never acceptable for a dispatcher or intaker to be that disrespectful to a person requesting services. To tell a caller to shut up or make better choices is not our job. For what it's worth, I hope the last went quickly and painlessly."
news,"As an emergency services professional, with emergency call taking experience, this one hurts. For a number of reasons 

1. I get that this was the dispatchers last shift after putting in her two weeks. I get that she was mentally checked out. I get that the job can be frustrating with the lack of common Sense runs at time. I get it I do. What I do not understand is the complete lack of empathy and compassion for the RP. We are trained to treat every call with the highest level of professionalism and compassion, treat each caller as if it's a grandparent. The lack of sympathy and concern for the caller, during an incident that could litterally happen to any one, is sickening and disheartening. The one thing I can't quite understand is why the dispatcher isn't trying to make a clean and precise delivery of when help will arrive. Even if you have checked out, it's still a force of habit to give an ETE OR ETA of responding units. That should be criminal negligence, as should the comment about ""risking their lives."" It might not be, I don't know; I've never seen a case study of something of this magnitude, but it most definitely is inhumane and unethical. 

2. The lack of empathy from the Police Chief is even more concerning. Some one litterally die under the watch of a person on his payroll. SOMEONE DIED. His dispatcher went on a power Trip and wasn't focused on the greater mission of ""so others may live."" His response should have been ""We will launch an immediate review of our internal policies and procedures. We will also ensure our staff under go sensitivity training and have a Employee Assistance Program available to ensure our stuff are processing after traumatic calls effectively and safely. While that individual is no longer employed with us, we will be launching an investigation to determine if any criminal or legal actions need to take place."" The lack of any steps to move forward and prevent from happening again shows a deep organizational leadership issue. 

All and all a absolutely horrible tragedy. With out knowing more information I can't determine survivability."
coolguides,~~Ball^sack~~
Games,"It still is going to be a mafia management game. For what ever reason this wasn't depicted in the go trailer. I believe the fast sequence of different menus and prompts and people management screens, is the management part of the game. 

My understanding it'll be pretty sim heavy."
AskReddit,He is now only executive producing.
interestingasfuck,"🎶What do octopuses dream of, when they are taking a little octopus snooze. Do they dream of eating star fish, Miley Cyrus in yoga pants.🎶"
blackmagicfuckery,"The true bmf is landing on that sketchy LZ. As a cct provider, that lz has too many variables that would be a no-go. Granted it might just be the perspective, but still."
oddlysatisfying,That kid towards the end has an arm.
interestingasfuck,Berlin Tampon Party.
gaming,You know how to Google right?
interestingasfuck,During the quidditch world cup it describes there being aurors posted to watch the crowds. Also similar situation during the triwizard cup
interestingasfuck,It's even depicted in Harry Potter.
interestingasfuck,"Very under rated comment! Penciling is more effective in this situation, pencil and get the hell out"
blackmagicfuckery,That's one of the eight uses of propane I haven't experienced yet!
Damnthatsinteresting,Microwave oven power
AbandonedPorn,Sent a pm
AbandonedPorn,Hey there fellow Hoosier explorer! I'd love to share locations some time! Feel free to send me a pm! Maybe we can colab on something.
Games,Click the link. It's clearly the name of the game. K thanks.
fo76FilthyCasuals,Ftfy: Long LOG drop.
WTF,"Wow, dirty Mike and the boys really let themselves go."
Games,Yo.
relationship_advice,"Yep, easy mistake friend! I've been following this from a far because it's one of those ""what's going to boil up next."" It seems like with every new post there was some new escalation . He made numerous comments and snide remarks on the very first post that I think has been removed. I honestly feel bad for the gal."
relationship_advice,"Ordinarily I'd agree with you. On some of the first posts he made about the situation, the comments (maybe now deleted) were not innocently put. There was one that stood out as ""I told her she either gets an abortion and cuts off her mother or I'm leaving her ass."" There were others along the lines of ""I can love with out her, but she can't live with out me."" As someone that works in emergency services there's allot of context that we look for. If the context and patterns indicate abuse it's likely abuse. The major thing here is through out the narratives that he is providing he is making it out that he is doing her a favor and that the mother is evil and vile. 

You're right the lady is a grown woman, however, when you are mentally abused and conditioned, it's all you know. There are many forms of abuse and many forms of manipulation. If this all happened exactly as how the op relayed it, than I'm sorry, grown woman or not, being given major ultimatums that includes severing relationships with family members or else is abuse."
relationship_advice,It's a common tactic! Cause isolation with parents. Ramp up the abuse.
relationship_advice,"I think what makes this even worse (I'm pro choice,) is that this whole ordeal started with a series of ultimatums. OP stated in early posts, if you don't get an abortion I'm leaving. Mum threatens to disown. Op threatens to leave. I don't know why, but something about this entire situation isn't sitting well. 

I feel like there are bigger issues at play here and it makes me very concerned for OPs girlfriend. I feel like there is more than likely emotional abuse going on behind the scenes. Just the whole way the story is being told and relayed gives off some very concerning red flags. I get the need for dark humor as a coping mechanism, but at the same time, the OP wasn't the one that was raped, the OP wasn't the one that received the abortion and the OP wasn't the one that ended up having a family fall out. So why make jokes at the GFs expense, which circles back to makes me wonder about abuse at home. 

Like I said, just doesn't sit well."
NintendoSwitch,There are plenty of other games in the packs that are not trivia based.
fo76,Any idea on why you can't sell weapons and amor above your players level?
fo76,"I guess you're right, but at least then I'd have a way to stockpile food. Right now I'm running dogfood"
fo76,So you ignored some of the major bugs.. like a broken social menu. Hunger and Thirst degrading at a too fast of a rare to be viable....
fo76,Mr handy would like a word.
fo76FilthyCasuals,I'd be interested in setting up a booth. gt Foxtrotbourbon
fo76,I agree... As long as they expand the no build zone around white springs. I'm tired of turret farms.
fo76,"I'm the Judge, The Jury and The Executioner, banker."
fo76,I role play as an upset and disgruntled utility worker there to shut off the power and things get carried away.
EarthPorn,Right? I litterally had to lay down when I got back up. Pretty sure I saw the light that day.
EarthPorn,"Those stairs are no joke. When I went, made it all the way down only to immidately run back up. The evacuated the bottoms because of a severe thunder storm. Man it sucked. Only time I've ever bought a gimic shirt. ""I climbed the stairs.' all 425."
Games,Not to mention the nemisis system.
fo76,Armor vanishing is both.
fo76,"/u/aten_ra

Xbone

Robots disappearing after death in Watoga.

Trade menu randomly glitches out.

Food, veggies and drinks spoiling at an accelerated rate.

Glitching into buildings when fast traveling. (Both into camps and into non player builds.)

Robots exploding in tubes in Watoga. 

Crash to home screen when trying to enter silos.

Server seems to become more unstable the longer your on it.

Random weight glitching. (You get into power armor and have your max carry weight, when you start to move you suddenly are over encumbared.)

Weight reductions from armor and perk cards are not stacking.

When ever you fast travel you loose armor. 

Event icons appearing in the wrong place... (Defend Monongah Power Plant is currently over vault 76.)"
Whatcouldgowrong,"Acidity, oxygen conversion, gas exchange

https://www.ems1.com/ems-products/Capnography/articles/2163495-5-things-to-know-about-capnography/"
Whatcouldgowrong,ETCO2 monitoring is becoming mainstream for more than just post sedation monitoring.
fo76,Player vending was move to may.
fo76,I role play as a pissed off utility contractor there to disconnect their power for no pay. 
fo76,I role play as a pissed off utility contractor there to shut off power. 
fo76,"Honestly, if you are griefing others and have a massive bounty, I am going to level your camp. I'll keep leveling it too. Too many people are here to play the game for relaxation. They don't need to deal with the HEERRRRRR IM RP AS RAIDERRRR.  

If you build anywhere that interferes with the spawns and farming and general flow of whitesprings, your base needs to be destroyed. You don't get xp from turrents when you are away from your base. So why set it up there and ruin the farm for others?"
fo76,But even the community managers aren't interacting as much as they used to. I don't understand why they say the listen to us when their community managers don't even take the time to respond. 
fo76,"You're welcome my dude. I'm glad it turned out! 

If anyone on on Xbox needs help with electrical let me know
"
fo76FilthyCasuals,There's even a spot to meet Mr pebbles! 
fo76FilthyCasuals,It was a pleasure my man. 
fo76,This was at Billings homestead right? I think i punched a hole in the wall a few nights ago after you left. My b. 
fo76,"My group of friends and I were griefed for three hours. We had passive on and all of a sudden after the SBQ we were all being attacked by a group of people. We blocked and moved on. Then they started server hopping and kept it going. They ended up destroying my entire base.

I don't understand why Bethesda is permitting this to happen in adventure. "
fo76,He also puts a letter in your inventory.
fo76,"Check your inventory
"
fo76,"Ah ah ah. I would fight you, but your life already seems to be a big mess. Ah ah ah "
fo76,An army of insult bots. 😍
fo76FilthyCasuals,That's honestly what I do. 
fo76,Nope! I want to move the vendor to be with the other vendors and in a more visible location that has other content. 
fo76,"She sells different flavors of Nukacola, Orange, Grape, Cherry, Quantum, Regular and Alcoholic Nuka Dark"
fo76,/u/ladydevann
fo76FilthyCasuals,I use the apps. FO76 MAP on andriod and Unofficial Fallout 76 Map on apple
fo76,My mister handy buzz blade would like to have a word. 
fo76,Simple Rick
fo76FilthyCasuals,"Yup. Message me on Xbox
"
fo76FilthyCasuals,I want to see this spreadsheet 🧐
fo76,"So, I did the event the other night in a nuked Helvita. We successfully completed the event, with one bot taking heavy damage but not being destroyed. So 5/5 were safe. All I got was the Donut Plan. No mask. No beret. Just donut plan."
fo76,"Xbox? If so, how?"
fo76,I've been getting the infinite load screen lately. It's been a pain in the ass. 
fo76FilthyCasuals,FO 76 Map on andriod and Unofficial Fallout 76 Map on apple
fo76FilthyCasuals,There's bags of concrete up on the NRG Bridge behind the nuke cans. Use the FO76 map (there's also an app!) Most roads have gravel pits that will yield concrete.
todayilearned,Never thought I'd watch a documentary about Price is Right and contastantly say WHAT THE FUCK
Wellthatsucks,"We've lost public safety divers to this type of dam. Here's a good video on it. 

https://www.pbs.org/video/over-under-gone-killer-our-riv"
fo76,"The issue wasn't the crops. The nukes caused the waypoints and tracking to not work, even on a server hop. "
fo76FilthyCasuals,How do I know which number corresponds with which red dot?
fo76FilthyCasuals,"How do you build
"
fo76,Soooo can you ask someone what's happening in this picture. https://imgur.com/kCi3Sfu.jpg
fo76,"There's a woman in a portalet wearing a dress, legs spread wide, holding a corn cob.
"
fo76,If your on Xbox.... I'd be happy to take.some.off your hands. 
todayilearned,They also had a rts!
interestingasfuck,"Absolutely. Think of it like this, it's basically the minerals from the rock is blocking certain wavelengths of light. "
fo76FilthyCasuals,Im always looking. FoxtrotBourbon
NintendoSwitch,"I have a few questions. First off I really love y'all's games. I use these at work for doing team building and professional development. Thank you for creating a product that can be used for fun and education.

1. What goes into the development of a new game mode?

2. What was the hardest game mode to come up with?

3. What are some game ideas that were scrapped?

4. What's the office culture like there? 

And lastly If you had to be a cheesecake flavor, what flavor and why. "
fo76,"Selling straightjackets to robots, tell me.more
"
fo76FilthyCasuals,"Level fifty rolling pin
"
fo76,"https://discord.gg/pnYBWb a link to our discord. 
"
fo76,Or a discord!
fo76,Awesome. We should do a Google spreadsheet. 
fo76,"That and other things, both weird and unexplained.
"
todayilearned,You are correct. 
todayilearned,"This incident was the basis for WEB Griffin's book ""By Order Of The President."""
Games,"Why do you think the character, that gave you missions to beat people up for money, name is Strauss?"
fo76,I'd play with y'all. 
gaming,"Epic typo. I can just imagine a bunch of old timey shop keeps battling it out in the middle of a cactus patch, surrounded by tnt. 

Maybe a battle Royale style game? With over the top destruction?"
fo76,Isn't that the map that's under the NRG Bridge?
todayilearned,"Unless you are Jessica Jones, Daredevil, Luke Cage, Iron Fist or the Punisher....
"
suggestmeabook,"Venus fixers and monument men. 

Both books tell the very under told story of protecting art during Hitlers Rise. "
WTF," Nah just blood. Your colon and intestines is smooth tissue, so when you apply suction to it, it causes surface capillaries to rupture. "
funny,"If you watch the two part episode ""trophy"" there's a hangglider scene that shows the ""hang glider camera."" Throughout the montage the camera appears and disappears.
"
WTF,"I would have thought the Rocky Mountains would have been a little bit more Rocky.


Ya that John Denver is full of shit."
LifeProTips,I met with Indiana Legislature during my time at undergraduate. I raised awareness about the perils of not having a bill of this magnitude on the books and how it was causing unnecessary deaths due to fear of prosecution. 
LifeProTips,I helped with the Indiana Bill.
todayilearned,"I visited the ELF site at Clam Lake Wisconsin. It's very.... Interesting
"
mildlyinteresting,Also can cause a build up of CARBon Monoxide in the house too.
AbandonedPorn,"I have a painting of this place....
"
todayilearned,"Who does numbah two woooork foh
"
Games,Fallout 4 has them. 
Games,"I'll help out with this one too! All my info from e3 is the same
"
suggestmeabook,"Enders game
"
suggestmeabook,The doodle revolution. The energy bus. Who moved my cheese?
suggestmeabook,Band of Brothers. The steel wave. (Jeff shaara has a whole series on ww2.) The pacific. Shindlers List. Hart's War. Citizen Soldiers. Night by Ellie Weitzel. Diary of Anne Frank
reddeadredemption,That's how my beloved dicksmelt died.
SquaredCircle,You fight like Hanks Wife.
AskReddit,"Mud or crud. Is that brown stuff on the floor mud, or crud?"
suggestmeabook,Goosebumps. Percy Jackson. Maybe young adult books? Is there a half Price books near you?
suggestmeabook,Goosebumpa
suggestmeabook,"Artimus fowl, series of unfortunate events, captain underpants"
suggestmeabook,"BHD  is good, I also recommend In The Company of Heros. "
suggestmeabook,Check out 1630 by Eric Flint 
fo76,"No problem friend! Like I said, it wouldn't surprise me if Microsoft freaked after day ones were being bricked by the beta. "
fo76,"You're right, there are times it was deliberate! But there was one instance where they came up through a bridge..... That's high in the air. "
Games,Real life IoI 6ers.
fo76,"I know one of the things that was being heavily reported was the game crashing xboxes and causing them to overheat. I saw more than one comment on the bug threat about this. To me, this forum is a microcommunuty that has a good sample size of Xbox users. If this small community had several instances of it happening, scale it up globally. 

There were a few texture bugs, a few combat bugs that I noticed that were frustrating, like ghouls appearing from under ground. There were instances were things that should drop things were not dropping. 

From a speculation side of things, these issues are pretty important and they NEED to delay the beta, until the overheat issue is resolved. It would suprise me if microsfot said ""what the fuck Richard."" when these reports started to come in. Beth doesn't want to jepordizr any future exclusivity with Microsoft so this would be a priority fix.

In my honest opinion and assement the game worked good for me, however I am one person. But, if it causes damage to my fellow gamers. DELAY. "
Games,"Absolutely, in real time. The map is out off of pipboy. So you click the menu button and it brings up the map (it has the same functions as 4. With the introduction of photomode and social, which shows who of your friends are playing and who is on your server.)"
Games,"I hope this makes sense. To me the combat is different than fallout 4. With vats and everything it made combat feel slugish and more run and gun. In 76 everything seems more tuned. Aiming down sights is more realistic. Close combat feels more impacting. Like I can feel the punches, I can feel my impact.

The guns sounds better. The shooting is more damaging and punishing. "
Games,"The way I see it, I am sharing something I love. 
"
Games,"I found a pickaxe, it has allowed me to battle Ghouls pretty easily. In this game, ghouls are more hordey and swarm pretty relentlessly, so having a good weapon that will let me mow them down is vital. "
Games,There seems to be an over arching story your following. Trying to figure out a disease. 
Games,It does and doesn't feel empty. The survivor stories makes it feel more believable that there's no other humans besides the Reclaimers. 
Games,When I first started' I was around players for 45 minutes. After that I was all by my self. I could have used the company
natureismetal,"You still need to galvanically earth the lightining rod.  If the conducting rod is not grounded properly, the charge will arc on the path of least resistance. I.e. it will arc to the building possibly causing a fire.

I've linked two websites below. 

https://science.howstuffworks.com/nature/natural-disasters/lightning7.htm&ved=2ahUKEwiY5OvCtZ7eAhVE44MKHUlRB4oQFjADegQIDRAI&usg=AOvVaw0q--JOgw6jU_c97sHMWInz

https://commotionwireless.net/docs/build/grounding-lightning-protection/"
MemeEconomy,!invest 1 brett
Games,I wish I was getting paid to play. Saddly I'm not. Just a government employee. *Puts tinfoil hat in drawer.*
Games,The new vats sucks. It's too complicated to switch parts in the middle of combat. The targeting seems slow too. 
Games,Yes! So it really wasn't much different. I viewed the other players as advanced ai companions. They came in and helped and left. I did the same. 
Games,"New River Gorge area is pretty memorable. That's where the Highropes course and summer camp is. As well as a ""resort."""
Games,No major issues. It stuttered slightly when me and another player battled Handy's.
Games,The pickaxes just feel very satisfying. They do allot of base damage
natureismetal,Arson investigator here. Total loss. Cause of fire was due to the building being improperly grounded. 
Games,Yes. The match making is.... Rough. I wish it would be a key thats not the action key. Maybe rb plus a?
