subreddit,body
fo76,The crying and apologizing was just.... Wow. Something I wasn't expecting. Especially after finding his letters. 
fo76,"Yeah, even with it on, I've found dark places that drowns out the piplight."
Games,I absolutely love the game. It's just those few things are just annoynces of mine. 
fo76,I thought the survivor stories is a great touch. It definitely makes up for the no human npcs
fo76,The world isn't empty. It's just spread.
fo76,I've made it all the way to Camden park. I got destroyed.
fo76,Empty nukacola bottles need fixed. They appear to be full bottles with the transparency turned down.
fo76,"Xbox Foxtrotbourbon

When sitting in a chair, the pipboy doesn't illuminate player, instead it illuminates the ground. "
fo76,"Keep your head up friend. If you want some one to play with you during the next beta, send me your gt."
fo76,Nope
fo76,Update three. So far haven't found too many buildings that are explorable :(
fo76,Thanks VD!
fo76,"Xbox 1 

Foxtrotbourbon

The lighting is way too dark. The sound also is very quiet. "
fo76,Am I free to keep updating this as I go or no?
fo76,Update two. The survivor story's are very good and gut wrenching!
suggestmeabook,By Order of the President by WEB GRIFFIN
interestingasfuck,The damn Dam shop.
AskReddit,Clogging the shitter.
Showerthoughts,So basically Snow from Smokey and the Bandit?
aww,"The gray white tiger stripe on it's back remind me of Hedonism Bot from Futurama. ""I say."""
todayilearned,I can see why!
todayilearned,"I fucked up my knee playing there. If memory serves it was basically Concrete, sand, ruber mat, then the carpet. It was very very unforgiving. 

You'd take a hit, and it would feel like you were getting slammed into a wall. When they built lucus oil, that turf was pretty good."
todayilearned,When the Indianapolis Colts still played in the RCA their turf was more like carpet. I played on it. It sucked. Majorly. Had to wear tennis shoes. 
mildlyinteresting,Airhorn sample on a laptop. 
falloutlore,"Not to mention, built a laser weapon defense system that protected New Vegas from missiles. "
suggestmeabook,Terry Pratchett books. 
IAmA,"Hi Jodie, what have you done to prepare for the role?
"
aww,"The parents probably turn on frozen so they could do a little bit of acting of their own.... In the bed room

"
suggestmeabook,"There's two sequel's.
"
suggestmeabook,Postman! One second after. Lucifer's Hammer. Monument 14 
r4r,"Knock knock
"
r4r,I can work with that!
r4r,Meme game ugh! Sorry stupid auto correct! 
r4r,"What's your go-to meme or gif? How's your men game?
"
suggestmeabook,"The camel club by David Baldacci
"
AskReddit,"""Hello, I'm Chris Hanson, please have a seat."""
gaming,"Max Payne, meets fallout meets Hitman. 
"
abandoned,"I can get to Chicago quick... I'd be interested.
"
todayilearned,"Pedicures can help prevent ingrown toenails. Which is a very valid issue and concern, especially in football.
"
nostalgia,Its on Hulu.
todayilearned,"Corn starch and water. When eqaul pressure its a solid, when the pressure gradually increases it becomes a liquid. Kinda like poop.
"
nostalgia,"Klackers
"
gaming,All the marijauanas.
AbandonedPorn,Let's take this conversation to dm.
AbandonedPorn,"Last year I posted about a poor farm in west central Indiana. The post received a lot of attention, both on reddit([https://www.reddit.com/r/AbandonedPorn/comments/5lo6hx/even\_the\_smallest\_of\_towns\_has\_its\_skeletons\_mic/](https://www.reddit.com/r/AbandonedPorn/comments/5lo6hx/even_the_smallest_of_towns_has_its_skeletons_mic/)) and around the internet. This past April, I decided to revisit the Poor Farm and see how much it has changed in the past year.

Here is a link to the original Imgur

[https://imgur.com/a/xEyr5](https://imgur.com/a/xEyr5)

Here is the new Imgur

[https://imgur.com/a/vmMJaXa](https://imgur.com/a/vmMJaXa)"
WTF,"His hands were too busy fappin
"
todayilearned,Totally for regular use... Totally not fetish.... /S
todayilearned,"Damn....
"
todayilearned,Rapidly aging... Sure... Totally not for fetishes wear... /S
Games,This isn't the first time PlayStation stale mated. Think about the PS4 mods....
fo76,What if the control vault was full of serial killers. The expieriment is to see how long it will take them to revert once they are on the surface. 
fo76,"Samsqaunches, hillbillies, black bears, A shiners faction. Beavers, coyotees, eagles, owls, "
fo76,You tube Country Roads Golden Circle. You're welcome
fo76,If Chris Avellone wrote the story for this game (as is rumored) then yes old lore will be regarded.
WTF,For fucks sakes Randy control your dogs. I'm minding my own business. 
fo76,"Forests, yes but it will take tons of nukes to reduce the mountains and topography
"
fo76,"Not whole mountranges.
"
fo76,"If you are going by leaks, it's two studios. If you are going by the caption on the Teaser it's Bethesda Game Studio."
fo76,Wasn't it built under the West Virgina wing or just built WHILE the West Virgina wing was being built?
fo76,"Ark, with story telling and quests from BGS"
fo76,Ark.
fo76,"IT JUST WORKS.

but seriously. I think the spin is strong right now. There's lots of good prospect with this style of game in the fallout universe. It's still a rumor until today confirms. Personally. I'm excited to see the universe continue.

What I'm hoping for is a meaty story ala FONV, resource management and crafting like Conan Exiles, base building like fallout 4 and drop in coop like Far Cry5. "
fo76,I'm having visions of Conan Exiles. Which will be very good. In the article Jason states his sources told him it will have full story and quests like any other meaty rpg from BGS
fo76,https://youtu.be/T9q2vH8Ms00
fo76,West Virgina and Western Virgina are both very mountainous and some of the most forest dense portions of the country. A PvP environment would be very hard to implement with out major retcon of geography.
fo76,"Biometrics?
"
fo76,I thought the Rockies would have been more Rocky.
fo76,"Maybe the east coast ""command vault."""
fo76,"If people know more about geography too, they wouldn't believe the online rumor."
fo76,"It's a pretty amazing story. Here's a brief documentary https://youtu.be/g3kAcJruEOs
"
fo76,Yes sir. There's a massive bunker complex underneath the hotel.
Games,Yeah...established Canon in both 3/4 has vault 76 as a control vault with no expieriments. So I doubt it's a vault management game.
Fallout,"Clip?

"
Fallout,"Clip?
"
Fallout,Kortaku.
Fallout,"Who pissed in your Cheerios?
"
Fallout,It starts off with your birth...
Fallout,"I saw some one banned earlier for ""English only"""
Fallout,Nope it's the special edition fallout 4 pipboy...
gaming,What value? Are you receiving money when you buy a loot boxes? All you get is random items that affect gameplay and or cosmetics. It's gambling with no money pay out.
gaming,Useless reply.
gaming,"Going to expand on the gambling addiction. If you think about it, the perceived payout on loot boxes is far worse than playing the lottery. At least with lottery, slots and table games, your gambling has the potential to pay out a cash return.

Loot boxes have no cash return. Just a perceived psychological return. "
Games,"I'm pretty excited. It looks pretty good. I can't wait to create my own company. 
"
Games,"Is it true, that once you download it (and maintain an active game pass account) you can still play it for free, even if they remove it from the pass?



Edit I guess they changed it."
nostalgia,And ernest joins the army.
mildlyinteresting,Storm chaser. There's an barometer above the driver side. 
suggestmeabook,"Schindlers list.
"
celebnsfw,Good bot
Whatcouldgowrong,"If these two worked for me on a Bus, they would be terminated on the spot. 98.9 percent of Patient drops are preventable. "
WatchPeopleDieInside,It's called feeding the bite. I am a rec therapist and I working in a residential mental health facility for youth. 
lfg,"I'm pretty new. I've never paid, but, I've listened to several podcasts"
lfg,I'd be interested!
trashy,"Julian, I'm not becoming the liquor. JULIAN. I am in the liquor. 
"
trashy,"The shit boat is sailing down Shit River, Julian, and the shit hawks are circling high above. "
worldnews,That some one finally came up with the perfect dry gin?
nostalgia,"Early slime recipies was applesauce, vanilla  pudding and food dye."
pics,"Instructions unclear, another four weeks of winter."
SquaredCircle,"I'm sure Vince did. The gucking camera man, the real MVP, framed the shot perfectly. "
SquaredCircle,https://imgur.com/QvkYxMD
SquaredCircle,Check your messages. Am I allowed to post that on here?
SquaredCircle,Her whole muff was out of her suit.
SquaredCircle,"Did no one notice Natalyas malfunction when she was eliminated?
"
southpark,BUFFFAAALO SOLDIER COMING TO AMERICAN
photoshopbattles,[I didn't mean to!](https://imgur.com/a/C3GO3)
photoshopbattles,[I DIDNT MEAN TO!](https://imgur.com/a/C3GO3)
Games,I'd be willing to help with the Microsoft con
Seaofthieves,Seems they are working on it. http://m.ign.com/articles/2018/03/26/sea-of-thieves-devs-cut-controversial-death-tax-update-following-community-feedback
Seaofthieves,Try the eye patch install.
Seaofthieves,"Nah, I have the full version of game pass. Besides the game hasn't been out for 14 days yet. "
Seaofthieves,Both.
Seaofthieves,Xbox. I downloaded the update.
Seaofthieves,I tweeted them. Maybe we should tag them in the thread?
Seaofthieves,I'm so frustrated. 
Seaofthieves,Ugh. I'm home recouping from a surgery. I was lookin forward to sailing.
nostalgia,"Lunch has been canceled for a lack of hustle.
"
AskReddit,Gaming Simulator 2016 lol
IAmA,"Hi Denny,

Thank you so much for doing this AMA. I have a few questions for you:

1. What made you decide to become a distiler?

2. What kind of career progression did you have to take to get to where you are today?

3. Do you think the recent surge in artisan distilleries will have over all positive impact on the big brand whiskies?

4. What was your first alcoholic drink?

5. What flavor profile do you usually look for when you are sampling?

6. Which king of the hill character do you closely relate to?"
HighQualityGifs,I read this in the Panguin voice. 
nostalgia,Right in the feels. One of the first games I 100%
Damnthatsinteresting,"Considering he doesn't use the suspenders or the zipper, ya he is pretty fast. But not safe. "
IAmA,"What's you're favorite memory as an actor? Any funny stories from sets?

How often do people ask you to scream?"
WTF,"However, I think this pt is still alive and this isn't post mort
"
WTF,Some pathologists request post mortem films with equipment still in place. 
SquaredCircle,What went through your mind during the Chris Benoit incident? How did that incident change the face of wwe?
suggestmeabook,"Web Griffin has a huge series on police. 

I also recommend black by Christopher whitcomb"
books,You should read Killer Angels next. 
WhyWereTheyFilming,So you saw the marks on the road before he started too?
suggestmeabook,The postman 
todayilearned,Sorry. Made an edit. Meant to say ingredients. Sorry friend. 
todayilearned,Coke also doesn't want the ingredients to be public record.
Games,That game was amazing. 
pics,"Hey there fellow Hoosier
"
BetterEveryLoop,Novelty grill? NOVELTY GRILL! fights on!
gaming,"Simsafari
"
gaming,"Plot twist, Kerbal Space Program is in the same universe. "
pics,Still got one of those metal detectors?
IAmA,I remember your visit to Indiana State last year and how some guy punched a cop during your appearance. How did that make you feel?
WeatherGifs,Thank God it's now windy /s
WeatherGifs,I'm looking at the Chippewa from my porch... right. Now.
gaming,I literally just watched this episode of South park.
gaming,"Shoes went flying. Confirmed fatality.
"
lifehacks,Huffpo is your source? Are you fucking serious? You're getting your financial advice from the Huffington post. Wow.
lifehacks,"You're an idiot that has no understanding about fundraising or charitable giving. Point of sale fundraising is still a direct donation to the cause and you can still claim it on taxes. Further it's tracked on every receipt as either ""charity donation"" ""charity"" or The causes name and the amount you give. 

This isn't a life hack this isn't even a shitty life hack this is a ignorant persons conspiracy theory. "
lifehacks,Can we get a speaker warning?
instant_regret,Try lotus candle
IAmA,Have You ever sharted and blame the dog?
pcmasterrace,Is use the card to get my cat a cat castle.
BSA,Scoutingnewsroom.org scoutingwire.org facebook.com/boyscoutsofamerica 
BSA,"Starting in the 2018 program year, families can choose to sign up their sons and daughters for Cub Scouts. Existing packs may choose to establish a new girl pack, establish a pack that consists of girl dens and boy dens or remain an all-boy pack.  Cub Scout dens will be single-gender — all boys or all girls. Using the same curriculum as the Boy Scouts program, the organization will also deliver a program for older girls, which will be announced in 2018 and projected to be available in 2019, that will enable them to earn the Eagle Scout rank. This unique approach allows the organization to maintain the integrity of the single gender model while also meeting the needs of today’s families."
BSA,"It's right in the official press release from national. ""Separate program based on the Boy Scout Curriculum."""
BSA,That hasn't been the mission for at least 30 years. 
BSA,"Sorry for the delay. I am close friends with an individual that wrote the proposal. Secondly, I've had conversations with the Chief on the subject and the organization never wants to integrate girls into a single gender troop.

Coed cub scouting serves the entire family. "
BSA,It's what I'm here for!
BSA,"Hopefully this will be seen. Here's what I know(Professional Scouter.)

•charter orgs will have final say.

•packs will be coed, dens will not. Packs will have the option to be single gender or coed. If coed, the dens will be single.

•troops will not be coed.

•a separate program for post cubscouts is being created USING the boy scout curriculum.

•a new youth protection training encompassing coed issues and other safety concerns is currently being developed and will launch in 2018.

•the emphasis of the changes will be serving the entire family.

•national is still working on the final implementation of the changes and will likely have a firm plan released in April.

•the BSA will not be rebranding, changing uniforms or name for the foreseeable future.


I hope this helps?

Format edit."
BSA,"Hopefully this will be seen. Here's what I know(Professional Scouter.)

•charter orgs will have final say.

•packs will be coed, dens will not. Packs will have the option to be single gender or coed. If coed, the dens will be single.

•troops will not be coed.

•a separate program for post cubscouts is being created USING the boy scout curriculum.

•a new youth protection training encompassing coed issues and other safety concerns is currently being developed and will launch in 2018.

•the emphasis of the changes will be serving the entire family.

•national is still working on the final implementation of the changes and will likely have a firm plan released in April.

•the BSA will not be rebranding, changing uniforms or name for the foreseeable future.


I hope this helps?

Format edit."
churning,"I used a code FTUEARLY and it brought it down to $29.99

For what its worth... 
"
churning,"Im just using the link that I found. Im sorry. :( 
"
churning,What do you mean by a referral link? I am literally copying the link that I originally found for this site/event. I am so confused. 
churning,"I think it sounds like a fun event and just wanted to share it with the folks here. Im a long time lurker, and this website, and this sub has helped me along my journey. I wanted to pay it forward. 
"
BSA,"The original K will always be the best.
"
BSA,"Send me a message. I'll contribute.
"
Games,"Cadyshack simulator
"
BSA,"""too hard to verify"""
mildlyinteresting,Slow panda with armor.
BSA,"Good luck. I tried getting the mod to allow ""professional Scouter"" or ""council employee"" he won't do it."
gaming,"[doubt] You're really not crazy are you Trevor! This was all just an elaborate scam. [Accuse] you don't even do meth do you, Trevor?"
suggestmeabook,Level 26. It's a fictional novel about a serial.murder and rapist. 
todayilearned,"I have a px4 storm. Great gun. Very reliable. It also fits my hands super neat.
"
happy,Fascinating. I'm not doubting you. That's just what I've been through my staff assignments and folks through national. If you don't mind me asking what council or state are you in? You can om it to me. Im just genuinely curious if your in one of the council's that is being proactive.
happy,Incorrect. They are pulling out of the varsity program. They will still use Boy Scouting and Cub Scouting for the foreseeable future until they come up with their own program that can be implemented world wide. 
happy,A board of review is not allowed to ask if you specifically believe in God. They can ask.you what being reverent means. 
happy,Not entirely true. You need do believe in a higher power. 
gaming,"Hot coffee. 
"
Games,I speed up time all the time.
gaming,"I just started a new sub called gaminglostconnections. My.goal is to have it be a central hub for people trying to find ""missing gamers"" "
BSA,"De here and former program guy. Please message me some, id love to hear about the issues and try to offer solutions"
BSA,Forward the note to the de. DO EVERYTHING YOU CAN TO STILL GET STUFF IN ON TIME! Let the de be the one to talk to the goofball. That's what we get paid to do on your behalf!
BSA,"De here. Yes. Please reach out to your de. I would also notify the restrict advancement chair. This is a clear addition to the eagle scout requirement, there for a violation to guide to advancement. "
WritingPrompts,This.
BSA,De here. Thanks. 
BSA,Council training staff advisor here... My understanding it's been delayed.
todayilearned,"I have nicknamed them skycarp.
"
BSA,"Excellent! I hope I see you at the staff ceremony
"
BSA,I'm excited to be on EMS staff! I'll also be talking to various people about being a professional scouter!
BSA,"Little known fact, Ransburg lies in the Hoosier national Forest. This was a health logging and property management."
suggestmeabook,Anything by Jeff Shaara
suggestmeabook,Upvote for turtledove. I started with guns of the south and finished with his settling accounts series.
instant_regret,http://imgur.com/PjpeYT3
xboxone,That it tries to power on
xboxone,Should I be hopeful that it at least true to power on?
gaming,I'll never get that 1:10 back. 
WTF,She's wearing a er band
gaming,"It's the daily bash EA post. If you don't like their games, stop buying."
xboxone,Ftfy Assassin's Honor: Far Dog.
WTF,Confidifth
suggestmeabook,Second
news,Upvote for bacon.
gaming,"Hi there, you should look into the new Xbox game library pass. Tons of kid friendly games. (Including Lego Batman) I recommend minecraft. There's also a game called unraveled that's pretty fun. Rocket league would be good. Games with gold have the complete Lego Star wars (all six?) for free."
gaming,"They will be look out tours in this game.

"
AbandonedPorn,http://imgur.com/a/nQ1h6
news,"I wouldn't call it a charity so to speak, however the BSA is the official male youth program for the LDS church."
BSA,"Hi there, District Executive and Jambo staffer here! There will be plenty of mixers happening in the Echo Subcamp. You'll meet tons of people!"
GrMD,"Yes.
"
suggestmeabook,"The nursing home scene really fucked with me. It was extremely descriptive, and as some one who used to be a paramedic it hit way too close."
BSA,Hi fellow team.medic!
gaming,Kenny loggins.
Wildlands,Second. 
gaming,Lord of the rings return of the Caine 
gaming,Far cry 8: drugs
gaming,Grand Theft Auto 6: Cartel 
gaming,Helicopter. 
xboxone,That boy ain't right
suggestmeabook,Im sorry mate 
suggestmeabook,Sigh it would help if I have the right name. Population 854. Michael Perry. 
suggestmeabook,Texas.
suggestmeabook,Population 421
gaming,"Let me call my friend Dale, he lives in his mom's basement and he is a expert on stuff like this. "
gaming,"Frank, father Frank GAllagher. Give me your fucking liver. "
WTF,1 dick...Ah ah ah... 2 dicks ah ah ah. 3 dicks... Ah ah aaaaaaaah
mildlyinteresting,Yep
mildlyinteresting,"Looks like a books a million. This is a current event display. Trump books because he was recently elected. And the Orwell books because some news stations used them to describe current events, which caused several major online retailers sell out."
mildlyinteresting,Kwik Trip is a damn life saver. Don't forget your bagged milk jug!
BSA,Most of my units pay using money from popcorn sales.  
BSA,"30 per member? It should be 24 a year for dues plus a dollar for insurance.  PERIOD.  Unless your unit is paying a 5 per member unit. Fee.  There should be no other costs. Going out side of the 24 or 25.
"
BSA,200 or 400 a year for cub Scouts? Man that's...  Weird. 
BSA,Technically you can earn the Eagle as a venturer. But you had. To have started the requirements in a troop. 
pics,Fuck the vikings 
pics,Any love for superior? Toot toot? 
AskHistorians,Tl;Dr göring
2007scape,You're welcome. 
pics,Ftfy smellout
suggestmeabook,I was way off.  Level 26 by zuicker
suggestmeabook,"Level 19 by one of the writers from Csi. It's a very frightening book about a serial sex killer
"
nonononoyes,Hello laaady. 
nonononoyes,Yeah this comment through me off.  In just centeral Indiana alone there's over 20 dirt tracks. Probably double that in North East Georgia... And. Where I am now there's at least 5 within 30 miles. Maybe the guy mentioned in California... Confused. 
pics,What's the data for this photo? Fstops? Appeture? Shitter speed? 
pics,That'd be a day drinkers dream. 
suggestmeabook,Second for boneshaker! 
suggestmeabook,The road by comick mcarthy
secretsanta,Thank you so much! 
BSA,"If you're looking for quick funds,  using a crowd funding site like go fund me is a real gamble.  If you. Need the cash yesterday, consider asking businesses for sponserdhip or a local service club. "
AbandonedPorn,Pretty sure it was designed and built around the same time.  The one off of 59 near clay city correct? 
suggestmeabook,Cotton Malone. Start from the first Novel.  They kind of build and overlap can be slightly confusing if done out of order 
suggestmeabook,The postman 
suggestmeabook,1640 by Erik flint.  It's about a town in West Virginia from the late 1990s that gets transported to the 1600s in Europe.  It's a great read.  
AbandonedPorn,http://imgur.com/a/xEyr5
pics,Yup
pics,😆
AbandonedPorn,"I took down the link due to all the threats and complaints. 
I'll reup it in the morn"
AbandonedPorn,"Just because I regretted going in,  doesn't mean I didn't think the place was worthy of showcasing.  "
AbandonedPorn,I took the original link down.  
AbandonedPorn,Facility. 
AbandonedPorn,Sadly no.  
AbandonedPorn,You're absolutely right.  It was mostly I didn't want some one getting hurt or sick from the conditions.  
AbandonedPorn,"You're right,  I regretted venturing in there shortly after hitting the basement with the bio and documents.  But post the location away.  I'm actively working on getting it cleaned up.  "
AbandonedPorn,Cool story boo.  
AbandonedPorn,"You're right.  However, it will be rectified soon.  "
AbandonedPorn,Already taken care of doc :) 
AbandonedPorn,I was hoping people wouldn't post the information out of respect of the property.  
AbandonedPorn,I was hoping people wouldn't post the location out of respect.  
AbandonedPorn,You're correct.  Auto correct.  
AbandonedPorn,"I honestly believe it closed in 2005. That's when all the payroll stuff ended.  As well as research conducted with local county historical Society, library and county officials. "
AbandonedPorn,"Actually.  On any of my pictures there is nothing I repeat nothing that shows identifiable patient information. In fact I made sure none of the pictures I took did the same.  I work in the healthcare field and I take Hippa very seriously. 

They took absolutely no steps to safe gaurd patient information among other things.  So don't even begin to put me in the same category.  

Edit-hipaa"
AbandonedPorn,You do you boo
AbandonedPorn,"Wrong facility,  that one's on the other side of the county. "
AbandonedPorn,"Malnutrition. A couple of heartattacks, diabetes, unexplainable circumstances, electrocution and a fall down the stairs. "
AbandonedPorn,Fine.  Theres also a risk of collapse in some areas.  
AbandonedPorn,Trust me.  It was used as the county jail during the poor farm years. Edit-on some of the old old county maps it is even labeled as county sheriff's Jail and office. 
AbandonedPorn,Not true.  
AbandonedPorn,The John doe box contained information of unclaimed deceased with no known names.  
AbandonedPorn,"Lead paint was downstairs in the maintained areas.  

Edit maintance "
AbandonedPorn,I'm working on it. 
AbandonedPorn,I'm working on it.  
AbandonedPorn,Since 2005. 
AbandonedPorn,Sadly this closed in the mid to late 2000s.
AbandonedPorn,All of the private info. The John doe box.  
AbandonedPorn,Pretty sure it's a 4 all of. My research shows the facility closed in 2005 and besides  those kinds of prescription books should have phased out in 06 07 ish
