subreddit,body
AbandonedPorn,"Honestly,  the conditions this place was left in the owners need to be in jail. The amount of patient information,  accounting  payroll and personnel records that was left unsecured is illegal.  These documents needed to be destroyed. It's hard telling how many people's information has been accessed by nefarious actors. 

The Biohazard is a completely separate issue. There was sharps,  narqs, Caths, blood test vials(full) and other unidentified materials mixed in. When this facility was closed  the administration should have taken steps to properly and legally dispose of this infectious waste.  

Both of these items coupled with the rapid abandonment of the property points towards some illegal things occurring at the facility.  The incident reports I saw was deeply concerning; the fact the state of Indiana investigated the facility and fined them was another red flag.  I just hope the illegal actions by the former owners didn't lead to identity theft. "
AbandonedPorn,"No homeless are using this building.  

The Biohazards is the number one hazard.  Secondaries include flaking lead paint,  asbestos,  and fecal matter"
AbandonedPorn,2005
AbandonedPorn,"Biohazards,  flaking paint,  and asbestos.  Plus all the information that's In there makes it very sketchy"
AbandonedPorn,"Honestly, It was a test run of the watermark
"
AbandonedPorn,", Investigative results from audits, tax info, how much money was being paid in and out from the state. ;) Bitch. "
AbandonedPorn,"This County has a history with Mental Asylums. there is a second abandoned asylum that is now believed to be owned by a right wing militant group.
"
AbandonedPorn,You'd think. Should have seen what I found in the payroll room
pics,http://imgur.com/a/xEyr5
AbandonedPorn,"Believe you me, if I had the money, I'd buy it and rehab it. SO Much history. I mean the small jail alone is so cool. "
AbandonedPorn,I guess to renovate it would cost 3.5 mil and to tear and clean would be just as much. 
NoSillySuffix,http://imgur.com/a/xEyr5
AbandonedFans,http://imgur.com/a/xEyr5
AbandonedPorn,"MORE PICTURES!

http://imgur.com"
AbandonedPorn,"Yes Sorry, Imgur is giving me fits.
"
AbandonedPorn,"Tucked away in a rural community in Indiana lies this complex. This used to house the ""Poor Farm"" also known as the Blank Countyhome. This (specific) sprawling complex housed people with disabilities or poor health (often the elderly) who failed to pay taxes in the late 1800's to 1920s. This was scene as a better alternative than jail for this specific population. Residents at the Poor Farm were required to provide labor. Sometime after the closure the complex saw new life as a state ran mental health facility and finally a nursing home. 

The Pictures will tell the rest of the story of what happened after the nursing home was shut down.

http://imgur.com/a/xEyr5

**Edit: If you know where this is, please don't share the location. And for the love of god. Do. Not. Go. In. That is a n mistake I made and I got awesome costs, but Ive also a lot of sleep over it. 

Gold edit.  Tha m you for my first gold kind stranger. "
WTF,"Looks like gangrene mixed with cellulitis.  Also looks like neuropathy onset from diabetes

Edit necropathy "
suggestmeabook,Randall Wallace 
suggestmeabook,"Web Griffin,  badge of honor"
suggestmeabook,Jeff shaara had a good series on ww2
suggestmeabook,The brave heart series is pretty good.  I read some books based on merlin.  
food,Don't. Let your bagel and falafel hang out 
BSA,This is 100 percent false.  All membership numbers are unique and if you transfer councils you will received a new number generated from national.  
gifs,Did any one notice the buggy wheels are not round.  
trashy,No guys
ems,"Why,  it's not protected information and it's situational at best.  Let me ask you this.  If you were unconscious would you want your tech or med not relating this to friends or family members? Remember they can't get your consent. "
gaming,The legend of zelda: the bastard's gas. 
suggestmeabook,Second! 
AskReddit,So they are linked in the ebdb 
