subreddit,body
admincraft,Does your router/firewall support a DMZ?
politics,Or use this to get more asses off couches and mouths off bongs for the GA runoff
politics,Tobacco stains walls and ruins the interior of places anyways. Ever seen those white window blinds after a stint in a smoker's place? They are yellow.
politics,"Some countries will issue fines that are a % of your annual income for things like speeding.

Seems more fair. If I was filthy rich why wouldnt I speed everywhere if it only costs me $100? I might change my tune if it cost me personally $14,000."
politics,"The South Park Movie: Bigger, Longer, and Uncut."
politics,Nice
books,Great point!
books,How is this different than indiebound.org?
SelfSufficiency,"Seed to Seed by Suzanne Ashworth is a great book about seed saving if you all are into this.

Beware it reads like a text book at times, but its a great resource.

https://www.indiebound.org/book/9781882424580"
SelfSufficiency,"How to make a box out of paper

How to make bread

How to make pickles

How to stack rocks

How to clean your electronics

How to make a bench with rope and logs

There is a bunch!"
simpleliving,Origami.
botany,The owls are not what they seem!
politics,There will be a thread linking to both.
politics,Thank you for your input and the examples. I have relayed this information to the mod that drives the live threads and I will be talking to them about this.
politics,"Hello! This is generally due to limitations on Reddit's side... Subreddits are limited to a maximum of two sticky slots. This means that when things such as Megathreads and AMAs come up, we need to clear the way for them.

It is not that we do not want to do it, in fact one of my fellow moderators keeps telling me to post stuff in the live thread....

Would it suit you if we had one every day, but left it unsticked during times when we need the slots?"
politics,"What we mean is that if you have articles you feel support this ideology (or any hateful ideology) that are coming from the Daily Caller, or any source, you should report them to us via the modmail action. We have mechanisms available to remove sources from the Approved Domains List.

If any source seems to be advocating for hate against any protected groups, we need your support to smash that report button and modmail us."
politics,"The headline for this article has changed, but we are leaving this up. It has changed from ""after testing positive"" to ""while awaiting COVID-19 test results""

Original Headline: GOP Sen. Ron Johnson Went to Oktoberfest Party After Testing Positive for COVID-19

Current Headline: GOP Sen. Ron Johnson Went to Oktoberfest Party While Awaiting COVID-19 Test Results"
terrariums,"It may not have died, mushrooms are technically are just the fruiting bodies of the fungus. It may return!"
NintendoSwitch,The touchscreen drum is tolerable!
Gameboy,Thank you! Will try this next.
Gameboy,"Still happens on DC adapter, unfortunately."
politics,"Lots of duplicate articles were submitted. There is a rule about that on this sub. You can report posts as ""already submitted""."
politics,"https://www.cbc.ca/news/world/cbc-trump-scene-home-alone-2-1.5408809

The CBC version is missing Trump, but it was done in 2014.

>CBC confirmed Thursday it deleted a scene featuring Donald Trump from the movie Home Alone 2: Lost in New York, but the broadcaster says the cut occurred before he became president and was not politically motivated."
politics,"We have added more polls, sorry for the delay."
technology,"Unfortunately, I've purchased an item on eBay and had it arrive as a ""gift"" from Amazon."
politics,"Firefox will tell you. There's a shield icon you can click around the Navbar.

I think uBlock origin will tell you as well."
politics,"My absentee ballot in WA for August has giant letters on it indicating to mail by the Friday before election day for a valid postmark.

I think people are, or are getting, wise to this."
admincraft,"They are working on it. You can see they have already made the branch here: https://github.com/PaperMC/Paper/tree/ver/1.16

Soon! I feel your pain!"
admincraft,"Since you can connect locally, but not over public IP, we know the issue is *likely* limited to the edge of your network.

With that in mind - are you certain the port is actually open? Can somebody from a PC other than your own get a good looking response from this command:`telnet your.public.ip.addr 25565`?

It should basically say anything other than ""connection refused"" or ""could not connect"".

That is where I would start. Also consider what other devices are present in your network edge. Is it straight up fiber > Google device > laptop? Or do you possibly have fiber > Google device > additional routing device > laptop? All are things to consider."
admincraft,Looks like Spigot is ready for 1.16.1! https://getbukkit.org/download/spigot
2meirl4meirl,"Aldi's is called Trader Joe's on the left half of the US, check there?"
simpleliving,Some public library systems in the US are abolishing late fees all together!
Python,Arduino Nano 33 IOT comes with a wifi chip in addition.
politics,"If you read his statement he mentions the students should ensure they practice situational awareness, something he failed to do that day. So yeah, ""off guard"" would be what happened here it seems."
politics,"Public figures are generally exempt from the incivility rule on this sub. You can say ""fuck Rand Paul and I think he smells""."
politics,Mormons did not allow most black people as clergy until 1978. Apparently there where at least two between the mid-1800's and 1978.
politics,"This sub tries to not ""lock"" posts. Please provide a link to the ""locked"" post."
technology,Check if your home router supports DNS over https.
technology,"Some VPNs leak DNS information.

If you go this route please test."
homelab,Heck yeah!
politics,Or the state can just send one to every voter.
politics,To be fair some states let felons votes after X years. See WA.
politics,"Some states have already been doing this for years. Why not ask them how they handle the fraud if they even have any? Additionally, voting online opens up _even more_ security issues. Plethora of holes in software from all sorts of different vendors."
leaves,I appreciate you!!
PoliticalDiscussion,Sorry for the delay! My state tracks you and what you have voted in. You enter your voter registration info and can see previous elections you have also voted in (but not read how you voted if I recall).
PoliticalDiscussion,"WA here. It's super easy. You get a packet with information on everything and who all is running. You have a few weeks to think it over. You then can either drop your sealed ballot into a blue USPS box (postage paid) or drop it off in a secure ballot drop box usually found near libraries, etc.

Edit: you then go to the state/county website and check that's your ballot has been registered as counted."
politics,Lack of testing compared to other nations.
politics,"When you see this, please report the submission as copy-pasted."
politics,"Hi `Sulde`. Thank you for participating in /r/Politics. However, [your submission](https://old.reddit.com/r/politics/comments/fj5gtp/-/) has been removed for the following reason(s):

* Article not in english.



If you have any additional questions about this removal, please feel free to [message the moderators.](https://www.reddit.com/message/compose?to=/r/politics&subject=Question regarding the removal of this submission by /u/Sulde&message=I have a question regarding the removal of this [submission.](https://old.reddit.com/r/politics/comments/fj5gtp/-/?context=10000\))"
Minecraft,The heart containers in the GIF.
politics,Then a third party recounts.
Minecraft,Yes.
politics,The rule is live.
politics,Yes.
politics,"The president will now go on trial in the Senate for the two articles passed, with the chief justice of the supreme court presiding over the ""court"". If convicted, the Senate may choose to remove him from office."
politics,"If impeached, it goes on trial in the Senate, who may find him Guilty or Not Guilty. If found Guilty, the power would be stripped immediately."
politics,"The entire Devin Nunes involved debacle about people being ""unmasked"" during investigations."
Python,Yes!
politics,I do not believe there was an emergency declaration involved at this time.
politics,Yes it is totally irrelevant! Just giving further info.
politics,"It should be noted that the 17th amendment to the constitution afforded us citizens the right to vote for senators - they used to be selected by the state legislatures.

Edit 19th to 17th."
chemistry,Of course. Thanks!
chemistry,Thanks!
ModSupport,I am interested in enrolling as someone who can assist other subreddits if needed.
politics,Thanks.
politics,Can you give some examples of these posts for my knowledge?
politics,This is a thing in Seattle! https://www.seattle.gov/democracyvoucher/about-the-program
Python,"Could it be using noise, such as /dev/random getting ""noise"" from device drivers - or even reading /dev/random on some types of OS?

[https://en.wikipedia.org/wiki//dev/random](https://en.wikipedia.org/wiki//dev/random)"
politics,We can do multiple things at once.
politics,I would disagree that it is a privileged thing as thousands upon thousands of less-well-off immigrants are bilingual.
instantpot,"Yes. Your instant pot still wants time to depressurize slowly - opening the valve immediately causes it to depressurize fast. (This won't break things, just makes noise and maybe a mess and some scalding.)

You should notice a timer start after you finish any pressure cooking method. Let this counter go up for a bit before opening the lid or depressurizing manually.

I suggest you retest again and wait some time after the process completes before proceeding."
politics,A cost is a factor. You can say you like something but think it costs too much.
politics,"First paragraph of the article:

>Nearly a year after U.S. Rep. Duncan Hunter suggested his wife was to blame for their alleged misuse of $250,000 in campaign funds, Margaret Hunter pleaded guilty Thursday to a single corruption count and agreed to testify against her husband at his upcoming trial."
politics,"Regular posts sort by best, megathreads sort by new."
politics,Trump doesn't own the company that was subpoenaed.
politics,">Hoyer added that Democratic leaders are assembling a package of contempt resolutions that would be approved at one time, although there is no timetable on what that will reach the floor."
politics,"Click comment, should have a reply button or arrow."
politics,"It was restored.

https://www.reddit.com/r/politics/comments/bja2t9/mueller_told_the_attorney_general_that_the"
politics,"Here you go!

https://crosscut.com/2019/04/wa-democrats-vote-use-presidential-primary-not-caucuses-choose-2020-nominee"
politics,Thanks
politics,Thanks
politics,I don't think he's part of the gang of 8 now that he is no longer Intelligence panel chairman.
AskReddit,"My cup being empty of water every time I am thirsty.

Gotta get up I guess."
politics,Try opening the article in an incognito/private tab.
politics,"Hello!

I was wondering what sort of actions you would take to help further scientific literacy within America?"
politics,What would you say opened the door for this career - how did you get your start?
AskReddit,"So in normal life there are two layers: reality and your inner thoughts. My first time on LSD had three layers: reality, my inner thoughts, and my point of view at the time (basically behind those two and ""looking"" at them).

I guess in sober reality you have this as well, which would kind of be the way you react to your emotions.

That was trippy."
LateStageCapitalism,To be fair the Obama administration ordered the US Government to move away from private prisons (...at the end of their admin time) and then Sessions cancelled it during the Trump Admin.
politics,Oh. My apologies for misunderstanding you then!
politics,"I have personally had medical staff give me a new doctor because I didn't trust them. Then again they gave me anti-biotics for what turned out to be allergies.

The lowest GPA of a graduating doctor in a class is still called a doctor. You should trust initially, but should also consider the fact they may not be the best for you.

Vaccines, however, is pure science you can research without asking a doctor. They are fine and safe."
politics,"I think the assumption is the doctors who have had pharmaceutical reps visit their office push those particular pills. I don't think this person is saying doctors lie about vaccines.

There is a trope of anti-intellectualiam that is pervasive in parts of US society. This may be what sub-OP was referencing."
smashbros,"Yes. You down-a with Yoshi to do a lot of damage quickly, then bat smash. I loved having the highest score on the console."
politics,Same in WA.
politics,Networks will show it immediately following.
AskReddit,It's not that hard to type all 10 digits of a US phone number. Local dialing is legitimately going to no longer be supported soon. Quit asking us to troubleshoot.
JusticeServed,That's Windows XP on that screen right there.
politics,This seems like a rather large crime. Interesting story.
politics,"Hi `MmmmikeHhhh`. Thank you for participating in /r/Politics. However, [your submission](https://old.reddit.com/r/politics/comments/a6cjly/-/) has been removed for the following reason(s):

* [Out of Date](https://www.reddit.com/r/politics/wiki/index#wiki_articles_must_be_published_within_the_last_calendar_month): /r/politics is for **current** US political news and information that has been published within the the last calendar month. For example, if the date is January 29 and the article submitted was written before December 29, then the submission is out of date.



If you have any questions about this removal, please feel free to [message the moderators.](https://www.reddit.com/message/compose?to=/r/politics&subject=Question regarding the removal of this submission by /u/MmmmikeHhhh&message=I have a question regarding the removal of this [submission.](https://old.reddit.com/r/politics/comments/a6cjly/-/?context=10000\))"
politics,"Hi `7AV4`. Thank you for participating in /r/Politics. However, [your submission](https://old.reddit.com/r/politics/comments/a5vums/-/) has been removed for the following reason(s):

* [Out of Date](https://www.reddit.com/r/politics/wiki/index#wiki_articles_must_be_published_within_the_last_calendar_month): /r/politics is for **current** US political news and information that has been published within the the last calendar month. For example, if the date is January 29 and the article submitted was written before December 29, then the submission is out of date.



If you have any questions about this removal, please feel free to [message the moderators.](https://www.reddit.com/message/compose?to=/r/politics&subject=Question regarding the removal of this submission by /u/7AV4&message=I have a question regarding the removal of this [submission.](https://old.reddit.com/r/politics/comments/a5vums/-/?context=10000\))"
politics,"Hi `porkbelly-endurance`. Thank you for participating in /r/Politics. However, [your submission](https://old.reddit.com/r/politics/comments/a5p4w5/-/) has been removed for the following reason(s):

* Your headline must be comprised only of the **exact** copied and pasted headline of the article - [see our rule here.](https://www.reddit.com/r/politics/wiki/index#wiki_do_not_create_your_own_title)) **We recommend not using the Reddit 'suggest a title' as it may not give the exact title of the article.**

* The ALL CAPS and 'Breaking' rule is applied **even when the actual title of the article is in all caps or contains the word 'Breaking'**. This rule may be applied to other single word declarative and/or sensational expressions, such as 'EXCLUSIVE:' or 'HOT:'. [click here for more details](/r/politics/wiki/index#wiki_do_not_create_your_own_title)



If you have any questions about this removal, please feel free to [message the moderators.](https://www.reddit.com/message/compose?to=/r/politics&subject=Question regarding the removal of this submission by /u/porkbelly-endurance&message=I have a question regarding the removal of this [submission.](https://old.reddit.com/r/politics/comments/a5p4w5/-/?context=10000\))"
politics,"Hi `skoalbrother`. Thank you for participating in /r/Politics. However, [your submission](https://old.reddit.com/r/politics/comments/a5nmx0/-/) has been removed for the following reason(s):

* [Off-Topic](https://www.reddit.com/r/politics/wiki/index#wiki_the_.2Fr.2Fpolitics_on_topic_statement): All submissions to /r/politics need to be explicitly about **current US politics**.

 



If you have any questions about this removal, please feel free to [message the moderators.](https://www.reddit.com/message/compose?to=/r/politics&subject=Question regarding the removal of this submission by /u/skoalbrother&message=I have a question regarding the removal of this [submission.](https://old.reddit.com/r/politics/comments/a5nmx0/-/?context=10000\))"
politics,"Hi `jingooftherex`. Thank you for participating in /r/Politics. However, [your submission](https://old.reddit.com/r/politics/comments/a5l1ji/-/) has been removed for the following reason(s):

* [Out of Date](https://www.reddit.com/r/politics/wiki/index#wiki_articles_must_be_published_within_the_last_calendar_month): /r/politics is for **current** US political news and information that has been published within the the last calendar month. For example, if the date is January 29 and the article submitted was written before December 29, then the submission is out of date.



If you have any questions about this removal, please feel free to [message the moderators.](https://www.reddit.com/message/compose?to=/r/politics&subject=Question regarding the removal of this submission by /u/jingooftherex&message=I have a question regarding the removal of this [submission.](https://old.reddit.com/r/politics/comments/a5l1ji/-/?context=10000\))"
wholesomememes,I feel like I am the kind of person that just says yes to be nice. :/
politics,"Hi `ixiduffixi`. Thank you for participating in /r/Politics. However, [your submission](https://old.reddit.com/r/politics/comments/a3hdii/-/) has been removed for the following reason(s):

* Your headline must be comprised only of the **exact** copied and pasted headline of the article - [see our rule here.](https://www.reddit.com/r/politics/wiki/index#wiki_do_not_create_your_own_title)) **We recommend not using the Reddit 'suggest a title' as it may not give the exact title of the article.**

* The ALL CAPS and 'Breaking' rule is applied **even when the actual title of the article is in all caps or contains the word 'Breaking'**. This rule may be applied to other single word declarative and/or sensational expressions, such as 'EXCLUSIVE:' or 'HOT:'. [click here for more details](/r/politics/wiki/index#wiki_do_not_create_your_own_title)

You are welcome to resubmit your link, but please follow the submissions rules listed in the sidebar.



If you have any questions about this removal, please feel free to [message the moderators.](https://www.reddit.com/message/compose?to=/r/politics&subject=Question regarding the removal of this submission by /u/ixiduffixi&message=I have a question regarding the removal of this [submission.](https://old.reddit.com/r/politics/comments/a3hdii/-/?context=10000\))"
politics,"Hi `Just_Curious_512`. Thank you for participating in /r/Politics. However, [your submission](https://old.reddit.com/r/politics/comments/a3hdik/-/) has been removed for the following reason(s):

You are welcome to resubmit your link, but please follow the submissions rules listed in the sidebar.



If you have any questions about this removal, please feel free to [message the moderators.](https://www.reddit.com/message/compose?to=/r/politics&subject=Question regarding the removal of this submission by /u/Just_Curious_512&message=I have a question regarding the removal of this [submission.](https://old.reddit.com/r/politics/comments/a3hdik/-/?context=10000\))"
hockey,In 1917 Seattle was the first US team to win the Stanely Cup. Time to bring it back.
politics,"Hi `romans310`. Thank you for participating in /r/Politics. However, [your submission](https://old.reddit.com/r/politics/comments/a0295x/-/) has been removed for the following reason(s):

* [Off-Topic](https://www.reddit.com/r/politics/wiki/index#wiki_the_.2Fr.2Fpolitics_on_topic_statement): All submissions to /r/politics need to be explicitly about **current US politics**.

 



If you have any questions about this removal, please feel free to [message the moderators.](https://www.reddit.com/message/compose?to=/r/politics&subject=Question regarding the removal of this submission by /u/romans310&message=I have a question regarding the removal of this [submission.](https://old.reddit.com/r/politics/comments/a0295x/-/?context=10000\))"
politics,"Hi `fu__thats_who`. Thank you for participating in /r/Politics. However, [your submission](https://old.reddit.com/r/politics/comments/a01m4j/-/) has been removed for the following reason(s):

* Your headline must be comprised only of the **exact** copied and pasted headline of the article - [see our rule here.](https://www.reddit.com/r/politics/wiki/index#wiki_do_not_create_your_own_title)) **We recommend not using the Reddit 'suggest a title' as it may not give the exact title of the article.**

* The ALL CAPS and 'Breaking' rule is applied **even when the actual title of the article is in all caps or contains the word 'Breaking'**. This rule may be applied to other single word declarative and/or sensational expressions, such as 'EXCLUSIVE:' or 'HOT:'. [click here for more details](/r/politics/wiki/index#wiki_do_not_create_your_own_title)



If you have any questions about this removal, please feel free to [message the moderators.](https://www.reddit.com/message/compose?to=/r/politics&subject=Question regarding the removal of this submission by /u/fu__thats_who&message=I have a question regarding the removal of this [submission.](https://old.reddit.com/r/politics/comments/a01m4j/-/?context=10000\))"
politics,"Hi `WingedMercy`. Thank you for participating in /r/Politics. However, [your submission](https://old.reddit.com/r/politics/comments/9zcw3b/-/) has been removed for the following reason(s):

* Your headline must be comprised only of the **exact** copied and pasted headline of the article - [see our rule here.](https://www.reddit.com/r/politics/wiki/index#wiki_do_not_create_your_own_title)) **We recommend not using the Reddit 'suggest a title' as it may not give the exact title of the article.**

* The ALL CAPS and 'Breaking' rule is applied **even when the actual title of the article is in all caps or contains the word 'Breaking'**. This rule may be applied to other single word declarative and/or sensational expressions, such as 'EXCLUSIVE:' or 'HOT:'. [click here for more details](/r/politics/wiki/index#wiki_do_not_create_your_own_title)



If you have any questions about this removal, please feel free to [message the moderators.](https://www.reddit.com/message/compose?to=/r/politics&subject=Question regarding the removal of this submission by /u/WingedMercy&message=I have a question regarding the removal of this [submission.](https://old.reddit.com/r/politics/comments/9zcw3b/-/?context=10000\))"
politics,"Hi `simplelifestyle`. Thank you for participating in /r/Politics. However, [your submission](https://old.reddit.com/r/politics/comments/9yvsva/-/) has been removed for the following reason(s):

* [Off-Topic](https://www.reddit.com/r/politics/wiki/index#wiki_the_.2Fr.2Fpolitics_on_topic_statement): All submissions to /r/politics need to be explicitly about **current US politics**.

 



If you have any questions about this removal, please feel free to [message the moderators.](https://www.reddit.com/message/compose?to=/r/politics&subject=Question regarding the removal of this submission by /u/simplelifestyle&message=I have a question regarding the removal of this [submission.](https://old.reddit.com/r/politics/comments/9yvsva/-/?context=10000\))"
politics,"Hi `simplelifestyle`. Thank you for participating in /r/Politics. However, [your submission](https://old.reddit.com/r/politics/comments/9yvsva/-/) has been removed for the following reason(s):

* Your headline must be comprised only of the **exact** copied and pasted headline of the article - [see our rule here.](https://www.reddit.com/r/politics/wiki/index#wiki_do_not_create_your_own_title)) **We recommend not using the Reddit 'suggest a title' as it may not give the exact title of the article.**

* The ALL CAPS and 'Breaking' rule is applied **even when the actual title of the article is in all caps or contains the word 'Breaking'**. This rule may be applied to other single word declarative and/or sensational expressions, such as 'EXCLUSIVE:' or 'HOT:'. [click here for more details](/r/politics/wiki/index#wiki_do_not_create_your_own_title)



If you have any questions about this removal, please feel free to [message the moderators.](https://www.reddit.com/message/compose?to=/r/politics&subject=Question regarding the removal of this submission by /u/simplelifestyle&message=I have a question regarding the removal of this [submission.](https://old.reddit.com/r/politics/comments/9yvsva/-/?context=10000\))"
