subreddit,body
malelivingspace,"Bathroom:

* Plunger - Buy it before you need it
* Toilet Brush
* Bath mat.  Dangerous to have a wet floor

Kitchen:

* Pots/pans - start with a skillet and a pot big enough for boiling things.
* Dish towels.  I always have one hanging around for easy use.
* Trash can.
* Recycle bin.
* Anything else is going to be really dependent on what you cook.  Some people can't live without a rice cooker, others need a colander, others would die without a tea kettle or coffee pot.  Limit the gadgets though, you don't need a food processor, a juicer, or a $500 blender.

Extras:

* First aid kit.  Make a nice one, read some online guides.  You won't use it much, but you should have it.
* Basic tools.  Screwdrivers, an adjustable wrench, etc.  Just get the absolute basics, and let it grow as you need them.  Really, screwdrivers and whatever you need to assemble your bed are probably enough for now."
vegetarian,"This is why I think the meatless monday trend has the biggest impact.  It's really hard to convince someone to give up meat, but it's easy to have someone eat something different once a week.  

If I talk to 100 people, *maybe* one of them would consider vegetarianism seriously.  But, I could easily get 7 of them to not eat meat one day a week.  And in terms of impact, those are nearly equivalent."
pics,"It is a complicated issue.  People try to pretend it's not so that they can feel justified in doing awful things.

Is asking someone to murder another protected free speech?  Is telling someone to kill themselves protected free speech?  Is threatening someone protected free speech?  Is yelling fire in a crowd protected free speech?"
pics,"> [The television host is] a bit of a stretch. Unless it's a call to action, and attempting to mobilize others to harm you

Stochastic terrorism is a thing.  Fox and the republicans do it all the time.  There is a reason that planned parenthood shootings happened after the republican debates spent weeks calling abortion doctors murderers.  There is a reason that someone murdered Tiller after Bill O'Reilly spent so long calling him ""baby killer"".

If you talk to enough people, statistically one of them will be crazy.  And if you tell enough people that someone is evil, eventually one of the crazy people will take action.

> How does a private individual, separate from a government, infringe on your rights?

Well, the simple answer is that it's easy for a private individual to violate your 13th amendment rights.  

Medium difficulty answer is that a coffee shop operating on government property that refuses to sell to black people is violating their 14th amendment rights.

Difficult answers:

What do you call rights, do you have an enumerated list?  The Declaration of Independence suggested that the pursuit of happiness was one.  Sexual harassment and hostile work environment for example can take away your ability to pursue happiness if you have no other job options.  Does verbal assault at a park take away that right?  What if people are on every street corner, every school, every library, on the street outside your house, and in your workplace?  Are your rights being infringed then?

Do you have the right to an education?  Someone speaking freely, loudly, and often in class may disrupt your education and take away that right.  A student verbally harassing you in class may take away your ability to learn in that environment.

Is your right to exist infringed if everywhere you go people call you inferior and worthless?  It's irresponsible to deny human psychology, and we are all actually emotionally very fragile.  Goading people into suicide is a thing.  Verbally harassing LGBT people until they feel so worthless that they kill themselves is a real issue.  Does beating someone to death violate their rights?  Is verbally assaulting someone until they commit suicide really any different?

Are the Westboro Baptists violating your rights by calling a deceased loved one slurs during a funeral?  That's complicated and not easy to answer.

> I would argue that there should be no context [...] unless [...]

""unless""...  That's the point.  It's not an absolute.  The discussion is where that line should be.  And you just agreed that it's not an absolute.  

> Just because someone else doesn't like what you say and doesn't think you should be able to say it in public, doesn't mean you shouldn't be able to say it or that it should be criminally punishable.

Since we already agreed that some speech should not be allowed at this point, we are just arguing what is and is not protected.  Obviously ""down with the government"" is an incredibly important right.  But is ""kill all the ___"" equally valuable?  Is looking someone in the eye and telling them that they are worthless and not welcome valuable?  Is it still valuable when they are talking about your skin color or religion?  Is it valuable when it's someone with 10 million followers telling it to you in front of all of them?

Hiding behind an absolute is dangerous."
pics,"Most of the people trying to criminalize hate speech are not trying to make blanket bans, only context specific bans.  Like your boss calling you racist names infringes on your rights.  A politician representing you in government saying hateful things could be argued to be infringing on your rights.  A television host with 10 million viewers each night calling you evil, because of your membership to a protected class, could be argued to be endangering you, or advocating for the removal of your rights.  Do you have the ability to pursue happiness if people on the television are inciting violence against you everywhere you go?  Do you truly have 'liberty' if you are afraid to leave your home?  Free speech is a very complex issue.

It's very difficult to find someone who wants to make it illegal to be racist in your own home."
politics,"Man, government is the worst just taking away these American's benefits.  We should get rid of all this terrible government.

  - Republican voters"
AskReddit,"LSAT is multiple choice, and most people self study for it after a typical American education.  LSAT also has an essay section, but it's not scored."
malelivingspace,"> Things that people always forget to buy before moving in?

The very first thing in your apartment should be toilet paper.  The second should be a plunger.  Toilets will get used during move-in, and it's always unpleasant to go and not have either, especially with others around.

Other disposables are often forgotten early, but nothing critical.  Shower curtains, paper towels, cleaning supplies, brooms, dust pans, etc.  It's nice to have cleaning stuff handy when your are unpacking to be able to clean things when you first see them.

> Tips to make the transition smoother as I'm also balancing a full-time job at the same time?

Depending on how much stuff you have, it will take a long time to unpack and organize.  So make sure you stage stuff in a place that is not in the way, but accessible.  You don't want to be searching through boxes while making dinner after a long day.  Also, get as much done as early as possible.  The longer you wait, the easier it is to put it off longer."
pics,"> but it’s also none of the guvment’s damn business what two people do in their own home

And that is why the republican messaging is always about ""government is forcing me to marry gay people"" or ""the gays are trying to change the meaning of my marriage""  Leadership knows that most people really don't care what people do in their homes, so they have to find a way to make it sound like it's an attack on you."
malelivingspace,"Rule of thumb is anything under 30% of your gross income is considered ""affordable"".  Obviously, the less you spend, the more money you can save to eventually buy a place, contribute to your retirement, take trips, or have fun.

Commute time is a big deal though, so make sure it works with your lifestyle.  I used to live 20 minutes from work, and that made lunch-time errands difficult.  20 minutes home, 20 minutes back to work, only leaves 20 minutes to get stuff done over a lunch hour.  What value you place on that is really personal.  For me, commute time is worth about $300/month ($3600/year).  Which prices my commute time at something like ~$21/hour.  But with wear and tear on my car, gas, my real cost for commute time is different.  If your commute is 15 miles, and you get 30mpg, that's 1 gallon of gas to commute per day.  @$3/gallon, that's $61/month in gas.

Also depends on your lifestyle.  I like walking around a city, so I pay a premium to live in a city that entertains me.

SO:

* If only one place is affordable, go with that place.
* If both places are affordable, look at commute time.
* Price your commute in terms of $.  Gas, car repair, value of your time.
* How much are you willing to spend to be in a particular area
* Are there other things you want, and what is the value of those things.

Add that all up, and you will find a winner."
AbandonedPorn,"Well I think everyone has covered that this is not an original stage coach.  But it is still a cool find.  I wonder where they found it (this photo has been around online for a while).

However, the thing no one has noted is that even if the plywood was a repair, we still know it's still not a real one because of the *front* wheels.  If the front wheels were that large, it wouldn't be able to turn, as they would rub against the sides of the carriage.  That's why front wheels are always smaller."
conspiracy,"> I could explain to you the various types of CNC machines available today.,,but there is absolutely nothing that exists on that mega scale that could handle those multi ton polygonal stones.

Ive built CNC machines...  It's not hard to scale them up, and they are custom made all the time in large factories overseas.  Milling machines have to be large enough to make ship's engines.  Those engines are MASSIVE, and have many parts that are precision machined.  The crankshafts on them are often a single piece, extremely heavy, and have to be very precise rotationally.  

FOR EXAMPLE: http://www.mtsq.co.uk/waldrichsiegen/

That has milling machines capable of handling 10m X 10m, and lathes that can handle 500 tonnes with a diameter of 7m.

The largest stones in the walls you are talking about are smaller than that.  And that machines I linked are capable of higher precision than those stones.  It's also not the largest one in existence by any stretch.

> to get all the other stones to fit around that one, and all the others to fit around that one is a mind bender all on its own.

Today with modern modeling software, it's a pain sure, but far from impossible.  Back then, they probably did a sanding fit.  They place one block, then set the next one on top of it and push it back and forth until the texture of the stones sand themselves into two matching faces.  Lots of work, sure, but human labor was ""cheaper"" back then."
conspiracy,"Not sure why you think CNCs can't do this today...  A lot of decorative stonework is carved by cnc, and they can achieve tollerances higher than is needed for these stones.  Example from youtube: 
 https://www.youtube.com/watch?v=jvQnZWoGv3U"
conspiracy,"> why? Because no one knows how to make them.

We know how to make them, the problem is cost.  3 ways to make polygonal blocks:

1. Modern tools - CNC Just put the rock in the cnc and click go.  Easy.  Takes a long time, and the CNCs are expensive.
2. Hand carving the same way we do sculpture.  Measure, chisel, measure again, etc.  Takes even longer, and human labor is a lot more expensive than it used to be.
3. The way they probably made these:  The rocks are heavy enough to crush small protrusions, and sand down bigger bumps if you slide the rocks back and forth until they meet flat.  Problem is that takes even more man power, and is a lot of work.

We can make things with much higher precision these days, and modern skyscrapers have much more complex materials than these stones.  We don't use polygonal stones due to weight, cost, and generally it's not in vogue.  Building solid masonry is long gone because those buildings have poor thermal performance, are high cost, and you can only build so tall before it becomes impractical.

> But, it was TECHNOLOGY that created these blocks.

I am not yet convinced that it was anything more than a clever process (like using the block's own weight to sand the sides flat).  That is technology, but I get the impression you are talking about something more interesting."
Portland,"> The fact that it's based on number of people in Congress, which is itself a compromise of big vs small, is also a pretty big clue.

comeon, read my comment thoroughly...  It's only based on the congressional apportionment because some people decided to do an EC instead of popular vote.  You are making a post-hoc-ergo-propter-hoc fallacy here.  The apportionment was a compromise to make EC more palatable and fix it's flaws, it was not the defining feature of EC.

> Having a limit to senators/representatives does nothing to change the trends in a popular vote scenario, only the EC scenario.

It does nothing to change a **National** popular vote scenario, which is why I want a national popular vote.  That's kind of a big part of my argument.  I feel like you are skimming my replies without reading actively.

> Seems fairly narrow-scoped to me.

Ehhh, it's not that narrow given that the SCOTUS previously ruled that non-citizen border access effects citizens (visiting family, academia, business, etc.).  But either way, it still does cover your hypothetical pork import scenario.  :)

> What laws have been passed that disproportionately affect city people?

Tax Laws, government shutdowns, bailing out farmers due to the republican tariffs (farmers are getting more than they lost, and guess who's paying...), Social services funds come from cities and pay rural areas, fossil fuel extraction, alternative energy funding, water laws, Public transit gutting, public land privatization, I could go on for days.  There are thousands of issues where urbanites and rural hicks are opposed and the republicans always side with the rural folk.

Remember, rural areas take more tax money than they generate.  And yet rural people go out of their way to cancel funds for projects that help cities while demanding more investment in their own areas.  You have to think at the second order impacts to really understand the disparity.

> It says it will put its Electoral Votes towards the candidate that wins the popular vote, not do away with the Electoral College.

That's a distinction without a difference in practice, and you know that.  There is no functional difference between a national popular vote, and awarding a majority of electors to the winner of the national popular vote.

> So by superseding the vote that takes place within the state. That hardly is fair to rural areas.

How is that any different than today's system?  Burns already gets overruled by Portland.  And a rural state would only get overruled if their electors were going to be overruled anyway.  

Stop using ""rural voters"" as a shield."
Portland,"> If the president is about country-wide agreement, then shouldn't it be about area and not about population? 

No?  The population of the United states doesn't change if you are in NYC or Antelope.

> The issue that the EC is aiming to resolve is that

**NO**  The electoral college was implemented to solve the issue of a popularly elected president being too close to a king.  And that worried the founders.  Thus they (well half anyway) wanted to separate the president from the popular vote.  So they made electors.  They also didn't want low-information voters choosing a president so they wanted to send people to debate rather than let uninformed people choose.

Having electors has nothing to do with small states vs. large states.  The number of electors takes that into account because small states didn't want to be drowned out in the DEBATE at the CONVENTION.  

But now, we have a pseudo-popular vote, so the electors are not filling their purpose.  The electors don't debate at the convention, so small states don't get drowned out.

> This means that eventually every direct vote election will end up with the urban mindset winning

**NO**

1. The population of the United States will never become infinite.  
2. There is a minimum number of senators (2), a minimum number of congressmen (1), and a maximum number of total congressmen.  THUS each year city voters have less and less say while rural voters have more and more say.  

> creating a tyranny of the majority

**NO** Won't happen, because the rural states still have the senate.  And the senate is the body that votes to confirm the cabinet and SCOTUS, as well as being half of the legislature.

>  In a majority Christian country, we can't create a law that says your tax rate will be inversely related to your amount of pork consumption because that would disproportionately affect Muslim and Jewish populations, and religion is protected.

Funny you should mention this.  Because of the Republican/Trump SCOTUS judges, this can TOTALLY happen now.  Trump v. Hawaii decided that as long as there is a facially legitimate purpose behind a law, it doesn't infringe religious rights, even if they admitted on tape that it was designed with religiously discriminatory purpose.

> If someone's platform was basically ""Screw those country bumpkins over to make urban life better!"" there would be no recourse for the rural population should that person win and follow through with that promise.

The current government though is running on ""screw the city folk"".  So you are throwing the majority of the population under the bus because you decided that rural people are more valuable.

> abolishing the EC is not going to happen, as the EC is mandated by the Constitution and would therefore require 2/3rds of the states (34 states) to ratify it.

You are literally commenting on an article about a law that was passed in Oregon that can do away with the electoral college without a constitutional amendment.

> We all agree that plurailty-take-all is probably the worst way of granting votes, right?

Nationally?  No, we don't agree on that at all.  I want the presidency to be decided by a national popular vote because that's what half the founders wanted, and the current system is far, far worse than that.

> How would you propose that votes are counted within the EC to make it more reflective of popular vote?

**The way described in the article you are commenting on.**"
politics,"Supreme court will just ignore inconvenient evidence like they did with the muslim ban.  So let me guess their response by pulling from Trump v. Hawaii and updating it for the situation:

> *We limited our review to whether the* Lawmaker *gave a ""facially legitimate and bonafide"" reason for it's action.  Given the authority of the* legislative *branches over* redistricting, we hold that *the courts will neither look behind the exercise of that discretion, nor test it by balancing its justification against the asserted* legislative *interest.*

In other words:  We found some old books that said facially, and that sounds lawyerly enough that you probably won't realize we are ignoring evidence and giving you the middle finger."
Portland,"What a lot of people are missing though, is that the president is a check/balance to the house and senate.  And thus should be chosen differently.  The president represents the *whole* country, and by tying the president to congress+senate, you are only reinforcing the power of people currently in power in those areas, and marginalizing those who currently lack political power in the house and senate.  

The President appoints and the senate confirms.  Thus you don't want them representing the same sub-groups of people.  You want them to represent different blocks so that choices that affect the whole country are general compromises.  Just look at the scotus.  A majority of Americans are unhappy with the choices, but because Republicans control rural states, they have outsized influence in BOTH the senate and Presidency.  Thus, they were able to appoint candidates to the SCOTUS without compromise, AND with a minority of the country's support.  Electing the President differently would insure a compromise pick rather than a partisan one.

The EC was intended to be a debate amongst electors at the convention who were chosen for their ability to get information that normal people wouldn't, and choose someone to act as a legislative check to the house and senate.  However, the EC today is not a debate (elector's votes are tied to the poll results), the convention is more a formality than an actually useful event, the people themselves aren't doing the research that the electors were supposed to do for them, Electors are only chosen because of their ability to vote for the winning candidate, and the president chosen is not a check on the power distribution of the senate and house.  So the electoral college is a complete failure for what it set out to do.

> it makes sense to have the state popular vote determine the 2 ""Senator"" votes, and then the popular vote within each district determines their ""Representative"" vote.

Okay, issues:

* Like you pointed out, this is ripe for gerrymandering.  And unlike you, I don't think there is hope for ever moving away from FPTP.  Nor do I think voting methods would change gerrymandering, since that is done by moving boundaries of like-minded individuals through cracking and packing.
* Community level already has representation in the house.  The president is about county-wide agreement.  Farmers in Oregon share some legislative needs with farmers in Missouri, but both groups can be marginalized by district lines in their states.  Popular vote lets those farmers vote as a block.
* Something like 40% of LA voted for Trump, but 0% of their votes helped Trump.  Conversely, loads of people in rural Tennessee vote for the Democratic candidate, but 0% of their votes help democrats.  These are wasted votes.  Popular voting makes LA's 40% Republican actually matter in national politics.  
* Congress has a capped number of seats **AND** a minimum.  This means that no matter how you divide it up, some votes count more than others in the president and house.  Montana, Texas, and California are underrepresented on a per-capita basis.  I think it's Delaware and wyoming that are most overrepresented on a per-capita view.  By tying presidential votes to the number of house seats, you are compounding the inequity introduced by the capped number of house seats.  California's 40 million residents are all under-represented.  And because rural places are overrepresented, that gives rural people oversized representation in the SENATE, HOUSE, **AND** PRESIDENT.  The original idea was to give them just the Senate, instead they have all three.
* Modern life isn't as tied to a physical location as it used to be.  I can work remote from Portland with people in SF, Boston, and Miami.  People can make daily trips across the country for meetings.  People have vacation cabins in different states.  Popular vote makes more sense to represent the highly mobile population we have today.

Making the president a popular vote would fix those issues and can be done without amending the constitution (via this interstate compact).  The electoral college has failed to prevent all the things it was designed to, and is actively making things worse.  It's time to re-evaluate our government like the founders expected.

------------

My ideal would be:

* President as popular vote.
* Better voting system.  I prefer something like the Schulze method personally.
* Make the house back to 30k people per rep.  Harder to gerrymander smaller districts, Harder to bribe larger number of reps, harder to make votes come down to 1 or 2 people with more people."
Portland,"Because there is supposed to be balance in the legislature.  Senate prevents rule by majority, Congress prevents rule my minority (assuming gerrymandering is fixed)."
Portland,"> We want ~~everyone's~~ Pennsylvania's and Florida's voice to be heard which is what the electoral college does.

FTFY"
Portland,">  I am worried about stripping small states of all of their power.

That's what the senate is for."
politics,"> This is a game, and Nancy has shown she knows how to play it.

Has she?  Her track record is far from spotless, and just blindly getting behind her is dangerous for the health of the party.  

Democrats lost loads of seats under her watch.  If you listen to people like Hillary, the party effectively died during the Obama years, and it's hard to let Nancy escape partial blame.  Under her watch, the republicans ran the government while she was the minority too.  Under her watch, the republicans ran the government from the minority.  She reached across the aisle long after the republicans made it clear they never would reciprocate.  Recently she publicly poo-poo'd impeachment when there are a thousand reasons to impeach.  She is still letting the Republicans run the media after years of their lies.  She is partly to blame for letting bush et-al walk away scot free.  She was in the house during iran-contra, but apparently didn't learn anything.  She doesn't address any of the dirty tricks the republicans do.

She may be better at passing a budget than the republicans, but she refuses to play dirty for the good of the country."
