subreddit,body
midcentury,"Thanks for the help.

I can't go by the price because I have found a lot with different makers:

Korup Stolefabrik:     
http://antiqimmacdesign.canalblog.com/archives/2016/04/01/33604151.html

K.S Mobelfabrik:    
https://www.1stdibs.com/furniture/seating/dining-room-chairs/set-of-six-dining-chairs-stamped-ks-mobelfabrik/id-f_1032378/

And then this site https://www.meubliz.com/fabricant_meuble/korup_stolefabrik_ks_mobler/ says that korup and mobler are the same company???

Im too confused"
midcentury,"Do you have any source that I can verify that with?  

I've seen that and other designers and makers on various auction and antique sites, but nobody has anything concrete"
midcentury,"Also, Does anyone know good sources for reproduction fabric?  two of the chairs need to be reupholstered, and I would like to keep the same material if possible."
midcentury,"Attached are some images of the same model chairs I have, just with a different seat fabric and darker color.  

So I got a set of chairs that I love, and I can't find any definitive information on who made them.  I don't know what the K.S. logo stands for (have seen lots of different meanings searching google), but the most common is ""K.S. Møbelfabrik"" and ""korup stolefabrik"".  Though I can't find much on either of their stamps to know what is correct.
I don't see it on the design museum's search, and I don't know how to look up the stamp.  

As far as designers go, I have seen a few different people attached to it in various listings (kai is the most common, but I can't find any proof of that)

Any help would be appreciated."
specializedtools,"Because of the way locks work, you can throw out a lot of combinations before even getting to the unlikely combinations.

For example, in a standard cheap combination lock your third number cannot be greater than the second number and you can't have duplicate numbers.  So, although a lock with 100 digits and 3 numbers to input has 1M total possible combinations, using just those two restrictions reduces the possible combinations by over half."
todayilearned,"But previous bets have everything to do with whether or not the lottery company will make money on a current jackpot.

Expected value on a single lottery draw can, and often does, exceed the cost of a ticket.  The lottery company doesn't lose money on those draws because that jackpot is the combination of several lottery draws.  

In the USA, for the powerball lottery, the jackpot starts at something like $40million with a drawing twice a week and keeps growing until someone wins.  That can take months sometimes leading to jackpots of several hundred million dollars.  

The odds of winning the jackpot are something around 1:300,000,000 and a ticket costs $2.  So if the jackpot exceeds $600Million, your expected value is greater than the cost of the ticket.  BUT the lottery doesn't lose money because that jackpot is the result of several lottery draws."
todayilearned,Results of a bet have nothing to do with the expected value of a bet...
todayilearned,"> The expected value of each ticket cannot exceed the cost of the ticket without the lottery company losing money.

This is incorrect because lotteries have rolling jackpots.  

In most lotteries if there is no jackpot winner, the pot from that game is added to the next game.  So, to turn a profit they only need to have an expected value less than the cost of the ticket for the *incremental value* of the jackpot, not the *total* jackpot."
cartoons,"That phrase gets close, but still no dice...

The tex avery world of tomorrow cartoons (house of tomorrow, car of tomorrow, farm of tomorrow) are really similar to what I remember, but they aren't specifically about the ""year 2020"""
cartoons,"I love those, but the ones I remember are similar to the Tex Avery The World of Tomorrow series."
IdiotsInCars,https://media.giphy.com/media/S9XaGr8wQ9Jwk/giphy.gif
malelivingspace,"I see an aloe vera on the top shelf, and what looks like a zz plant on the tv stand. I am guessing the corner plant is a dracena deremensis. Not sure what is the other big one on the floor, but you could get something similar with a bird of paradise plant, peace Lilly, or cast-iron plant."
malelivingspace,"None of those look like anything exotic.  I see an aloe vera on the top shelf, and what looks like a zz plant on the tv stand.  I am guessing the corner plant is a dracena deremensis.  Not sure what is the other big one on the floor, but you could get something similar with a bird of paradise plant, peace Lilly, or cast-iron plant.  You can find all of these at most nurseries, just expect to find ones a bit younger (read:smaller).

Go to your local nursery and grab some house plants that you enjoy.  Talk to the staff to get an idea of light requirements and maintenance.  If you go when they are slow, people are usually happy to talk about plants and offer suggestions.  Then just take care of it for a couple years until it fills out the space!"
conspiracy,"> I wouldnt place it as ""sides""

But that's the deflection that keeps this crap going...  The fact that one side, no matter how arbitrary that side is, shows that there is a difference between the groups.  It shows that there is a cause that needs to be addressed.

Just to break this down:

People have arbitrarily divided themselves into two groups, A and B.  Many people in Group B are doing something that people in group A generally aren't.

Observer-1: ""One side is doing bad stuff!!!""

Observer-2: ""sides don't exist, all people are idiots, problems are everywhere, there is no difference between A and B""

Observer-1: ""... Well, only B is doing it.  So..."""
politics,He also said that the aid was part of the quid pro quo in the questioning
conspiracy,"> We should be able to have ANY guns

Many many people disagree.  Which is why it's not a good thing to use as a base to build nonpartisan consensus.

> The entire point of 2a is to keep the government in check.

This is a side point unrelated to the discussion, but it's something that bothers me a lot.  The point of the second amendment is to keep the **Federal** government in check.  It's a minor, but very important difference.  Prior to 2008, this was agreed upon, but the gun lobby paid off politicians and judges until the republicans on the SCOTUS overturned established rulings based on flawed reasons (which they acknowledged) and ignored facts.

> Again both parties suck. We as people need to agree on this.

I guess my point is that you're picking issues that you feel strongly about and saying we need consensus about them.  But there is strong legitimate disagreement about a lot of these issues.  So I think if you're goal is to build nonpartisan consensus, we need to start elsewhere.  And there are more basic issues to address where there isn't such deep-rooted disagreement.

> It makes it hard to bribe people. I cannot see how you possibly could be against it.

This is going to get off topic, so I will just leave you with a couple reasons so that you can get an idea of why I wouldn't be readily on board with term limits.

1. It makes it easier to bribe people - If you can only work as a politician for a couple years, you need to make it count.  That means an increased incentive to line up cushy jobs when you are forced out in a couple years.  That means a greater incentive to take bribes to fund yourself when you are out of a job in a couple years.  
2. Being a politician is not something that a new person can be ultra effective at.  Just look at all the junior congressmen over the past 10 years and all the major problems they have caused.  Think of all the bills they unknowingly sabotaged by not understanding process.  When I vote for reps, I want someone who can work the system to my benefit.  Being loud and passionate != being effective.  
3. It's a small pool of people who are qualified and capable of being a good politician.  If someone gets elected who represents me well, I don't want to lose them just because of some arbitrary rule.  

One of the things to think about is that while most americans hate congress, they love their congressman.  Generally, we all want term limits because other people keep electing someone we don't like.  But that's what representative democracy is all about.  They elect someone they like, and you elect someone you like.  No matter how upset you are at their choice, it's still their choice.  

>  the problem is people play the ""my team good your team bad"" game

And why are they playing this game? Because money is paying to inundate them with this message.  Money is funding ""think tanks"" to support their candidate and divisive message.  Money is buying ads reinforcing hard divisions.  Money is hiding issues and increasing focus on others.  Money in politics is at or near the root of the issue.

> All of the above should not be a party issue it, it should be forced by the people.

But people don't agree on those things...  So who is going to force it?  These are things you care about, but not everyone agrees with you.  So it's not going to be forced, nor should it.  Just because it's an issue you feel strongly about does not make it nonpartisan..."
conspiracy,"> free speech

Republicans and democrats don't agree on this...  Republicans think that companies like facebook and twitter shouldn't be allowed to remove posts on their website they don't like.  Democrats think that stores shouldn't be allowed to deny someone service because or a protected class (masterpiece cake)

> guns

They DEFINITELY don't agree on this.  Republicans made the conversation an all or nothing situation, so there is no inbetween now.  If you want better background checks, you are anti-gun and want to confiscate hunting rifles from veterans.

> monopoly break ups

Ron paul (the person this post is about) doesn't think monopolies are real...  So you definitely won't be building a coalition with him on this issue.

> federal reserve removal

People definitely don't agree about this.

> congress term limits

Again, not a widely agreeable issue.  There are a lot of problems with term limits that many people (like me) will say negate the benefits.

-----

The problem with a lot of nonpartisan consensus issues is that we are all so taken by partisan talking points that 90% of people can't honestly consider issues objectively.  

What we should be fighting for (and trying to build nonpartisan consensus around) is getting money out of politics.  That way we can actually start to talk about issues without big money controlling the discussion.  But the problem with that is Republicans have decided that money is speech, and any infringement on that is an assault on average citizens rights."
politics,"> DACA **recipients** are still arrested far less [...]

Another thing about this article is that it's not even about recipients, it's about applicants...  So we have no idea how many people who have been arrested were accepted into the program.

> child immigrants who had **applied** for the DACA program, 12 percent had arrest records"
politics,"They have been whining for years about ""Uranium One"" and Clinton, because they think there was a quid pro quo there...

Funny how that's not being talked about any more..."
politics,"> their side

And therein lies the problem with America's Government currently."
politics,"> Pursue contempt of Congress charges after Trump is impeached.

""But Trump wasn't removed from office, so therefore there was nothing to obstruct!!!1!!  This is just the democrats undermining democracy by trying to punish republicans for *daring* to support the lawfully elected president.""

That is what will happen.  People need to be held now before Republicans get control of the narrative.  Once the impeachment moves out of the house, they will have control.  Just look at how kavanaugh went.  They somehow managed to take someone who yelled at senators, lied under oath, had very serious claims made against them, and was strongly disliked by the general public, and then blamed the voters for being upset..."
AdviceAnimals,indignation
pussypassdenied,"This started off good, but then took a left turn part way through.  The initial premise of ""I don't believe it, you are not supporting your claim"" was OK (beginning until 1:10).

**Lets go through it**

> There are a-symmetries in all sorts of places

This claim has no evidence.  He handwaived away the claim that there is an asymmetry between men and women backed up by the example of sexual violence.  Without any counter example, and without any hedging with ""I believe"" or ""I think it is likely that"", he is just dismissing a claim and changing the subject.

> The fact that there are asymmetries has nothing to do with your basic argument

This isn't true.  The interviewer is making the implicit claim that the asymmetries provide evidence that there is a power dominance of men over women.

> [cuts off presenter]

And here is where this crosses a line from a disagreement in an interview into dishonesty.  By cutting the interviewer off before she could respond, he is starting to enter into the territory of gish gallop.  Basically, by adding more and more without letting them respond, the previous statements stand as true-by-default.  When they are actually contentious positions.

> it's not true [...] even if it has a patriarchal structure to some degree

So it's not a patriarchy, but it is?  His argument here is not clear.

> The fundamental basis of that structure is not power.

He is changing the topic.  See what happened here?  The original position was about ""a system of male dominance of society"" and he is now refuting it by saying it's not about power...  That's a complete non-sequitur.

> It's competence, that's why our society works.

This veers into casual sexism.  It sounds like the argument he is making is that men are dominant because they are the competent ones.  He doesn't back this claim up.  

And again, this is another topic change...  More gish gallop.

> It's only when tyranny ...

So now he is refuting the idea that it's about power.  Which is not a position the interviewer made.  It's a claim he made...  It's a straw man.

> Roving bands of tyrannical band of plumbers

This is not only a distracting absurdist claim, it's again changing the subject in a dishonest way.  And it's casually sexist to boot.   

The interviewer is not making the claim that the patriarchy is forcing people to hire only men.  So his point here is not addressing anything the interviewer said.  

> and and and then again

Again, he cuts off the interviewer to change the subject before she can respond.  This is gish gallop...  She isn't being given a chance to refute his points.  It's dishonest debating.

> western culture is by no means perfect

Again he just brushes away the actual topic without addressing it.  The argument here is about the ways in which it is not perfect...

> is the least tyrannical society

Just because it is the least tyrannical society does not mean that the patriarchy does not exist...  He isn't addressing the core claim of the argument.  

> You have no idea how ...

Again changing the subject.  So because it was not refuted (because he never gave them a chance to respond) it stands as true, and now the topic changes to why it's bad to push a falsehood (even though it wasn't proven false).

> death rate [...] starvation [...]  disease [...] raising children

What a subject change...

> it's a terrible thing to teach

Why?  He gave no evidence other than his own indignation about why it is a bad thing.

-----------

**TL;DR** - Everything after 1:10 is unsubstantiated claims given in a dishonest way that sounds well reasoned even though it is just as bad (even for some of the same reasons) as the claim he spends the first 1:10 breaking down."
politics,"I mean the standard play is to claim it was a liberal activist judge trying to undermine the rule of law.  Then while you are thinking about whether or not that is actually true, they dazzle you with a whole bunch of non-sequiturs about hot button issues."
malelivingspace,"Alright, you can totally make that chair work.

For a coffee table, any style would work as long as you get something wood that matches the chair and has thin legs.  I would avoid anything with black metal.  You want to keep it light, warm, and colorful.  

A wood MCM coffee table would fit this space really well and as long as you match wood, could work for with this chair.  They are easy to find.  Something with aluminum legs could also work, but I would stay away from polished aluminum.

Given the rest of your decorations, you seem to be going for an eclectic bohemian style.  I would play that up and get a bigger rug of the same style/color as the smaller one.  You want to show off the colors and textures so the chair doesn't look out of place."
malelivingspace,"Yeah, I don't get the upvotes.  There is basically no substance here, and most of what is there is wrong.  In addition to what you said:

The coffee table?  There are like 2 different popular curvy MCM coffee tables.  Most are rectilinear.  

The Chair?  Barcelona chair isn't technically MCM.

The media stand?  Who has a credenza AND a media stand these days?  

The Rug?  The most famous MCM rug designs are black and white.  So no color..."
bestoflegaladvice,"Serious apologies to ozymandias:

    I read a long post from a land-stayed blag
    Who said — “Two large thirteen striped jacks of grace
    Stand in the courthouse. . . . Sewn on, to the flag,
    A gold fringe delicately lies, whose base,
    And flanking stance, and regal hailing swag,
    Scream the protector well its purpose knows
    But yet survives, obscured by lying things,
    The laws that mock them, and loopholes for pros;
    And in that guarded room, these words I spoke:
    On behalf of LEGAL PERSON, Sovereign;
    Look on your fringe, usurpers, and despair!
    My judge sits unswayed.  Requesting a name
    From a person enslaved, and bound through tax
    Their long and dead eyed stares burned into me.”"
bestoflegaladvice,"I like tree posts and I cannot lie    
you Bolarinas can't deny    
when a truck pulls in lookin' at a tree to trim    
and a chipper full of limbs    
you get sprung, so you write some stuff    
'cause your neighbor all actin' tough    
deep in your yard they're starin'    
I'm hooked on the dirt they're airin'    
Oh Baby, I'll write some stricture    
an MS Paint Picture?    
The Moderators tried to warn me,    
but the post you got makes (me so ornery)    
Good sam-inheritin'    
a property with a big oak tree?    
well use me, use me    
'cause you ain't that average OP    
They said it's leanin'    
Now they intervenin'     
It's treble, rebel    
For the Tree they decided to fell    
Cause LA's on the scene    
Sayin' damages are a thing    
Replacement cost is our plan of attack    
soon to move from house to shack    
So Lawyers (yeah), Lawyers (yeah)    
Is your client down a Tree? (Hell Yeah)    
Tell 'em to post it (Post It), post it (Post It)    
Make that tree law post    

Bring tree law back."
conspiracy,"> $3.1 Billion

That's not profits per year, that's assets.  And we don't know the debt load on those.

> Ipek?

https://www.theguardian.com/law/2018/sep/24/media-tycoon-fights-extradition-turkey-coup-akin-ipek-erdogan

The ""coup"" was just a farce to round up people the government didn't like, and that included a lot of wealthy people who did not like Erdogan.  A quick google search is your friend here.

> not saying anything on a matter is coverup, okay this is something new to me

They weren't ""not saying anything"", they were publicly agreeing with MBS' obvious lies even as they changed story and evidence came out showing they were lies, and then when the legislature requested documents from the white house, they **actively** refused to submit a report.  

> [...]

The rest of your comment goes off the rails, and I want to stay on topic...  

You seem happy to justify that Trump blindsided the rest of the US government and it's allies with an action that supports someone who Trump himself admits he has a conflict of interest with.  People around Trump are defending him and refusing to comply and share documents at every step of the way.  This sounds like a clear conspiracy to me.

I don't know what more to say to you about it..."
conspiracy,"> trump's companies and profits are close to a billion

[Citation Needed]  --  Their revenue is estimated at half that, and their profits are probably very small in comparison.

> Show me which Turkish Billionaires were fucked

Ipek?

> everyone wants leverage on the USA and there are constant geopolitical moves done daily to try to achieve this, its hardly anything new

That doesn't excuse Trump's conflicts of interest...

> Of course they declined [...] You dont bite the had that helps you.

You are not refuting that it was a coverup.  Turkey holds all the evidence about the coverup, and now Trump blindsided everyone by doing exactly what Turkey wants...

Remember when leaks were coming out that Trump was thinking about extraditing gulen to Turkey to help coverup MBS' involvement?  Thats the same person that one of Trump's campaign advisors (Flynn) was planning to kidnap for $15M"
conspiracy,"Countries don't care about the cost of a few million, that's pocket change for them.  That amount of money matters to individuals like Trump a whole lot more than it matters to Turkey

> the last thing you want do is ruin the businesses of the top Billionaires in your country

You mean just like they did during the most recent and totally real ""coup""?

> they dont give a fuck. They're glad that dude died.

1. Because they don't like SA.
2. They want leverage on the USA so they can get their way (like the us leaving the Kurds in syria)

> that's a massively failed cover up

https://www.washingtonpost.com/politics/white-house-declines-to-submit-report-to-congress-on-khashoggi-killing/2019/02/08/fdab7f96-2bd4-11e9-984d-9b8fba003e81_story.html"
conspiracy,"Maybe he will take action to remove Trump's name from the towers?

He definitely can fuck with Dogan

Also, don't forget that Turkey has all the dirt on Khashoggi, which Trump helped MBS cover up."
conspiracy,And guess what Erdogan is not saying any more...
conspiracy,"https://twitter.com/ivankatrump/status/193337302066540545?lang=en

> Thank you Prime Minister Erdogan for joining us yesterday to celebrate the launch of #TrumpTowers Istanbul!"
politics,"> Adam Schiff failed to disclose the outside information provided to him to the republicans on the house intelligence committee in violation of house rules.

How did you feel about Nunez not telling democrats about the FBI whistleblowers last year?

How did you feel about Conway and Nunez meeting in secret without notifying any of the committee democrats to review notes and conduct hearings so that they could kill the house russia investigation?"
politics,"No, but I would have liked to see cohesive messaging to all the disinformation coming from the Republicans over literally every other issue.

remember how Trump obstructed justice 11(?) times, and barr decided to do nothing.  Nobody is talking about that, but there are still republicans spreading conspiracies right now about how clinton bought judges and that's why she isn't in prison...  ...Even though that is exactly what Trump is doing.  For real...  How long did benghazi play out, and how many people remember the largely similar incident in Africa right after Trump took office?  Why didn't Pelosi rally democrats to talk endlessly on TV about how republicans killed every investigation?  Remember when House Republicans held secret meetings without the democratic committee members to figure out a way to sweep everything under the rug?  Pelosi said essentially nothing.

Under her leadership, they have let the republicans run the show since 2012.

Leadership requires more than knowing who will vote for and against a bill.  There is a public component that Pelosi has been failing at.  Remember how she undercut her committees a few weeks ago and gave the trump admin an excuse to refuse cooperation?"
politics,"> Where they at now?

Happy that she is finally doing something."
KamikazeByWords,"It's being used as a pun here too.  They are literally talking about laughing at nothing (a stupid ""joke"" made by gonzalo), but the context is that the conversation is about a perfect kingdom being just a bunch of lazy people and whores.  

The line before this snippet is:

> ALONSO:  Prithee, no more. Thou dost talk nothing to me."
KamikazeByWords,"I don't think this is a kamikaze.  Gonzalo isn't putting himself down here.  

The context is him talking about him being an ""ideal"" king in a hypothetical equal utopia (*""No occupation. All men idle, all. And women too, but innocent and pure.""*), and everyone laughing at the ridiculous idea.

So, when he says ""Who in this kind of merry fooling am nothing to you"", he isn't putting himself down, he is instead jabbing the king.  It's in a way saying that the king falsely thinks his power comes from himself, but he is forgetting the power of those below him."
malelivingspace,"+1 for leaving them open.  Realistically nobody will see inside.

Also, you already have a curtain rod on the right window, and it is correctly placed imo."
technicallythetruth,"> no fans in star wars

https://gfycat.com/lefttidyauklet-starwarsbattlefront"
