subreddit,body
conspiracy,"> D's actively attempt to circumvent free speech and open platforms.

...  And only the Democrats, right?

> This sub is still mostly Independents

Not even close."
conspiracy,"> Were neutral, it's just that those darn democrats are ruining everything"
Libertarian,"> Not having a profit motive is not a good thing

I strongly disagree with that statement.  Strongly.

I started a nonprofit a few years ago, and we had ~20 volunteers who donated a bunch of time and effort to get it up and running.  The organization did everything BUT profit.  And yet, we were all still motivated to make it work as best as we could.  If you have ever worked with a serious non-profit, you know that those people aren't slacking.  We were motivated by the mission of the organization.  And because of the nonprofit status, people were taking minimum pay (and no pay) and constantly coming up with creative solutions to stretch each dollar as far as humanly possible.  

Also, charter schools are not definitively better.  There is a lot of debate about that currently, because most of the stats are inflated by things like selection biases and shifted costs.

> Better schools can charge more for that very reason which in turn allows the stratification of students. That's a good thing.

But this whole thread is about college being too expensive...  And I would argue that a country where poor kids are unable to attend good schools is worse than one with equal education opportunities.  Who's to say that trailerpark terry isn't the next bill gates?  But when they can't afford a good school, they may never get the chance to reach that high.  This is social inertia and is a well studied concept.

> These colleges are choosing to charge more because people are choosing to continue paying for education that is far too expensive. [...] You literally cannot work and pay your through college anymore.

So why would dropping federally backed loans change that?  If the market is willing to pay the current price, why would *costs to the students* go down?  They are willing to pay the current prices afterall...

And before you say that federal loans allow them to take more risk than they otherwise would, don't forget that federal loans are capped well below the expensive college rates we are talking about.  I maxed out my federal loans at <$50k. Anything over that would have had to come from a private lender, and I had several friends at a state university who left with $25k in private loan debt on top of their federal loans.  So it's clear that private lenders are already willing to lend to students.

> Staying the same is better than this apparent exponential increase

Who's to say that we ever reached equilibrium before federally backed student loans?  During the same time we had a large increase in population, college became a requirement, and a whole lot of very expensive things became mandatory for education.  You picked a conclusion without considering other factors.

> The universities are getting far more money per student than they were 10 years ago. HEA was passed in 2008

Tuition has been going up much longer than just 10 years.  in the 60s a minimum wage job worked part time during the summer could pay for ivy league schools.  

> Private student loan companies keep people who would pursue useless degrees in check at least

I have seen no evidence supporting that statement.

> Why do you think there is market saturation among jobs which require an English degree, communications degree, and other non-STEM fields?

Because with the advent of mass media, the internet, and modern technology, one person is much more productive with a wider reach than they were in the past.  A single person can now do the work of an entire team a couple decades ago, and a publication that reached 100k people 30 years ago now reaches over a million.  

Horse drawn carriages were displaced by cars, leaving many blacksmiths out of work.  An oversupply of farriers due to artificially cheap apprenticeships had nothing to do with it.

> The alternate was working just fine for decades

No it wasn't.  College costs have been increasing for decades."
Libertarian,"> Then stop giving out government funded student loans

But the government is the one and only institution that can do things on a large scale without a profit motive.  That's the point of government loans.  They absorb the risk, because the government is the only entity that derives benefit from a widely educated population.

> rapid increase in college tuition costs

Tuition costs are different than loan interest rates.  This image macro is silly, because it's mixing the two.  You can dislike bankers profiting and be perfectly happy with educators profiting.  There is nothing hypocritical about that.  Libertarians will disagree, but it's not hypocrisy.

> Colleges gonna keep raising prices if kids are guaranteed government money

Okay, lets look at the FULL picture here.  

Prices are ALWAYS going to increase until the profit is maximized.  That's econ 101.  

If you get rid of government backed loans, then private loans will fill the gap.  Those loans will have higher interest rates, which means for the same price to the students, the universities will get less money.  So college students will still pay the same price.  

BUT, because universities will get less money for each student, they will either raise prices, cut staff, or both.  That's how economics works.  The end result is either students pay more, or less students attend university.  Both of which are objectively bad for the country.

This whole ""blame government loans"" is only looking at the first order effect, and not looking at what the alternative would mean."
conspiracy,"If you are really interested in radio specifically, start by getting you Amateur radio license.  These are the people who talk on HAM radios with people around the world.  It's a good introduction to what it takes to broadcast.  It takes a bit of study, and it's a hobby that not everyone is into (really really *really* nerdy).

But, in rural areas, you should be able to start up a legit station for <$20k."
conspiracy,"Your best bet to learn more is to probably just start a web-walk on the history of pirate radio stations, and supplement with wikipedia when able (some of the wiki pages in radio are difficult to read even for an engineer like myself).  There is a lot to cover, but there is also a long and colorful history of pirate radio in the US and UK (fun reads), and most stories will at least touch on the legal and public safety issues.  

> What's the problem with independent stations? Are there only so many frequencies to tune into?

Yes.

When looking at [electromagnetic waves](https://en.wikipedia.org/wiki/Electromagnetic_spectrum), we typically classify them by their frequency.  Xrays, light, wifi, Cellphones, over the air TV, Radio stations, personal radios, and RFID are all operating on the same EM spectrum, just at different frequencies. 

When two things are broadcasting at the same frequency, they interfere with each other.  It's why 2.4ghz wifi may slow down when you use your kitchen microwave.  As a result, any EE can easily build a radio jammer that does scary things like preventing someone from calling 911.  And so the government had to step in and regulate things.  (Don't want firefighter's radios to go down, blocking 911 calls on a highway would be terrible, commercial radio stations by law have to broadcast tornado and hurricane warnings and people could die if they don't get that memo...)

So, we break up the EM spectrum into ""bands"" that are reserved for certain applications.  Satellites use one range of frequencies, TV uses another, Radio uses another, emergency responders use yet another.

As an example, in the United States, the government set aside the EM frequency of 87.5 MHz to 108 MHz for FM radio.  So, a new music radio station might register to broadcast an electromagnetic signal at 90.1 MHz (90,100,000 Hz).  We usually refer to the stations by the MHz number and signal so 90.1 FM.  However, due to the way antennas and electronics are designed, a radio tuned to 90.2 MHz (90,200,000 Hz) can probably still pick up that station.  So any station on 90.2MHz would be interfering with 90.1MHz and vice-versa.  This is the reason why radio stations are spaced .2 apart (90.1FM and 90.3FM).  Because of the 0.2 spacing requirement, there can be at most 102 FM radio stations in a single area. (for practical reasons, you will never see that many and usually see far less)

Broadcasting on a narrow band is actually pretty difficult, and a lot of hobby equipment is not precise enough.  So pirate stations frequently bleed over many radio stations and get reported almost immediately even if they were broadcasting in a dead space.  And finding a station is pretty easy, as all you need is a signal meter and a car."
conspiracy,"Don't...

If you want to broadcast, do it online or in print.  Radio is easy to find, and insanely expensive WHEN they catch you.  Improperly done pirate radio stations cause real problems, and the government doesn't mess around with that.

I would recommend online distribution for content.  Podcasts are still very popular and streams are easy to set up on your own website."
conspiracy,"I think all the area51 talk is funny.  So much is public information, and it's really not hidden.  I knew someone who was a pilot that flew passengers into dreamland regularly, he said there was nothing suspicious going on there beyond classified aircraft.  

It's the other sites that I want to know about.  When I was younger, I had a computer class teacher who had spent many years managing teams designing and installing site specific hightech systems for the govt.  He was talking about some crazy unclassified stories and hinting at interesting classified stuff, to which we were all calling BS.  So he asks us to search the internet and find what military base was in some small town.  We couldn't find one.  So, he pulls up google earth, and zooms into a residential looking area.  There was a single wide driveway going underground with no signs of anything else suspicious...  I wish I remembered the name of that town so I could find it again..."
conspiracy,"> for 6 billion dollars

That estimate is not correct.  The minimum estimates are over 25B and go up depending on who you ask.  6B was a sales pitch that is not achievable.  

> I just don’t see how something so small in budget can cause such a large controversy

Lots of things:

* Some people don't want any money spent on the wall, no matter how little.  For many, the money isn't the issue.
* For those who do care about the money, even though it's small compared to the budget, it's still objectively a huge amount of money when other programs struggle to get any funding at all.  It's 1.5% the cost of student loan forgiveness.  It's the cost to build highspeed rail connecting a few major business regions improving the country's economy.  It could roll out better internet to underserved areas and help dying towns.  It could fund the national park service for 8 years, or wipe out their maintenance backlog ($12B) and have enough left over to fund them for 4 more years.  It could buy a lot of grid scale energy storage to improve our national electric grid, or build EV charging infrastructure.  There is a million things we could do that are better than the wall...
* The wall has an environmental impact.  It disrupts animal's movements for one.  
* The wall is a symbol that many people don't like.  I, for example, would be opposed to my city erecting a giant swastika statue regardless of the cost.  Many people (whether you agree or disagree) feel the wall is similarly a racially charged symbol, and don't want it.  

Personally, I think the wall is a useless waste, and im not going to roll over because it's *just* a few billion..."
blackmagicfuckery,https://www.reddit.com/r/interestingasfuck/comments/a64pto/ovens_connect/ebsy2nl/
malelivingspace,"Several states have minimums over $10/hour, and it's not difficult to make a $2 over minimum once you have a year of experience.  

> working that much and still being in high school.

I don't think OP is in high school.

> cuz they dont make sense.

Not everywhere that has jobs is a major city...  Ive known lots of people doing work right out of highschool making more than $15/hour in smaller areas.  Farm work can pay decent, good framers make decent money, Servers make more than $15 in a normal area, Call centers suck but pay well over minimum.  

But even so, in your state of California, you could rent a house in fresno for $500/month.  Minimum wage in california is $12/hour.  Sure, fresno is nowhere I would ever want to live, and some areas are not that safe to put it lightly, but it's affordable on minimum wage.  Mass. and washington also have $12 minimums both with many cheap towns scattered about.

My point is that it can be done, so people need to stop criticizing OP as if he was doing something impossible.

Is it easy?  Fuck no.  Do we have issues as a country with affordability?  Yes.  Is OP doing something impossible?  No."
Portland,"The point they are making is that cows only produce milk after giving birth.  And those calves are oftentimes slaughtered pretty quickly or just separated (if the calf is valuable enough to raise) to free up the mother for milking.  So by drinking milk, you are indirectly contributing to the slaughter of cows."
Portland,The people in black are antifa.  The old guy was also hitting people with a baton.  These videos are showing multiple people who wanted to get into a fight...getting into a fight.  No reason to cry about that.
malelivingspace,"Working part time at 16 & 17 can get you a few grand in savings to be able to move out when you are 18.

$15/hour @ 35hrs/week with some time off is = ~26k/year.  The ""affordability"" rate is 30% of gross income.  So, affordable rent on $15/hour is $725/month.  $12/hour is 575/month.

Rent in lots of places can be under $600, and being 18 and making $12/hour is not impossible."
conspiracy,"I'm not a vegan (and this is wildly off topic, haha), but just to defend them a bit:  Veganism for a lot of people is an issue of consent.  They view it as stealing from the animals in a world where it is not necessary, and thus morally wrong. 

So breastfeeding would not be amoral in the eyes of those types of vegans, as the mother willingly gives it to her child."
Portland,"> Am I missing a reason you're so weird and defensive about this?

Because homeowners are swarming any talk about this issue whining about losing property value, and making up crap to scare people into keeping ultra low density single family neighborhoods.  

It's ruining every city in this country.  It's making it unaffordable for normal people.  It's decreasing density which increases reliance on cars.  It's contributing to the financial problems of cities.  It's a huge issue.  It's why california is so expensive.  And the whole thing boils down to ""I got mine"".  

> I was here to do what I did, which was ask a question about something I don't fully understand.

You posted a leading question that showed you had already drawn your conclusion before receiving an answer."
Portland,"No.  Inspections are still required for ADU construction, and duplex conversion.  

Banning duplexes won't make terrible landlords go away.  

> isn't this just another tool for them to fuck over renters in new and creative ways?

No, it's the opposite in fact.  By legalizing duplexes, we increase supply, which lowers cost for renters, lowers demand for shitty places (like the one you describe), and thus incentivises the landlords to fix their properties.

**EDIT:** - Why would a renter like yourself (""more landlords doing what mine have done"") post so much in /r/homeowners?  I get the feeling that you are here just to spread fear, and not because of legitimate concerns..."
conspiracy,"The proof was that an officer thought a vegan coconut milkshake looked like cement?

That's the proof?

Officers have a history of seeing drugs and guns on people they don't like.  Why would I believe they can correctly identify cement mixed into a milkshake from 20 feet away?"
malelivingspace,Removed - Rule #1
conspiracy,"> Have you ever had one?

Yup!  I agree, they were tasty."
conspiracy,"magabomber?    
George Tiller?    
Colorado Springs Planned Parenthood Shooting?    
Gabby Giffords?

right wing media is really good at stochastic terrorism."
conspiracy,"So anonymous reports are okay again?  The police are trustworthy again?  

So the police are reporting that the people who dared to stand up to them were totally 100% doing really scary stuff that prove the police were needed?

I don't buy it."
conspiracy,"> They weren’t milkshakes

You are right, they were vegan coconut shakes."
conspiracy,And the police didn't even say this.  The police are saying they had **reports** that milkshakes contained cement...
politics,"The funny thing is the rest of the story they are not telling you.  Read through his twitter to see the full day's events.

Preface:  Andy is a known alt-right troll (which is why people were yelling at him by name in the video)

Day before - 

Antifa told people to watch out for him.  Andy posted on twitter how worried he was about being targeted.    

Day of - 

Andy entered the square and shoved his camera in people's face.    
People stood in his way and blocked his camera.  Andy reported it to the police as assault.    
Andy returned to the square and shoved his camera in people's face.    
Someone poured a milkshake on him.  Andy reported it to the police as assault.    
Andy returned to the square and continued shoving his camera in people's face as he followed the marchers around.  He did this for over an hour.    
Someone finally had enough and punched him (others threw a milkshake and sillystring).  Andy reported it to the police as assault.


The person who punched him was objectively wrong.  However, Andy was actively trying to get this reaction, and so doesn't deserve the media attention.  He was ""worried"" but showed up anyway.  He complained to the police about assault, but went back to those people twice.  He was obviously trying to provoke a response.

But BB will never tell that part of the story, and instead they will continue to tell people how evil antifa is."
malelivingspace,Rule #1 - Removed
dankmemes,"I think the differences are just in the words you choose to describe them.

Harry potter v star wars:  An orphan with magical famous parents is raised by relatives in a boring area who keep their past (and parents past) secret from them.  They leave home and are introduced to a wider world by a magical mentor, where they train and join an underground resistance seeking to defeat an evil overlord.  They make friends with another man and woman (who eventually fall in love) and together, the three of them take down the evil villain.  Both also enjoy levitating things through magic."
dankmemes,"Everyone who hates on Avatar doesn't understand that the reason I love that movie so much is the world building.  It's why I love waterworld, It's why I loved atlantis as a kid, it was a big reason why the first john wick was so wonderful."
dankmemes,"a.k.a its a narrative archetype.  

It's equivalent to calling harry potter star wars, or calling star wars the lord of the rings.

https://i.kinja-img.com/gawker-media/image/upload/kljiqcqqb2herdaycnyl.png"
politics,"Remember when they overrode Obama's veto, and them blamed Obama for the law passing?  Remember when Bush signed a $1T deficit budget, and they blamed Obama?  Remember all the times Republicans shut down the government, took credit for shutting down the government, ...and then blamed Obama?

This is just what they do."
Portland,"> You've made a number of claims

**IM ASKING YOU WHAT CLAIMS YOU WANT CITED**  It's clear you are not arguing in good faith.  You are putting words in my mouth and dodging when I ask you what you want cited."
Portland,"> if you aren't going to link to external, credible sources to back your claims and concepts.

""[What information are you looking for?](https://www.reddit.com/r/Portland/comments/c3g12z/extinction_rebellion_currently_has_the_street_in/ertgn1i/)""

You didn't read a single word of what I wrote did you?"
Portland,"> What do you base that information on?

What information are you looking for?  Im saying that suburbs are externalizing their costs and that freeways make cars artificially cheap. So:

* Are you looking for a source about how suburbs are built on farmland?
* Are you looking for a source that single family homes produce less tax revenue per acre than mixed use developments?  That parking lots generate less revenue than condos?
* Are you looking for a source about how utilities built not by the developer increase costs for people outside that new development?
* Are you looking for a source about how suburbs are more car dependent than urban areas?
* Are you looking for a source about induced demand of highways?
* Are you looking for a source about how cars make noise and pollute?
* Are you looking for a source about how highways lower property values of adjacent land?
* Are you looking for a source about the maintenance costs of highways?

> but again, what is your plan to stop them from being built?

[Again, already answered](https://www.reddit.com/r/Portland/comments/c3g12z/extinction_rebellion_currently_has_the_street_in/errvn0l/) One of the things you are not really getting from my comments is that the point of not building freeways is to stop subsidizing their growth.  Ive said it multiple times in this thread that if people want to live in the burbs, it's going to get more expensive.  And as I have said, suburbs will be disincentivized because of things [like long commute times](https://www.reddit.com/r/Portland/comments/c3g12z/extinction_rebellion_currently_has_the_street_in/errpxlv/). -- ""[""paying for it"" is going to be traffic](https://www.reddit.com/r/Portland/comments/c3g12z/extinction_rebellion_currently_has_the_street_in/errntw6/)""

> You've stated multiple times that people should not be driving

No I have not.

> that housing has now induced demand for the roads

That is not what induced demand is.  [Induced demand](https://en.wikipedia.org/wiki/Induced_demand) is when an increased supply *drives* increased demand.

> But I told you from the onset that I think that's a flawed conclusion without a transition plan in place.

Why do we need a transition plan?  You are suggesting that we build more outward without a plan to move people around.  How many lanes do you want to add to 26?  How many lanes do you want to add to 5?  Where are you going to get extra lanes for 405?  Again, you are suggesting building outward while ignoring the infrastructure needs and infrastructure impact of building outward.  Why is widening roads and building more freeways easier than adding another street car line?  Why is building another SFH neighborhood and adding another freeway easier than building condos in the city?  Why is building houses 30 minutes from jobs not require a transit plan, but building apartments walking distance to jobs needs a massive plan?

> What of the other cities in the metro that want to grow? Portland does not get to decide how Tualatin or Sherwood grows.

Where did portland deciding what happens to Tualatin or Sherwood happen?  This is not some proxy fight for your ""big city bad"" feelings.  Im arguing that we shouldn't build more freeways, you are twisting that into ""portland says you can't do things they don't like"".

Again, what I said was ""[""Our highways are big enough, we don't want more highways in our city."" They can say that. Voters in portland can push their reps to not fund highways in their city.](https://www.reddit.com/r/Portland/comments/c3g12z/extinction_rebellion_currently_has_the_street_in/ers450b/)""

>  It doesn't get to tell Oregon City not to increase density

I have explicitly stated that I want Oregon City to increase density.  I have said that multiple times.  ""[Make the core of all oregon cities more dense instead of sprawling outwards.](https://www.reddit.com/r/Portland/comments/c3g12z/extinction_rebellion_currently_has_the_street_in/errmgue/)""

> The transit doesn't exist,

The new freeways don't exist either, but you continue to ignore that.  

> our suggestions are admirable on paper, but making them a reality is the problem. [...] You can say what we should be doing, but it doesn't matter unless you have a realistic plan to get there.

Step 1 - Don't build freeways

DONE.  That's my plan.  That's it.  No more.  Yes, there are other things we can do to make the process easier (change some taxes, make certain incentives, update zoning, etc.) but my plan as far as I am arguing is ""Don't build more freeways.""  

--------

This is clearly just turning into an outlet for your ""portland is bad"" outrage.  You are not reading what I am writing.  I am answering the same questions multiple times, and you are continuing to put words into my mouth.

I don't know what else to say to you."
politics,"https://en.wikipedia.org/wiki/Thin_blue_line

You often see people with a black and white american flag with one of the stripes blue.  It's supposed to represent the ""Thin Blue Line"" and show support for police.

Of course these are the same people who stockpile guns and threaten police, but ya know..."
