subreddit,body
conspiracy,"Id like to break down and respond to a few points in your comment if that's alright (This is not meant to be read in a super aggressive way, just more as taking it piece by piece):

> will be used to usher in things

Do you believe that there is no way to fix the hate/discrimination without ushering in any ""draconian and illiberal"" things?

In my view, we should be working to fix the problems rather than giving up at the start and accepting the hate/discrimination as a necessary part of society.

> The handful

1. The hate/discrimination is faced by most LGBT people.  That's the reason to push for fixes.
2. The impact is still massive.  Think of how many people died because the US government didn't want to address the AIDS epidemic and thought it was only affecting gay men.  Think of how many people are still dying today because of it.
3. The people that have been lost and the potential wasted is worth the push in my opinion.  Think of what discoveries we would have had if they didn't chemically castrate Alan Turing.  Think of the leaders we could have had if they weren't marginalized due to their orientation (many great leaders in history are thought to be closeted).  Think of the great lives cut short due to suicide or murder.  

> the default which is the nuclear family

That's not the ""default"".  Never has been.  It's common in recent western history, no doubt, but to say it's the ""default"" for humans is wrong.  Raising children communally is not strange.  Having large numbers of children is not strange.  Research is showing that having half siblings is much more common than we thought  (I've read estimates >10%).  Polygamy, polyamory, bisexuality, and homosexuality of all forms are very common throughout history and all cultures.  Things like Eunuchs were historically very common too.

> Increasing [...] Masculinization of Females

Can you give me an example of this?  A lot of opinions, about what gender roles are, are Victorian era creations, which given the length of human history makes them strange.

> Speech codes

I am not so sure I see a purposeful link between trying to socially attack certain behavior and pushing for oppressive government regulations.  Most of what I see is publicly attacking people for speech so society knows it's wrong, not trying to imprison people for speech.  I think there is a distinct difference in most people's minds between attacking someone for bad behavior and outlawing bad behavior.  

I openly support people's right to use slurs, but I also tell my friends to not shop at places or support organizations that use those slurs, and I will tell people that they are shitty for using those slurs."
politics,"> He should do the right thing regardless if they will vote for him.

Why?

Why waste the effort?  Why waste the time?  Why waste the political capital?  Rural america, by voting republican, has shown that these issues are not high priorities for them.  So why should it be a high priority for Biden?  It's not going to change any votes."
vermont,"This is actually more of a Colorado/Utah joke, than a VT one.  

Texans would flock to Colorado to go skiing in the winter.  They never knew what they were doing, were unprepared for the snow (hence the jeans), and were a mess that basically everyone hated.  So someone who skis in jeans just became a trope that skiers out there could all identify and collectively dislike.  

I think the joke is lost out here because our neighboring source of tourists generally understand winter and how to dress for the snow."
WhitePeopleTwitter,"> Supply and demand.

Elasticity

> then the wage for a barista goes up until one is willing to take the job

It doesn't though because the world is MUCH more complex than just saying supply and demand will solve it.  It takes generations to reach the steady state where prices will match needs.  And in the meantime that leads to the quality of life going down for most people.  And when you add in the complexity of national debt, regressive tax codes, and the externalities of road construction and maintanence, you wind up with a system that is headed for total failure in a couple generations.

> That still doesn’t mean the barista should expect to be the doctors neighbor 

In no way did I suggest a barista should be paid the same as a doctor.  Being neighbors doesn't mean having a house of the same price.  It means having town houses down the street, it means having affordable apartments one block over.  

-----

You talking about what is fair is ignoring the fact that the current system is less fair than the communist strawman you are arguing against.  And because of rising costs of living, it's getting worse.  

I laid out several problems with the system you are supporting, and it seems that you ignored all of them."
WhitePeopleTwitter,"> A barista not being able to afford the house next door to the doctor isn’t a problem with society

Actually, yes it is.  Where does the barista live?  If not in denver, then either the doctor can't get coffee, or the barista has to drive super far to go to work.  

If the doctor buys an espresso machine, then that's money going to China instead of the local economy. 

If the barista drives super far to work, then that means more roads are needed to support the commuters (which uses more tax dollars that could be spent elsewhere), which creates more pollution, which uses more land for parking (which is less land for housing), which means businesses rent is higher (passing costs onto customers), etc. etc. etc.

Also think of things like workers living in areas far away have less funding for schools per-student, meaning their children are less educated which hurts the whole country in the future.  (fewer educated workers, less innovation, more jobs overseas)

The list of second order effects of pushing out the workers is long.  And the TL;DR of it is that it hurts us all eventually."
vermont,"""Best"" is super subjective, and it's hard to award that title to a single state given all the different factors that make a state.  For me, there are some things that make Vermont a wonderful place, and some things that I miss from other places I have lived.  

Ranking states into tiers though, Vermont would definitely be top-tier."
politics,Youre changing the subject.  You said barrett was more qualified than Garland.
politics,"That rating is a minimum requirement, not a sufficient requirement."
politics,"In what way was Garland less qualified than Barrett?

Barrett has been a judge for less than 3 years.  Garland had been a judge for about 19 years (chief judge for 4 of those years) at that point.

Barrett's first experience was being a clerk for the court that Garland was a judge on."
conspiracy,"But see, here is the problem.  There are two types of posts on conspiracy:

1. Democrats are bad
2. Both sides are bad (This post)

End of the day, that provides justification for people to ignore the relative actions of each major party.

Would you rather vote for corrupt as hell, or a little corrupt?  If you only have those two options, i'll take a little corrupt every day of the week.  

That's the real conspiracy here.  They are pushing discussion into this framework so that the overton window shifts hard toward corruption.  It's building a world where those who already have money will never lose it (more so than in years past)."
conspiracy,"> hate the other half due to a ...

No, I dislike the other half because they are against voting.  They are against science.  They are supportive of corruption.  They are supportive of gerrymandering.  

I dislike people who actively work against improving the country because they want their team to win."
conspiracy,"This is another example of just making something up to be angry about and saying it often enough until people believe you.  This is the ammo they are using to control us.  This is how they make people abandon critical thought...

Rather than posting a picture of a comment on another site, back up the things you are angry about with actual events.  This is just feelings parading around as proof.

-----

Most of the media is owned by the right.  Sinclair?  Fox?  Facebook?  The countless right wing news sites.  

---------

Republicans do control the schools and their curriculums.  States like texas and kansas indirectly control textbooks for the rest of the country.  NCLB was a bush policy.

Red states do receive all the handouts.  look at how much each state contributes to the federal budget vs how much they get from the feds.  Red states take the most, blue states produce the most.  

-----------

When obama was president, republicans and fox news publicly announced their one goal was to make obama a one term president.  They turned down free money for their states because it would make Obama's policies less successful.  They blocked THOUSANDS of court appointments, and when obama left, they packed them full of highly unqualified people (like a lifetime appointment with no prior experience and a recommendation against hiring them from the non partisan boards)

---------

Being upset that a baker refused to serve someone for being gay is not the same as running someone out of town for being gay. 

The identity of good people vs bad people in media is the reason for the current social backlash..."
NewDealAmerica,"Three questions:

1. Do you believe the broadband innovation grant is enough to help expand internet to rural areas?

2. I would love to be able to get an electric vehicle, but with a long commute to work and the lack of fast chargers along the way, it doesn't feel like we are ready yet for the switch.  What would you do to help add more fast chargers around the state?"
conspiracy,"Donald Trump was impeached for the following reasons:

1. Abuse of Power - Soliciting a foreign government to help him win a US election.  Traded $391 million in US military aid for an announcement against his political opponents.  
2. Obstruction of Congress - Ordered others to defy a lawful subpoena.  Ordered his staff to illegally withhold documents requested by subpoena.  Ordered his staff to not cooperate with the congressional investigation.


So how was that Biden's doing?

To me, it sounds like this tweet (from a republican operative) is actually just making things up and hoping we all accept it without question."
worldnews,"Conspiracy theorists being mostly right wing is a recent change (2015ish).  During the bush years most conspiracy theorists were far left anti-war types.  Really, Conspiracy theorists are at their core, just people who distrust those with power, and what power is most concerning depends on external factors (like wars, major stories, cultural trends, etc.).  Unfortunately republican strategists realized that this could be exploited.  

During Obama's second term there was a big push to amplify the the fears of people in a way that would help republicans.  For example: Instead of fearing billionaires manipulating society for personal gain, they amplified fears of communists manipulating society for power.  Instead of fearing an oppressive police state, they amplified fears of a lawless society.  Instead of fearing the military industrial complex, they amplified fears of what would happen if they lost a war.  The conspiracies fall directly out of those fears.

When election season rolled around, the seeds were sown and they just had to again cherry pick what stories to push and the community further polarized.  Suppress stories about Trump working with Russia, amplify stories about democrats inventing the story.  Suppress stories about republican astroturfing online, amplify stories about democratic astroturfing online.  Suppress stories about Trump, amplify stories about Clinton.  

People who saw through it were outnumbered and basically turned into an outgroup.  With the polarization across the country, it further consolidated into right wing and everyone else.  And because that is the core uniting trait of the community, it becomes embedded in every discussion.  Sprinkle in a little selection bias and you have a self-reinforcing system where anything not right-wing is a conspiracy."
politics,"Our official on-topic statement is linked [HERE](https://www.reddit.com/r/politics/wiki/index#wiki_the_.2Fr.2Fpolitics_on-topic_statement), and we refer to that wording when applying the rule.  One of the issues that makes an answer difficult, is that it oftentimes comes down the the specific link posted.  And we always make the decision on a per-article basis.

For example, an article discussing Herman Cain and his family would likely be off topic, as it has no impact on the running of the us government or campaigns.  However an article about Herman Cain's death impacting Trump's campaign very well may be on topic.  The death of a sitting politician will inherently have an impact on the running of the government, so those articles are, more often than not, on topic."
malelivingspace,Im just going to echo the other comments and say I love that color.  Great choice!
movies,There are all the things you listed.  There are loads of fan theories on youtube.  People actively learn the language.  There is a TON of fan art out there.
malelivingspace,Rule #2 - Removed.
reactiongifs,"That's a broad brush you are painting with...  Right leaning justices are just as ""pragmatic"" and non-textualist as you are painting left-leaning justices...

Was it textual or pragmatic to say that not giving religious schools tax credits was preventing them from exercising their religion?

Was it textual or pragmatic to say that a law passed by the house and senate and signed by the president could not lawfully prevent the president from firing someone without cause?

How was daniel lee a textualist opinion?"
politics,"https://twitter.com/AP/status/1307121771443826688?s=20

> BREAKING: Following Justice Ginsburg's death, Majority Leader McConnell says a Trump Supreme Court nominee will receive vote by full Senate."
Damnthatsinteresting,https://i.imgur.com/pQjoQ.png
politics,"https://www.cdc.gov/nchs/nvss/vsrr/covid19/index.htm

> Total Deaths	177,177"
youseeingthisshit,"http://www.cc.com/video-clips/12iecs/blue-chip

2:29"
vermont,"I apologize, I am presenting it more as a binary to try and answer the original question of ""why should they be taxed more [than full time residents]?""

The specifics of how much more, and how they are taxed, is a lot of politics and a whole other conversation."
vermont,"No question they do have a benefit, but it's a balance.  

Some vacationers are great for the state.  Like you said, they go out to eat at fancy places, go on tours, buy art and tourism gifts.  Property maintenance and management when they are out of state are good local jobs.  Their land is usually in growth which is helpful for local wildlife.  

But a lot of the benefits can be equally said for residents, and are sometimes better from residents.  Vacationers go out to eat during holidays.  Locals go out to eat in the off seasons.  Locals hire contractors too, and continue to buy local goods when the snowbirds are out of town.

Too many vacation home owners is a negative though.  Having a lot of driveways to plow doesn't help if you can't plow enough to pay the mortgage.  A restaurant may make a ton from the Christmas rush, but the servers need work in April too.  Someone wanting to get into farming will have trouble getting good land when it's all being subdivided and sold to vacation homes with restrictive HOAs.  

The way I see it is that people clearly already want to be in Vermont for vacation homes so we don't need to encourage them.  Property prices are climbing, so we know they are willing to pay the price.  And frankly, if Florida was perfect, they wouldn't be snowbirds, they would just be Floridians.  So don't think of taxes as discouragement, it's really to help local services and level the playing field for locals.  

Personally, I always like seeing taxes on empty houses.  That way they either live here and pay taxes as residents or rent it out and keep people generating income for the state.  The state gets supported either way, and it discourages speculation."
vermont,"Many of the resources they use cost money year round.  Roads are sized to handle the snowbirds, but still need maintenance when they are out of state.  Social services don't stop being needed just because someone is in florida.

Second homes require land and resources.  Both of which are not-infinite.  People with money buying up vacation homes increases the cost for everyone else.  This means that local workers have to commute longer to work and spend more for less.  More people commuting means more road maintenance, more pollution, more parking needs, etc.  People spending more on a mortgage means less money going into the local economy.

You have to think about the opportunity cost of a snowbird.  If they weren't in that house, who would be?  Would that person be better or worse for Vermont?  If it would be better to have someone else, then they should be taxed more."
Bad_Cop_No_Donut,They have the power to stand on a public sidewalk and watch what they are doing.
Ubiquiti,I never thought about power over coax.  That's interesting!  Thanks for the link
Ubiquiti,So I didn't pay too much attention in my antenna classes during college...  Can you make a passive repeater of a reasonable size?  Are there any plug and play options out there?
conspiracy,"https://www.reddit.com/r/politics/wiki/index#wiki_the_.2Fr.2Fpolitics_on_topic_statement

> r/Politics is the subreddit for articles, videos, sound clips, and polls that are directly related to or have a significant involvement/impact on:
> 
> * The running of US governments, courts, public services, legislation, and policy-making
> * Elections and candidacies
> * Political movements/demonstrations discussed explicitly in connection with advocacy for specific policies or political candidates
> * Lobbying and funding, groups, and donors
> * Opinion and analysis articles that explicitly and significantly discuss the above"
conspiracy,correct
ModSupport,"> by the end of this week

Do you mean tomorrow (Friday), or Sunday?"
PublicFreakout,"Change congress to have more representatives.  1 rep per 30,000.  

It will become easier to elect normal people, and the big corporate voices will get drowned out.  It will be chaos, no question, but it will result in a louder collective voice for normal people."
conspiracy,"It was removed for [incivility](https://np.reddit.com/r/politics/wiki/index#wiki_be_civil).

> All you cry babies [...] You’re a bunch of adult children"
conspiracy,"> https://www.reddit.com/user/maxwellhill - Moderator/Lead Moderator of many huge subs like r/worldnews, r/politics, and r/technology

They are only a mod of one of those three subs..."
vermont,Did you read my comment?
vermont,"> there is nothing wrong with VT [...] most every person that moves here tries to make it like the place they came from

I hate this attitude, every state has it.  

Making Vermont an exact clone of either Hollywood or backwoods Alabama aren't the only options...  We can adopt the successes other states where they fit along side with what makes Vermont a great place to live.

* Do Vermonters love driving long distances in their car and walking across acres of pavement to shop at a walmart or bedbathandbeyond to get something local stores don't have?  Several states are trying new redevelopment patterns that preserve historic town cores and attract great new locally run businesses.  
* Do commuters around the capitol hate the idea of functional and affordable rail service to and from Montpelier?  Denver and Portland OR have great lightrail systems, and I've seen a BRT that made commuting without a car actually reasonable.  
* Do cyclists love riding in the road with traffic?  Other cities and towns are finding ways to safely integrate bike infrastructure into their area so people don't have to drive everywhere if they don't want, and can safely enjoy some time out riding around.
* Traffic in Brattleboro can be a nightmare.  Should we ignore ideas from other cities simply because they aren't in Vermont?
* Most people cannot live in large parts of the state due to poor internet infrastructure.  Should we not see if another state did something to fix that?
* There are very few good jobs in this state for tech workers.  How did other states get so many?
* Vermont has wonderful outdoor activities year round.  Colorado and Oregon do too.  Those states are attracting young people and new businesses for that reason, but Vermont isn't.  Clearly we should take a look at what else they're doing right and see what makes sense for Vermont.

What about politics and laws in general?  Are you telling me that out of the other 49 states, they have are zero laws that would improve our state?

I moved here recently from another state and so far it has exceeded my expectations.  I like this little state more each day.  I left Colorado in part because of the increasing price and declining quality of life.  In that respect I have experienced first hand what can go wrong.  So I get why you are scared of change, but let me tell you what worked in other places I have lived, and let me tell you what I liked about the other states."
politics,What do you see as the current greatest barrier to getting more women elected to state legislatures?  What can the rest of us do to help?
politics,"Your FAQ says that sally's list targets viable races.

What is the most common reason you have seen for a candidate to not be viable?  What advice would you have for someone who may not be a viable candidate today?"
conspiracy,How are the moderators manipulating upvotes/downvotes?
unpopularopinion,"You can also have a related problem by adding unrelated facts . *Like fox news posting articles about crime in cities -- who have elected leaders from the democratic party.*

You can also have a related problem by giving all the facts, but not reporting every story.  **Like fox news -- only -- posting articles about crime in cities who have elected leaders from the democratic party.*

You can also have a related problem by not pointing out biases that make things sound worse than they are.  **Like fox news posting articles about crime in cities who have elected leaders from the democratic party. -- But not mentioning that cities have more people, and the particular per-capita rates of crime is no higher than other rural areas and areas with leaders from the republican party.*"
conspiracy,2016
conspiracy,maybe if the conservative meme subs would follow the rules...
conspiracy,"It's just standard republican garbage.  There's no conspiracy other than the fact that this crap keeps getting posted to /r/conspiracy. 

Translation: If you don't accept the system exactly as it is, you're lazy and worthless!  Young liberals are bad and need to get off my fox news powered lawn."
conspiracy,"Like others have said, this is just a law of large numbers thing.  There are >1000 daily papers in the US reporting cases for daily, weekly, monthly, and total.  You also have publications reporting from different countries and world regions.  

So lets say you have 1500 publications probably posting daily number, weekly number and monthly numbers for 3 months.  That's 107 numbers per paper, or 160500 numbers total.  Given that there's only 1000 numbers from 0-999, it's not surprising that there's an article for every number."
coolguides,"> caustic soda, one of the most harmful chemicals to the environment

What?  You boil bagels in lye before baking them..."
politics,"Fixing the cap would improve it, but not fix it in my opinion.  There's several proposals out there, the most popular of which is the wyoming rule.  I think The EC and popular vote would have still been different for Trump with that rule in place though.

Personally, I want to abolish the EC AND change the cap for congress, but neither is likely to happen (unless the interstate voting compact gets more support from deep red areas)"
