subreddit,body
FIFA,"I've been playing two weeks. My best tradeable pull is an 8500 coin bronze. I wanted to play non PL this year, but the only good players i've pulled have been untradeable and PL (kdb, wij, vardy). 

I have gotten 84 jimenez 5 times this week alone as an untradeable dupe.

i started in div 8, got to division 5 casually and honestly feel like i am playing legendary ai with how everyone does the same thing every game. sit back, counter....all fucking game. 

I am expecting a shitty pl freeze today, and nothing from the challenge much like the 5x85's and 2 ultimate packs i got after doing those one league sweatfests.

but , i'll log in today, use my beckham and feel good pounding some bangers today.

edit:

man u sbc is of course something i can fucking afford to do. gg."
FIFA,"martial feels like he is the only player to resemble how they play in real life. Lazy, is really the only word i can describe, he just disappears on the pitch. I like son, but honestly my little goal popper has been jesus."
eagles,"If there’s one thing I’ll always remember about the post Super Bowl seasons it’s, 17 points. It just feels like we scored 17 in half our games the past 3 years. I know it’s the case but it’s the first thing I saw on the screen cap of this."
FIFA,"i needed one shot like you. I went into a game, scored to quick own goals and let the guy score a couple more. after seeing what i was doing, he brought his keeper out to let me bang some finesse shots outside the box in. From there, we just ran back and forth trying crosses."
FIFA,"i don't play competitively but am enjoying it because of that reason. I play some rivals to get rewards but live in the friendlies with objectives. I've gotten a ton of free packs, i don't spend money, and probably play at most 7 to8 hours a week if i am lucky. 

When i do play rivals though, the game isn't as enjoyable. 99% of teams i face do nothing but sit back with what feels like the entire stadium of fans in their box and then spam counter attacks. the friendlies are awesome because for the most part people are kinda kept in check with teams. 

for 20$ or whatever, if you get a few weeeks of enjoyment out of it, totally worth it."
FIFA,wish i'd done this one instead of the 2x ultimate and 5x 85. Got shit from them.
FIFA,"you can build the team, go to squad battles and keep playing the top team. start game, pause, quit, restart, and it'll give you a game played for loyalty. You get losses on your record , but it is the fastest way i know."
FIFA,"look up the completed challenges on futbin. 

https://www.futbin.com/squad-building-challenges/FOUNDATION"
eagles,"Great post, i don't agree on 7 but it's a personal opinion. I am sick of watching the guy every year and am done with him. I don't think he'll ever be a franchise guy. It's always something, whether valid or not, it's like the employee that has an issue with health, mental, personal, co-workers. I just don't get defending a guy that can't hit a 2 yard pass , since he was in the league. The refreshing thing with hurts was how he could hit those little quick LOS passes to guys in stride. 

There is always an excuse, but when you pay someone to be the best on your team and they aren't, regardless of reasons, he's not worth it and won't ever be. This makes howie, doug, and anyone else that had a say in giving him the money look like morons. Hurts coming in and getting it done, while not even looking great (just not as bad as wentz) shows the right hand didn't know what the left hand was doing as far back as the draft. 

I am done with the defense as well. No linebackers and whatever this CB play is for the past decade is just old. Schwartz calls the absolute worst blitz packages i've ever seen. If brees was playing last night, we'd had lost 24-49. 

i am happy they came out to play but the woes of 17 points rang true almost the entire second half. The last scoring drive we had woke me up a bit but there are gaps of playtime with this team where they just disappear for chunks of games. It's been that way since 2018.

Dough didn't even look like he was happy about winning against a good football team. 1 win against a winning team isn't getting me on a , ""things have changed!"" bandwagon yet."
eagles,Was wondering when this stat would show itself
eagles,"Well fuck, I tried to be negative  and hate on the team but I can’t. They broke 17 points and won."
FIFA,"Gold 3 , rare gold pack, nothing ."
eagles,"God I thought I’d get enjoyable football again. Fuck this team. This is just fucking ridiculous At this point. 

Fire everyone."
eagles,I’d fire Schwartz right now
eagles,The Philadelphia 17’s
eagles,"Predictable. Listen, wentz is bad which has been displayed by hurts making the simple throws he can’t ,but another game stuck on 17. Doug needs to go."
eagles,I hate to be a complainer but this game is being kept close by the refs.
eagles,"They’re fun to watch again! 

Entertainment is back on the menu boys."
FIFA,A little piece of me dies every time I do these and get nothing .
FIFA,I’m thinking of going back to that or the 4222. I was enjoying the 352 off meta to start because it was new and refreshing. Now that I’m settled in it feels like to much micromanaging and I am not great at seeing a wide field or stopping the nonstop counter attacks.
FIFA,"In in five 6 now, was 5 almost 4 , but started in 7.

I come across people that are just better than me all the time. In friendlies, in rival, in weekend league. I just haven’t seen it enough to assume everyone is farming me."
FIFA,Can’t remember if it was 18 or 19 but I used Jesus for the whole year.
FIFA,"0 . Bought the game Sunday after Black Friday for 20 bucks. My goal was to give them as little money as possible.

My best tradeable pull was a bronze I sold for 8500. I’ve made about 170k so far playing and bpm. I have a team that’s worth about 200k in untradeables."
FIFA,"It really is and it won’t change because no matter what, the addicts buy the packs up in a minute when they’re released. When people keep paying for garbage , why would ea change it?"
FIFA,van aanholt stayed in my team the entire year i played.
FIFA,I’m so bad at this game and I’ve been trying to figure it out . I just press them at different times and sometimes cool shit  happens but most the time I just walk into the defender. I’m waiting for an explanation.
eagles,"the best thing that can happen for the eagles organization is the oline or something they can blame his bad play on if he plays bad. 

The worst thing that can happen is him being either good or bad.

For fans, realize the organization is a mess right now and just hope we have an exciting and fun game. I remember 2018, and it made me throw up in my mouth. Not because we lost, because that was one of those games forever etched in my memory of a team that had no intention of winning at the start of the game."
FIFA,"leno - sommer - burki - 2 hadreckis 

lol."
eagles,Great job on summarizing this. I am in my 40s and you really put together those years exactly how I felt them.
eagles,"Because if hurts plays well, our front office and coaching staff look like absolute morons. 

Wentz should have been benched several weeks ago. He’s only getting benched now because pressure. 

If hurts is bad they look like idiots wasting a pick on him. 

I still remember draft night and the mental gymnastics people were going through here to justify the pick. It was a bad pick then and now it’s a lose lose situation.

The ideal results for the organization is that he plays like a serviceable backup but even average play is miles above wentz’ play this year. 

They fucked up. The head coach looks like he is going to melt down every press conference. The owner is in fuck watching the games mode and howie looks like someone who writes checks based on his mouth and not his wallet.

No matter how hurts plays the organization is an absolute shit show right now."
FIFA,"i am getting beat mostly on counter attacks, so my coins are going to backs with wheels first. I've found i score the same amount of goals no matter who is up front, and my cm's don't vary whether it's fred for 1k or wijnaldum for 30k."
FIFA,i find tuesday and wednesday to be utter shit for it. thursday thru monday to be okay.
FIFA,"as a late starter this year, and a zero fp buyer i really am enjoying the game. I have gotten fuck all in my pulls but i love managerial masterpiece, the silver objectives, and honestly enough stuff that i have no desire to play weekend league. I have my frustrations with some aspects but being able to play the game with so many different lineups has been nice. 

The great thing about friendlies, is there's no punishment. if someone is making the game unfun, i just leave. My stress levels and fun factor this year are much higher than any year, and i may possibly stay longer than my usual 2-3 months."
FIFA,maybe better to sub him in when i am down and use as my relief since my mids get gassed around 60-70min in?
FIFA,"I started about ten days ago , I did the placements in a bronze squad which plopped me in division 7. When I got to six I ran into some good players and some bad. When I got to 5 , I ran into every person who watched a YouTube personality and just spammed the same thing over and over. 

High press, counter attack over and over with wonderful drop back tactics on top of it.
Monce I figured out how to beat that and move up in div 5 I started playing some people that just shredded me with skill and I played people that were so bad I thought they were bots.

I really don’t think I should be div 4 and I’m fine with that. I haven’t encountered a ton of super elite players in 5. It’s a mosh of extremes , either really good or really bad and there’s few and far in between close games."
FIFA,"It happens so much, I don’t even wtf rage. I just sigh."
nfl,"anyone questioning this during the time was crucified. He was mediocre at best his first year, had an mvp year, was mediocre at best the following year, and mediocre at best last year. The problems he's having now were concerns then, he has had injury problems, and the franchise is a disaster. Anytime you brought it up with eagle's fans you were told to stop being a fan. 

but, if you told me we'd pay a qb to be bad for all but one year and win a superbowl i'd had taken it then, and do now. We are going to be bad for a long while now, the writing is on the wall. 

He wasn't worth the money then, and instead of paying someone 10 mil to be average and having money to build up a solid defense and supporting cast, we have wentz and alshon followed by a crapton of crap."
FIFA,"i typicall last around 2 months. Once teams become uninteresting and everyone is stocked up with the same squads and super players. Since i started late, i feel like i walked into that already. I'd say this year, probably mid january i'll call it quits."
FIFA,"i've gotten , ibra untradeable 4 times. Been playing less than ten days."
FIFA,"To answer the question, no. I have not done a player sbc and probably won't for the forseeable future for the reasons below.

this year i bought the game on black friday for 20$. I decided to just play, collect whatever the game gives me and if i can do an sbc i'll do an sbc. I wanted to do allesandrini but couldn't. Since I am not dropping another penny on the game, and starting late, if i do an sbc it'll need to be someone who i will use long term. Son is one of my favorite players in PL but there is absolutely no way i could even think of doing him. I can't even do 1 of the sbc's in his challenge.

My best pull has been untradeable kdb, untradeable martial. My best tradeable pull was some bronze player that sold for 7500 coins. I finished all the foundation sbc's and got pjanic and saul as the best pulls. 

I am 9 days in with about 120k coins, and a squad worth about whatever kdb+martial are worth plus a bunch of random golds for 20k. 

The way it's going, I may get to do one futmas sbc if i am lucky. It may sound like a real downer but it's not. I am enjoying the managerial masterpiece and rivals. Playing with a non-meta squad and getting free players has made the game enjoyable. 

my only regret is that i use talisca in my starting squad and love him, i missed his sbc."
FIFA,"the best is when you get into the box and see a wide open striker in front of goal a few meters away, you aim to pass, but eject it back to midfield."
FIFA,my best tradeable pulls this year have been from bpm :\
eagles,thanks for the different view and you may be right. Part of it is that i was watching rodgers toss balls with little effort last night also.
eagles,"""opinion"". It may have been the beer, but his arm looked really weak."
eagles,"I am probably one of the most anti-wentz people here. That said, hurts coming in only showed me a few things.

The oline is in fact awful at pass protection. Now, a lot of sacks are on wentz but hurts being in there showed just how bad the pocket is for our qb's. 

alshon ran a shitty route, fulgham dropped a pass. Seriously, alshon is done. Again, wentz has been wildly inaccurate and not good but seeing some of the plays reinforces that our wr's are not playing well. Hurts being in did show how bad wentz is at throwing players open but seeing the way alshon was running out there and the drop, it also shows some of this is not on wentz.

playcalling , it is that bad. Regardless of who's playing qb. 

raegor is good and will get better with hurts in. 

unpopular opinion, hurts is not a starting qb but wentz is THAT bad.  You have to go with hurts though, see what you can achieve with his ceiling. 

Some non-qb related stuff. Wtf is the deal with sanders? he's the best player we have on offense and we go out and grab howard who was cut last week. Sanders is looking good every single game and still is not a featured back..

I am over the cornerback philosophy of never turning around. over a decade of this tactic. they even highlighted this shit during the game last night on the lack of int's. 





it may be me, but i am not sure that hurts will have the nfl arm as teams adjust to him if he continues to start."
nfl,Seeing hurts play really amplifies how awful the line is at pass protecting
nfl,"So, after seeing hurts play :

1. Wentz is bad.

2. The play calling is bad

3. The oline is bad

Takeaway, some of the woes are not on wentz but some are. I don’t think it matters who starts , the team is awful, but from the small sample hurts as a rookie with hardly any playtime looks better."
nfl,Won’t even be mad if we lose. I’m just enjoying us playing like we want to win for the first in 2 months.
nfl,"Not just the fact this guy seems worlds more accurate than wentz so far, but wentz would have taken at least three more sacks on that drive"
nfl,Wentz looking for manut bol to throw to
nfl,"At some point , would you pull the trigger on benching wentz just to save the dude setting records for being the worst qb in the history of professional football? Like, I’m benching you so you stop hurting yourself type thing."
nfl,This team plays like a group of people that all don’t like each other in the workplace .
nfl,"Even if he didn’t slip, why the fuck even throw that"
nfl,Rodgers 4 years 134 mil. Wentz 4 years 128 mil.
nfl,"We have a back averaging 5 ypc, we bring in a back who was cut to replace him. Why? 

Wentz is still starting. Why?"
nfl,Rodgers tosses those passes so effortlessly. Wentz seems like he’s mustering every ounce of strength to toss it half a yard accurately. Don’t know how you can see these two qbs play and think wentz is worth the amount of money comparable to what Rodgers makes. It’s night and day just watching how they see the field.
eagles,Wentz costing points. He coulda taken three knees there and it’d been better.
eagles,Ward wide open there on third.
eagles,"Hey run works , better throw. Another week in Doug’s offense. Fuck this team."
nfl,I’m a closet Miami fan this year. Love the way they are a family out there.
FIFA,"I tend to get more worried when someone has an 81 rated team when I’m pushing gold 3,2,1.

The elite teams motivate me, the 70chem, weird teams scare me."
eagles,"Conversation and accountability is a few weeks late. Having this meeting this late in the season really only shows the lack of accountability. 

Any success the team has now only serves to hurt our draft pick next year. It’s a sad fact , we have money problems, on top of winning problems. We desperately need to draft well next year and winning hurts that."
FIFA,"I am casual, maybe an hour a day at most if i can even get that. I don't buy packs, and wait till black friday to purchase the base game. One thing i've learned from starting hardcore in 2016  to being where I am now in the game, is to really only get players i plan on using long term. 

futmas is hard because i love the designs, and there are usually several players i want. You just have to pick and choose if you don't buy fifa points and play at a healthy level of time invested. It stinks that i'll never get those son potm's, or aguero's , and my best sbc is usually towards the end of the year but that's how the game is made. 

i play rivals and squad battles, not being able to really get enough time in to go high up on either of those. i collect my rewards, and just keep collecting. Some years i get lucky, some years i don't , but i just take what the game gives me."
SeriousFIFA,"I started playing with the 352 and saw incredible results. Taking me from div 7 to 4. 

current team - https://www.futbin.com/21/squad/3733931

i packed kdb and wijnaldum today and was wondering if someone who plays the formation can point me in the right direction to finish it up. I have only been playing a week, so my budget is only around 100k.

thanks."
FIFA,"playing 352 and really loving it. Current squad:

https://www.futbin.com/21/squad/3733931

i just pulled untradeable de bruyne and wijnaldum . Have 100k to spend as well. Any suggestions?"
eagles,anyone that can summarize after the pay wall portion?
FIFA,"yup, i don't think people realize it's free coins for minimal effort. i always appreciate seeing these posts."
FIFA,"everything outside writing the down the dupes for me. I am even more casual. I fill up my transfer list, i'll relist a couple times and then send all to club after 3 times relisting. typically this has me opening 5-7 packs every hour and keeps a steady stream of coin coming in. I average about 10k a day bpm'ing and i don't check it every hour. i relist before work, at lunch, when i get home, and when i go to bed, refilling as necessary. On the weekends, i'll upgrade bronzes to silvers if i feel like it. I don't plan to play fut champs this year (i didn't actually purchase fifa until black friday to avoid the urge to buy packs). 

But yah, bpm is tried and true and keeps money coming in when you don't buy fifa points and don't play the market."
FIFA,"hey /u/wahoos22, 

just wanted to update and thank you on the recommendations for the squad. I bought the game on black friday and tried pounding out the normal 4231 which i just don't enjoy. Your recommended squad using my only good pull (martial) has worked wonders.

I placed in div 7 rivals before switching. I've not lost once in rivals since switching to the 352 climbing up into the 5 range now , i've only lost 1 game and had a several ties, but everything else has been wins. 

I am using the standard to just get familiar until i start messing around with tactics but it's working like a charm.

I think this is going to be the formation i stick with long term because it uses another fun formation as a backup the (4222). 

Right now, i feel tolisca and anderson are really holding me back on the attack. Felipe because his gold isn't too great at cam, and him as a striker is hard cause he has no physicality or hold up play. 

if you aren't busy, was wondering if you could give me some ideas on players to move forward to. My pack luck is shite, and only have around 100k to spend but would like some long term goals.

Edit: packed kdb and wijnaldum untradeable."
eagles,"You have to fuck up real bad for us fans to call for your head 3 years after our first super bowl win and howie, Doug and co. are some how doing it.

There’s only 4 pro bowlers on that roster . Foles and wentz aren’t really elite players that were legendary picks.

So, that makes it look even worse. 

The last explosive wideout we have drafted was Jackson. I’m in 40s and think Lito/Reggie were the last decent cb we drafted. 

Shady the last but sanders is the real deal.

Barnett looks like a meh pick. Linebackers? Fuck, I haven’t seen any remarkable ones here since Seth Joyner days. 

I’ll take the Super Bowl win, but historically we haven’t really drafted hall of fame talent in a couple decades."
nfl,"Because he was almost this bad for most of last year. We won the division by beating the nfceast with the last 4 games.

The year before , he was playing mediocre at best. Foles came in and lit up Houston , and the Vikings gave us a wildcard.

His rookie year, he had one or two good games early and then looked a little below average at best.

2017 , he had a good year statistically and that’s the exception.

Wentz from the past two years and his rookie year were not good. 5 years and 1 good season do not make this an anomaly, it makes 2017 the anomaly.

People saying he played good last year or even the year before are remembering a couple games and not the entire season."
FIFA,"decided to buy the game during black friday, sucks that i was unable and still am unable to enjoy any of the content or players released. I made around 70k in a couple days by doing my qualifiers for rivals with martial and 10 bronzes (actually won 1 and tied 2, was shocked). The coin boosts helped a bit to build me a solid starting team. 

My goal was to wait, so i didn't build myself up thinking i needed to participate in black friday. It offers no sales outside the base game. I've done a few of the foundation sbc's, and opened about 15 packs that were handed out, my best player being martial untradeable with like my very first pack. 

i honestly can't believe people toss their hard earned money at this shit. It's fun and i enjoy the game but they'll never see a penny from me outside paying for the base game.

reading the posts though, i don't think us non-spenders affected the game's sales though. reading the packs still sold out in just a few minutes."
eagles,"Yah, why the fuck does he keep putting wentz back in."
FIFA,"I don’t treat it as something I have to do, instead I treat it as entertainment. Something that gives me some fun at the end of a long work day.

I logged in tonight and wasn’t feeling it , played two matches and punched out.

I don’t buy fp, I don’t stress over sbcs. I will probably get one great player at the rate I make coins and that’s fine. 

I typically play the game about two months out of the year. I hit a point where the cash grabs are just overwhelming.

In one sense I agree because of the content. The chances of pulling a promo or totw vs drop rates is absurd. It’s just too many players with unneeded upgrades.

I feel like the game tries to over complicate itself and lacks consistency on mechanics. It’s trying to put in realistic stuff while the base mechanics are unrealistic (pace, positions, chemistry, etc..)

I honestly preferred the finesse long shots and ping pong , arcade style over the past two/three years."
nfl,"Wentz is reaching Ryan leaf levels. Lurie has to be making the call on keeping wentz in. There was absolutely no reason to keep him in the past two weeks. 

He’s actually getting worse. I’m at a total loss trying to figure out why the dude is still on the field."
nfl,"Wentz is waiting on receivers to be backyard football open. I’ve been really trying to just look at why he’s not throwing and he just doesn’t see the field or believe his receivers will get open. 

I honestly believe he has no faith in throwing. There are hardly any coverage throws or contested throws. Missing easy slants, off target with a guy three yards out.

Seattle has a historically bad defense this year and that drive was the best we could muster. 

Unfortunately, that drive keeps wentz in."
nfl,"Gonna watch a hallmark movie with my wife , rather be just bored than bored and upset."
nfl,"In all seriousness, I’ve been watching football over 40 years and have never seen a an this bad week in week out not get yanked. They aren’t just bad, they’re not even trying. It’s like they are trying to make themselves unwatchable."
nfl,"1/6 on passes wentz, jfc is hurts that bad? Is sudfeld that bad? Wentz is the worst qb in football. Running it three times in a row is better than this. 

Fuck, enough is fucking enough with wentz."
nfl,Come on guys let’s get three yards at least on this drive.
nfl,Defense gets a 4th down a goal stop and we get two yards as a thank you. Defense gonna be gassed by half time and eagles fans will call for Schwartz head.
nfl,Announcers really amplifying just how bad the eagles are on offense. “3 and out for the eagles and Seattle didn’t even need to make a tackle!”
FIFA,"thanks man, i am from pompano."
