subreddit,body
FIFA,"if you are still around /u/wahoos22 , was hoping maybe you could give me a good starter team. Picked up the game on black friday, i am just looking for a fun formation. i have no intention of sweating real hard this year and my very first formation back in 16 was the 352. Anyways, i don't have much.

I pulled martial in my beginner pack untradeable (willing to use him as a sub if he's not ideal on this formation). 

I have 75k to spend. also have talisca, felipe anderson, and allan untradeable. 

cheers.

watched a streamable of yours by the way. 305 ?"
FIFA,"The games own currency isn’t worth using on packs and people think throwing real money at them is better value. 

I got the game at Target yesterday for 20$ (29.99 and I had a 10$ coupon). I’ll deep around for a month or two and move on. It’s fun for a couple months each year. 

I use what I pull and just save my earning for players. I never get the meta players but I build fun teams and play casually. I’ll do a weekend league once or twice and play drafts, rivals casually.

I don’t even pay attention to the events. When you treat the game as a source of entertainment and stop pretending you will be on the main stage competing but the best players are the only thing holding you back, the game is a different experience. 

I just feel bad for all the people that will wake up one day in their mid 40s like me and realize just how all that expendable income really wasn’t expendable (there’s no such thing)."
FIFA,Ea access is included in game pass now. Do the old fifas have active rivals and weekend league? I just want play casually and mess around and was wondering if there is any value in the older versions? How active are they in terms of market and population?
FIFA,"this is me. everytime i think about buying it, i come here and this sub saves me from paying for it. I'll wait till it's on ea access and play it for 4.99 for a month."
eagles,who?
eagles,didn't chubb  delete him with a stiff arm this weekend?
eagles,"The coaching staff doesn't feel that hurts is better than the worst qb in the league right now. That alone, should quiet people hoping he plays."
eagles,"there was a time, actually many of times through my 40+ years of life that i said to myself...i don't care if the eagles suck forever after, just give me a superbowl. If you give me what the rams have been and are, vs the eagles , i'll take the superbowl win any day of the week. if mcvay and goff were winning superbowls left and right, then yah.  whatever the reason we won it all, be it  reich, stars aligning, we won with wentz for most of the season and pederson as coach. 

That said, wentz is not good and pederson is a bum, and if they both left tomorrow i'd be okay with it."
nfl,"old news, we been hearing this for 11 weeks now."
eagles,maddox at a 39.3 ...jfc is he that bad?
eagles,"you don't pay a guy this kind of money to be coached on how to throw check down passes. every week, the breakdown shows he is not good. Good coaching could help him not suck as much i guess, but it doesn't fix the fact we threw the house at a guy that cannot perform at a level that matches his money."
Genshin_Impact,thank you.
Genshin_Impact,good stuff thank you.
Genshin_Impact,"someone build me 3 teams. open world, abyss 1, abyss 2, and suggest 2 dps for me please? I am ar45 and struggling a bit, so trying to mix it up. My lineup excluding the freebie ones:

c6 fischl, c6 barbara, c3 ning, c1 jean, c4 diona, c6 xiang,  c4 xingq, c3 noelle, c1 sucrose

no constellations. beidou, chong . venti, klee."
eagles,"this is just a go through the motions thing. if the team was good and just rusty or it was just injuries, we'd had made some progress. so far, the team is regressing as we get healthier and as the season goes on. They're just going to go out there, run the same plays , call the same game, and punch out when the game is over. Doug has no answers which is clear by his answers."
nfl,"what's that say about hurts though? Wentz is the worst qb in football this year, no questions asked, and our coaching staff thinks hurts is worse than that."
eagles,I don't even think the big thing here is him taking a sack when he coulda thrown the ball away. It's that it looks like he didn't even know what the play was from start to finish. You aren't seeing that he rolled out to the side of the field with zero receivers on it and did the fake handoff to the side with no running back.
nfl,"they threw the house at wentz to draft him. they threw the house at him to keep him and it turns out his one good year was also the year foles looked liked a hall of famer (after 2 bad games , foles lit up the world). The eagles organization is on the verge of total collapse and they're going to have money issues going forward with or without wentz. They're uninspired, bland, and just not a fun team to watch. Drafting hurts in the second, and then watching the coach say benching wentz says the wrong message that the season is over should be all anyone needs to see. Doug essentially just told his rookie, that starting him would mean the season is over (wtf says that as a leader?) . The eagles could have nabbed winston, or any of a dozen backups they'd never put in. Instead they blew a second round pick and suffered with horrible o-line play, linebackers that get sent to another galaxy by stiffarms, no replacement at safety, 1 good cb, etc.. They are in bad shape, the coach is in denial, the qb has had 1 good season and 4 mediocre/ bad seasons while taking enough money to probably purchase north dakota. 

The only thing good out of this season, is it's shutting up a ton of eagle's fans who , in all honestly, are worse than this team. They come out of the woodwork with their weird statistics, excuses, and overall insults like we are supposed to just love a shitty team even when they're shitty as some sort of way of life or we aren't true fans. I have no issue turning this team off and watching exciting football, it doesn't make me less of a fan, it just means i don't want to watch a shitty qb play like shit week in and week out."
eagles,"So you feel that the worst qb in the league is better than the 2nd round qb you blew a pick on? Basically saying you can’t draft or win, got it , thanks."
nfl,"this is such a good point. we drafted raegor which was a questionable draft in the first, and then we take a qb in the 2nd. Why take that pick if you aren't going to use the player when the person in front is playing this bad? it makes the draft pick look even worse."
eagles,"jfc it was a bad throw.

i've seen , ""well wentz got married"", ""well wentz got married and had a kid"", ""doug wrote a book"", you name it. HE IS FUCKING AWFUL. no matter who you blame will not change the fact he's bad at qb."
eagles,"this is a team going through the motions to just get through the year at this point. There's no passion or drive. Doug is sticking with wentz, schwartz is sticking with with what he's doing. I wouldn't expect any big time changes because they are going out there and playing solely because they're getting paid to and that's it. 

we're stuck with wentz and doug until lurie decides enough is enough. Putting hurts in will only energize the fans, it doesn't solve the fact we paid wentz 100mil + to be bad on the normal and  average on a good day.

organization is in a bad place. drafting sucks, playcalling sucks, contracts suck."
eagles,"he was average at best the year before that also, he had a 4 or 5 game stretch down the line last year with no talent that made people a believer but his overall play the past 5 years combined is below average. anything thinking he is better than average is living in a fantasy."
eagles,team can't draft. you think they can rebuild?
nfl,still can't get over the guy telling me doug writing a book is the reason wentz and the eagles suck.
nfl,"it's just eagles fans trying to make themselves feel better saying ""wow you didn't blow us out, you mustn't be that good, LOL!"" fact is, you guys played good football and are 7-3 and have an amazing fucking running game and defense. gg, my dude."
nfl,"why? the score doesn't reflect how much the browns dominated this game. a td with 1 minute left isn't something to say this was somehow close. the browns played good, real good."
nfl,"of course, alshon should know to jump 15 feet in the air to catch it."
nfl,"there's absolutely no way, he doesn't get benched for next week. how do you even justify keeping him in after that throw?"
nfl,worst throw of the year.
nfl,"oh god, more wentz. yay."
nfl,"hopefully we get to see a hurts drive after this, game is over and i don't think it does any damage at this point. wentz has taken a beating, and offense isn't really putting anything out that is productive."
nfl,"wentz launching it into triple coverage....and for the best excuse today, must be because doug wrote a book after winning the superbowl."
nfl,is that your reasoning as to why we suck? doug writing a book?
nfl,throwing an incomplete pass in teh direction of a receiver. he had dg he could have just overthrown.
nfl,"take this fucking guy out of the game for fuck sakes. throw it away, or to the open TE that you didnt see, anything but giving up points. Wentz is repsonsible for 9 of cleveland's twelve points......seriously, wtf bench this guy."
nfl,how in god's name is wentz still playing?
nfl,how can you expect wentz to be good with all the political turmoil going on? i know....forgot about that. he's forgiven.
nfl,"this is just an off year for wentz. We got it next year. hard for a guy to succeed with unfair weather conditions, less than 20 seconds in the pocket , and he doesn't have 5 jerry rice's . next year he'll be better."
nfl,corned beef
nfl,wentz finally checks down...on 3rd and 20.
nfl,how did we even win 3 games? jfc...
nfl,quicksand
nfl,"just like every other week, the announcers are showing wr's open and wentz not seeing them. i just don't get how this guy is still starting at this point."
nfl,who to blame now wentz homers? the weather?
nfl,beautiful cleveland weather today.
nfl,"gl brownies . I have no rage left in me, so i am just hoping for an entertaining game and not the boredom i've experienced all year from philly."
Genshin_Impact,"No, but I am older and a home owner, with a family...when i see people here and in games like FIFA say they have ""disposable income"" on virtual goods i get a little sad inside. There's no such thing as Disposable income for 99% of the world. Gambling on goods that don't exist blows my mind. It's one thing to buy a game for entertainment and what not, but to keep throwing out your money so you can do the games chores better, just doesn't make sense to me. If i had an extra 1k i'd buy a new lawnmower."
Genshin_Impact,"if by worst is she the best dps? nope. the best healer? nope.

But, she can do both of those roles good enough that she is probably one of the best characters to have on your team for all content. She's not exciting to play imo but she's a staple in my groups just because of utility."
nfl,"it doesn't matter who starts. they can't evaluate talent anyways, wentz had one good year and the rest has been average, hovering at below average with wow moments sprinkled in from time to time. we have an organizational problem from scouting (fulgham being the exception and not the rule), to drafting, training staff, coaching, contracts, and so forth and so on. One player doesn't fix problems when you have a coach who , had he not gone for 2 so many times or kicked field goals instead of going for it on 4th from the 30, we may be looking at a different record this year. 

This team is actually just boring to watch and putting hurts in will only generate some temporary excitement. He does deserve a chance to start , anyone else in this league would be benched by now but they threw the bank at wentz and he's the face of the franchise, so if it hasn't happened yet, i don't see it happening."
eagles,"S & S the only things i've been excited about this season , with some fulgham sprinkled in for a few weeks."
eagles,"Give me the difference in what we paid for wentz over keeping foles any day of the week. Foles being worse doesn’t matter much when you factor in we paid a qb elite money to be at the bottom of the list. 

He wasn’t worth the money to begin with and now we are in cap hell with old uninterested players, bad coaches, and a shitty franchise qb.

We are entering a rough time period and it’s gonna be a while before the ship rights itself."
nfl,"How has tua looked winced starting, overall?"
eagles,"according to this sub, not throwing two picks, fumbling two times, and not costing us the game makes wentz elite/good. having a slightly below average game by another qb , i guess means wentz somehow played well."
nfl,"going for 2 down 4, just highlights the absolute disaster this team is. wentz is getting paid top 10 money but probably wouldn't start on a top ten team, guy is lucky if he's considered a top 25 qb by end of year. I know, i know, o-line, doug play calling, injuries to wr's, bla bla. He's not a good qb, and the eagles  threw a shit ton of money at a guy who's one good year is the exception. W/e , gg giants, the better team won today."
nfl,"jones threw some nice passes today. if you watched the whole game, the giants just played a straight up better football game all day. our defense had really no answer to the gameplan."
eagles,the defense gave us 3 chances to tie it. how come wentz gets a pass every week?
eagles,dough isn't throwing 15 foot high passes to 5 foot running backs. can you take your lips of went'z knob and realize the guy's one good year is the exception and not the rule.
eagles,"fucking defense actually turns it up to hold them to 2 field goals and wentz turds it up again. This fucking guy had 1 good year and people think he has some sort ""it"" factor. He's a bum."
eagles,gg giants
eagles,that's why wentz is not the answer.
eagles,"defense held tight 3 drives only allowing 3. Let's see if wentz and doug cannot go full moron here and actually put a drive together. im ready for a 2nd and 10 hurts play for no yards , change my mind doug."
eagles,"that's the , we give up, handoff."
eagles,can someone give me a serious answer on why we went for 2?
eagles,"since the chip kelly days, we keep having these corners that never turn their heads. Whoever our cb coach is, has to have been here with chip kelly."
eagles,"tell you right now, i am not watching another year of us sucking and just hoping the rest of the division and other teams suck worse   the last 3 weeks. if we lose this, i am punching out the rest of the year and ill watch the highlights. It's just not fun watching them, they're not just bad , they're boring af."
Genshin_Impact,"Do you want all the characters and feel like not getting them all for free is unfriendly? Then no.

Do you want to get 5 star weapons? If yes then , no.

Do you want to have access to upgrading more heroes at a quicker rate? If yes, then no.

You can play this game top to bottom with what it gives you. You may get lucky , you may not, on banners.

You have a solid few weeks of casual playtime to make the determination though. Nothing you would be doing the first few weeks has any real impact on anything outside of character development and you can find guides on using your resources wisely.

I put 60$ into the game at launch and haven’t dropped another dime, and don’t intend to."
Genshin_Impact,I keep getting blown away by the quality of the game. Ning looked like such a badass during the jade chamber fight.
Genshin_Impact,How would dionas shield work with beidou? Does it help accumulate absorb burst or does it ruin the beidou counter?
politics,"Vet here. Good, fuck him."
Genshin_Impact,"I did 30 pulls from what I had saved up. 

2 x ning 

1 x beidou

1x Fiona

Not great , not terrible. I really wanted beidou though and c1 ningg, so mission accomplished I guess."
Genshin_Impact,"I played beidou in the beta, she’s my favorite character . I don’t care if she’s top tier or not I love her design. Ning , because I want c1 her and use her as well. If I get the 5 star that’s nice but I’m rolling for the 4 star."
politics,Putin was congratulating himself in 2016.
Genshin_Impact,No way I’d buy the bp just for the weapons . The crafted ones are free and comparable .
Genshin_Impact,"worth it? no. necessary for end game? arguably , yes. 

It's basically just resources that take forever to grind, and that's it. I think they should give you 1 acquaint every 5 levels, and 1 intertwined every ten. Then it'd give you something outside of resources worthwhile. 

I am hoping we see some cosmetics in there, maybe some cool food recipes and some fun stuff. Right now, i feel like i have to get it but don't feel like it has any value outside of the materials that i am starving for."
Genshin_Impact,There’s a tree branch you can stand on and not get hit by anything. Sure it takes about 4 minutes to do with fischl charged shots but it makes the boss trivial for me.
politics,"on decision desk hq, philadelphia county hasn't even hit total numbers matching 2016, for what it's worth. I am expecting more since the state totals are more than 2016."
Conservative,"can only speak for florida. when you request a mail in ballot it's logged in your voter reg. So if you request one, and go vote in person they'll pull up your file and see that you've requested a mail in ballot. If you've already sent it back and they received it then you cannot vote. If you requested one and didn't not send it back in you can vote in person. 

If you send it back in and they hadn't received it, then go vote in person with those intentions it's a federal crime. The county you are in will reject one of them though."
politics,my wife voted for trump and also the 15$ dollar increase.
eagles,"i don't doubt his intelligence, but i doubt his processing power after the snap. there's been a few instances where the announcers have said, if he just put the ball where his receiver was going it'd been a touchdown. ANother instance of him doing a fake handoff to the wrong side and then a rollout to the wrong side all in one play. 

I don't think he has that reaction intelligence or processing power in his brain to really scan and react with speed. he's slow on putting the ball where it needs to go way to often.

short passes look like way to much work with him and it's way to many miracle prayer throws each game. He has a few bright moments but they're the exception and not the rule."
Genshin_Impact,"how did you get the resin to get the materials? If i had unlimited resin, i could see it as a posibility but it's looking like 2 weeks min to get a character 1-80 with the restrictions."
Genshin_Impact,"nothing is more deflating than hitting ar40 and realizing just how long it'll take you to get a character from 1-80. it's so bad, it's made me debate putting the time into the game."
Genshin_Impact,"if we're talking pick 6 numbers in the lottery and win millions. you have  a better chance of getting struck by lightening , twice.

if we're talking about scratchoff tickets , probably scratch off tickets.

otherwise, casino. 

Lastly, gacha. i don't see value in spending money on something that is not permanent. If i leave the game out of boredom, i spent money on something i don't even care about anymore. I just don't value temporary money. FIFA really opened my eyes to this."
Genshin_Impact,"im 40+ and still exploring liyue and opening chests. I have to decided what i want to do when i log in. I get maybe 2 hours of gameplay in a sitting and between the dailies, weeklies, events, and resources for characters i am not running out of things. Most of my time is revolved around upgrading characters but isn't that the ultimate goal anyways?

I realize people rushed through and have everything found but just giving an different perspective that some of us still don't have all the shrines for max stamina and are at ar40. i am on 9/10 of geo shrines with a huge chunk of area that isn't fully explored."
politics,"Honest answer: i do not know. My wife is highly intelligent, she is extremely moral, and an incredible woman. I never thought she'd hitch a ride on the q-anon train. 

You have to remember, once someone goes to a side their fears are being fed by predictions. After the news of the trump supporters surrounding the biden campaign bus, the first video she saw was of someone saying how democrats assassinated three trump supporters. When the fear is that believable, how can i predict the way she justifies anything. My wife legitimately believes the democrats are going to take away our freedom, and lock us in our houses until we rot. that's what she sees from the youtube personalities she watches."
politics,"My wife , is a trump supporter and she's actually been crying at points worried about what she believes will happen to the country should biden win. I've  just pretended to not care about it  to alleviate the stress she's going through and the anger she has when she asks me why I am not voting for trump. 

I've never seen anything like this in my 40+ years, and my biggest wish is that we can mend our divisive behavior towards one another sooner rather than later."
eagles,"outside of about 20 minutes of play, wentz has been pretty bad for a majority of the season. Sure it's a mixture of bad o-line play, receiver drops, game plan, but he's not helping himself with the turnovers and has kept bad teams in the game with mistakes solely on him. 

we are basically getting 2-3 good drives a game out of him, and the rest is just hard to watch at times. 

Press taylor isn't the one throwing the ball 6 feet above a 5 foot running back. he's also not the one holding the ball for 5 years, taking sacks and fumbling when he could throw it away. There was a play last night where wentz did a fake handoff in the wrong direction, rolled out to the side of the field with no receivers, and that's press' fault? The int's were just horrible decisions. Every announcer every week has pointed out that he is holding the ball too long. We've seen clips of receivers open week in and week out and wentz looking the other way and taking unnecessary sacks over and over.

it's like watching someone trying to dig a ditch with a rake and fans defending the person saying , look how hard he's digging instead of asking why he's not using a shovel. It doesn't matter how hard wentz tries to dig the ditch if he's using the wrong tool. He's here to stay, and if he wasn't benched last night, he's not getting benched. Seeing someone get paid as an elite qb and after 5 years have one good year is frustrating to watch. The last 3 years and now this one, have proven he's average at best with some wow moments sprinkled in."
nfl,"Should be happy for a win but I’m honestly just sick of watching wentz and the team as a whole. If we win the division , we get a game to lose and drop what ten spots in the draft? It’s been kinda the same shit the past 3 seasons."
eagles,Yes
eagles,This team gets no more time from my eyeballs
Genshin_Impact,You are soling the 90 level domains after just hitting 40 and it’s a breeze? I envy you.
nfl,"Only about half the base. Wentz in 2016 was the exception not the rule. I don’t see how you can defend just how bad he plays, but they do."
nfl,"When will it be enough for half our fan base that wentz is really slow at processing the game after the snap and is just not fucking good.

I feel like I need to treat the eagles like an nba game and just check in during the fourth quarter cause they just don’t play football for a full game.

Dallas has let up historical yardage and points, you get a tight end and receiver back and you can only muster 1 score in a half. 

Send dough packing with wentz in the bag. Ffs, I’m tired of watching this guy and listening to fans scream excuses or that he’s back to being elite after playing good for 3 minutes a fucking game."
eagles,Doug and wentz fighting over  who can make the worst decisions on offense.
eagles,"A defense that has let up a historic amount of points , should be easy Pickens against them right? Wentz, “hold my ... oops dropped the beer”"
eagles,Ten minutes of good ply from wentz is enough for some people I guess. Between ints and fumbles he’s gotta be closing on 20 turnovers by himself midway through the season.
Genshin_Impact,"I was trying to hold off on hitting 40. I’ve just been enjoying what the game throws at me and my characters are a mess and I still have hundreds of chests to find.

The mobs are a bit tankier and I noticed how lacking some of my equipment is but it’s not impossible, or frustratingly difficult.

Now the domains? They are a huge step up. If you whales your way through the game, had the characters and resources to upgrade right when you dinged 40, maybe it’s easy. For me with minimal money spent and needing to farm resources at ar 40, domains are only possible via co op."
politics,How do you develop immunity to a disease that comes back again after already having it?
Genshin_Impact,"As long as you learn a lesson then that’s all it is, a lesson learned. I learned mine in fifa years ago. Now, I don’t even get tempted by these games. Remember it’s designed for you to lose more than you win. If you threw 100$ at the game and got every character miyoho would have nothing to sell you. This is the same way casinos stay in business. 

If you can’t control your urges, stop playing though. Gambling is a disease."
