subreddit,body
Genshin_Impact,"I really don't think the game is predatory. that's a dangerous word to use and should be reserved for games like FIFA where it's competitive and the boxes are designed to pull in money using the competitive edge.

Genshin is restrictive , but you don't need any of the gambling nature of hero collecting to progress or succeed. No one is forcing people to play 20 hours a day, using resin either. 

Does it suck? yes, it's stupid that you can spend 100$ on a video game and not get Messi or Ronaldo or Klee. The difference is that in predatory games, those lootboxes impact your overall success in a versus environment.

Streamers dropping thousands and flaunting their results to users is just irresponsible. Promoting a psychological behavior with the excuse of ""it's my job"" is shitty and will always be shitty. 

I laugh when folks say things like ""i have expendable income"" , or ""it's a gacha you should expect it"". there's no thing as expendable income, when you get to my age you are going to look back at the thousands you think you can throw away and really regret it. Second, just because something is being done as a standard , ie gacha's, doesn't make it an acceptable format.

these games , especially mobile ones, do this because people like you and streamers allow it. If you really think any video game is worth 400$ a year to play, or more, by all means just own up and say to yourself ""im gladd i pay 400$ a year for this""."
Genshin_Impact,What artifacts and weapon setup are people using to maximize klee’s usefulness.
Genshin_Impact,"my f2p is also lucky, and i've put maybe a day into playing it.

https://imgur.com/a/B6KYoPO"
Genshin_Impact,"I hate it because teh weapon, primos , are the least important to me. It's the mora and mats that I needed to get it for and it really sucks I paid to progress."
Genshin_Impact,"keqing, has fencer poses and her actions mimic those. She's got the most satisfying auto attack combo in my opinion as well. All her abilities feel like they represent her style. My favorite character in the game so far that i've played."
Genshin_Impact,"yes but the reason these games are so popular is that people like me and you are actually the exception and not the rule. They make millions because the normal people, are in fact the ones throwing thousands at these games."
Genshin_Impact,"Wow, good on him for this. It's incredible he recognizes it. I've watched his streams and really hated seeing how much he spent without realizing he was ecouraging this predatory stuff. I am just glad he's putting it out there and realizing content creators (games like fifa and what not) promote this behavior on their viewers."
Genshin_Impact,"I spent on my ps4 account (about 70$ total, blessing, bp, and the 49$ gem pack to start). That account has venti, and jean and traveler as my only 5 stars. Not a lot of good 4 stars or weapons etc.. THe account is AR 39.

My pc account, i made for kinda when I was in bed or bored or w/e to play on mobile is free to play and only AR 20. I have venti, qiqi, jean, keqing, and traveler along with a ton of useful 4 stars (sucrose, razor etc..). Not a dime spent, and far better than my ps4.

So, as a logical old man i look at twice the work on my ps4 with  and money invested vs my pc account , no investment, no time investment and much better results by not spending.

choice is simple, i am not giving them another dime unless it's something tangible like a costume or something."
Genshin_Impact,"well, i mean you are basically running 20 leylines, and 20 domains for no rewards. it is a choice, but the weekly bosses do require it right? I forgot you can do run them with no resin , i just hate doing it. thanks for correcting me on that."
Genshin_Impact,"it's the choices and the resin wall that impact you.

So what WILL happen is you will get to 50 or 60 on a few characters pretty easy. Then you have talents, weapons, leveling, artifacts, ascensions, and all that jazz as well as mora. 

You only have 120 resin, soon to be 160 i think. This limits what you can do daily, and when farming materials you also have to deal with rng. 

So, if you are needing levels, then you have to focus your resources on just leveling. That'll give you 6 leylines a day currently or 8 after 1.1. This is really not a lot and you'll be clearing leylines at 70 to 80 for a while. This becomes a problem witht he battle pass also, which requires you to do domains, world bosses, etc.. for bp exp.

It's not impossible to level, it's just over punishing the player for wanting to level a character. THe problem with this game, is at end game you really can't focus on different types of progression at once. You have to focus on one thing, but then have to do requirements for weeklies/dailies as well. 

again, not impossible but for the reasons above, it fucking sucks and makes the game a pain in the ass to enjoy late game. this is really impactful when you are AR 40+ and pull a new 5 star character or weapon."
eagles,"If we played the whole game like we did in the 4th against Baltimore. The whole game like the 1st against Washington. If they can play a full football game instead of bursts of good play, they can beat anyone. This teams worst enemy is themselves right now."
Genshin_Impact,"Yah, sucks I threw money at my PS4 account. I only made the pc account to occupy time driving, on webinars and stuff like that. I just keep pulling good characters, and after another 5 figured I’d just stop playing the PS4 account. 

I’ll give razor a little more time playing. Was using keqing as my primary deeps."
Genshin_Impact,Thanks. Open world I’ll fill as needed but for abyss I was curious.
Genshin_Impact,"so my ps4 account that i actually spent money on has 2 five stars , jean and venti and nothing else. Have had bad luck with 4 star rolls, you name it. ar 38

My free to play account, ar 20, just keeps getting lucky and lucky. So, i am plugging a controller into my pc and retiring from ps4. This is my free to play account below. Can someone recommend me a good team that synergizes well?

https://imgur.com/a/B6KYoPO"
nfl,Maybe he’s just trying to channel his inner wentz.
Genshin_Impact,"If you are playing free to play , not much to complain. This game sucks for people who want to pay,  just not 400$ for a 5 star. Someone like me, who has no problems throwing 60$ at a game and 10-20$ here and there. It’s actually better to spend nothing than spend a little bit, that’s the real problem. You choose to either spend nothing and never have anything or drop thousands, there’s no satisfaction in the middle."
Genshin_Impact,"I can’t take him out of my team, I didn’t even level him forever. I just popped field and went to work with fisch, xiang, etc. now I am maxing him out because he is just too good."
eagles,"one of my favorite all time eagles players. was so stoked to put his jersey back on and those two td's against washington gave me so much hypes. After the offseason events, and another year of no productions, I wish him well and thanks for the memories but there is no way he's in an eagle's uniform next year."
nfl,"No worries, I didn’t take offense my dude. It’s a weird dynamic."
nfl,"I’m in my mid 40s and her in her mid 30s. I think just from being older, I vote for who I want but I’ve been hearing Clinton is going to take my freedom away , Bush is going to take it away , etc... that I just try to live a good life and roll with the punches. Until political profiting goes away none of these people are there for you. They may start out that way but they never end that way."
nfl,this is the correct answer.
nfl,"oh, i don't care if people know. she's a trump supporter."
nfl,"it's not, i am quiet most of the time in hopes that when the election comes to pass she'll move on."
nfl,"he should have had a touchdown last night, one was carson not having faith in him, and one was him just a little bit out of bounds on a perfect throw by wentz. I hope he continues this trend. 

he looked solid last night again."
Genshin_Impact,"I think this game , for free to play players is best designed to run it once and just come back for new content. There is no real progression outside of abyss and I just don't think the rewards are worth the effort. There's no pvp, no guilds, the co-op experience meh at best. 

There's a major gap where people need to realize, light spending in this game is not worth it. You either go f2p or whale. It's honestly better to light your money on fire than it is to throw 10-20$ here and there at this game. 

i am ar38, and last night was really the first night i didn't feel like logging just because i didn't have the energy to chest hunt, or go through and see what resources i needed to farm and far off i was on getting what i needed to get done. I have characters I want to play but there's absolutely no way, I am grinding out another one. I love the game and feel like i got my 60$ worth that i threw at it, but i just don't see myself continuing down this path. The best weapons in this game are gacha. The resources are gates and paid, and every corner you turn there is something either paywalled or timegated. Outside of exploring the world for the lowest end resources, what is there?

I am looking forward to the story continuation because surprisingly i like the lore, but i guess my driive to play is in that diminishing point and find myself back on gamepass looking to see what i can play."
nfl,"well thats why the wife wants me to watch, to ""change my mind"" and give him a chance."
nfl,"my wife comes in, ""ready to watch the debates?"", and i say ""eagles is on babe"". She says they suck, and proceeds to tell me how i don't care about the future of our country and all that. We are on polar opposites of the political spectrum and there was a point in the game, as an eagles, fan i almost wanted to go watch the debates."
nfl,Is no one talking about the colts punt two point conversion?
eagles,I’ll go through the week confused about wentz.
eagles,Um.... yay?
eagles,"Wentz will get another shot and get us down to the 5 where Doug will call 3 fades in a row.

Half the base will call wentz playing hero ball working with nothing. The other half will point out lapses of good play week in and out.

Half us will call the other half dumb morons, and all it’ll be back to normal this week just like the last 6."
eagles,Djax is back and not one shot downfield.
eagles,"Bad play calling, followed by horrible oline play and an inconsistent qb. I mean , what exactly would you hope for if we even won the division? We can’t seem to play a whole football game. Defense mostly holds up all game then gives up a 97 yard , 9 minute drive. 

I have never seen a team so disconnected."
eagles,3rd and 1 and 4th and 1 haven’t been great for us this year.
eagles,Looks like a different wentz tonight. Keep it up!
Genshin_Impact,"i've decided to just roll when i have the primos, if it's once a day, or once every two days, don't matter. The rates are not worth spending money on, so it's miyoho's loss in their pockets. I like the game, but hate the nickle and dimed progression, the best weapons being paid, and requirements for some characters to have constellation in order to be competitive. 

Good luck to those that feel this is actually worth throwing money at, but my wallet is closed to the gambling portion of this game. I threw 60$ at it on release which was more than worth it in terms of enjoyment. I may get the 4.99$ a month and that's it (not sure if i'll get the bp in it's current state)."
eagles,"people only remember the 1 quarter of last week and not the trend of games where he has played 75% looking like a bad backup that wouldn't be on any team. You can say he did better the last two weeks, but to say he did ""good"" is a stretch."
nfl,"he played good for about 5 minutes of the game, must be elite. Had 2 dropped td's, then the receivers bailed him out, along with the refs, and baltimore by dropping an int. he gave up another costly fumble giving the ravens free points but because he tried and had 3 or 4 good passes he's back to being a top qb."
nfl,"that wentz has a receiver drop another touchdown while playing shitty for 3 quarters and the fan base blaming everyone else except him for another week. 

I either want him to play consistent football or just suck at this point."
eagles,no
Genshin_Impact,"The sense of defeat I feel is making it hard for me to continue. I threw some money at this game , but I can’t afford to pay for these rates, I just can’t. Love the game but if I have to spend 500$ to get the new chatlracter every month or two it’s just not gonna happen."
Genshin_Impact,"I had 6k gems saved after getting lucky with venti. I didn’t pull Klee and honestly just think I’m done. I dropped 60$ and another 10$ on the battle pass, I don’t want to go through this battle every month. I want the characters but I’m not throwing hundreds at a video game I paid for , every month. I feel like I’m taking idiot pills playing this to get the characters."
Genshin_Impact,i use ning but with the 5 star catalyst. I also have jean on a flute in my party. I use chong as well and razor but they are mostly in for mining.
Genshin_Impact,maybe i'll pull on the banner for sucrose cons and hope to get klee. i been farming viridescent but no luck on the set dropping. i've done about 4 days of farming and not one piece has dropped.
Genshin_Impact,"yah, that's the thing with venti i am starting to not enjoy. Where i really want him to be effective he's not. I have better damage with focused elemental burst. for trash clearing it's great but is the cc really that beneficial when i can just use someone like jean in place? 

it's really about getting a more consistent fire user to proc my electro burst with fischl and i was hoping klee could do that."
Genshin_Impact,wondering how a venti ult followed by klee and then into electric would work? ideal or not?
Genshin_Impact,"i have sacred winds on ning, and the bow was my second choice. I am glad you let me know. I'll keep using my compound/favonis bows. 

so, it'll be the sword more than likely. i have flute, sacrificial. for claymores, i have rainslasher and sacrificial. 

hard choice..."
Genshin_Impact,general consensus on the best weapon from the battle pass? Assuming I have a 5 star that can use each ( i don't but was wondering what the if you have x character this is best).
Genshin_Impact,"it was hard to do the big achievement at first on ps4 and world level 4. 

It was forgettable to be honest. The rewards, the loading times on ps4 co op. I'll take anything free but it wasn't something I'd look forward to doing again."
Genshin_Impact,"i'll give that a whirl, thanks."
Genshin_Impact,"struggling building a team for exploration and as my default team. 

I have Keqing, Jean , venti as my 5 stars.

4 stars , fischl 3c, xiang max c, razor 1 c, ning , barbara

rest are the free ones, noelle, lisa etc.."
eagles,"I watched the game and saw receivers drop two passes and then the receivers make incredible catches. He’s not a good qb. Up until the prayer throws and a questionable pi he was sub 50% , lost another fumble, and luckily had an int dropped. 

Jfc, it’s not all his fault but saying he played some sort of stellar game is far the truth. He’s not good, the oline is not good, the play calling is not good. 

Only thing this game showed me is Baltimore isn’t that good."
eagles,The absolute worst 2pt conversion I’ve ever seen in the history of football
eagles,Please put hurts in just for a change pace
eagles,“And ertz falls down”
eagles,Just take wentz out it honestly can’t get worse
eagles,Every time hurts comes in we look alive
eagles,"Just kick the xp, jfc."
eagles,Our defense is mediocre but our offense is worse. That’s the extent of everything I’ve seen this season.
eagles,"I don’t think Carson is as good as people think. I don’t think Doug is as good as people thought. 2017, was nothing more than the ugly kid getting the girl and I’m fine with that. I just wish we had some fucking intensity on this team."
eagles,This looks like a team that expects to lose now but is hoping to just score some points to save face .
eagles,Wow
eagles,Why do these announcers not want us to catch the ball?
eagles,The right leg comes down no?
eagles,"Serious, if they play like that at least they’re trying. Nothing else works, throw the kitchen sink. Most excited I been all season has been this drive."
eagles,There we go!
eagles,"5 , 3 and outs , a fumble , and what 5 sacks already? 

No one has any heart on this team, coach included. I’ve seen us play scared way to many times , it’s embarrassing. Ravens too good, might as well not try. That’s honestly what it looks like."
eagles,"Wentz is the worst qb in football , and it’s not even close."
eagles,"Why is it always an excuse for everything? We aren’t the only team that has to overcome adversity. Wentz just threw 2 bad passes in a row to cost a possession and runs erect into 3 defenders that literally just grab the football. 

At least see what we have with hurts , we are 1/3 the season in and he still can’t throw a football consistently or protect it."
eagles,More points given to the opponent by wentz. Fucking guy is responsible for about 40 points against this season.
eagles,"? He just threw two shitty passes. They’re all bad , wentz included."
eagles,Punter the only breaking a sweat today
eagles,The secret recipe to beating this team has been the same for the past decade. Throw slants at the linebackers.
Genshin_Impact,Yah I’m at ar36 and material farming only.
Genshin_Impact,"I read that there are some glitches with her abilities. I don’t have diluc or Bennett and the only reason I’d pull her is to have a better character for fire farming in exploration. I think, it’s best to wait a couple weeks and see what’s coming down the pipe from miyoho . She will be on banner for a while so you can weigh your options a bit. 

I have fully leveled Chong and wouldn’t mind some cons for him which is tempting me also."
Genshin_Impact,"Yes , and I probably should have been more clear. It’s not artifacts themselves. It cost resin to farm the good ones. I ran the domain for the anemo artifacts and ran out resin two days in a row while not having one drop. Third day I got one , with horrible rolls. So, what I mean is that resin actually controls my artifact farming on top of everything else."
Genshin_Impact,"No one has issues with them making money. But little things being nickel and dimed for gets old. Not enough resin for a daily, not enough primos for a wish in an event, not enough mora, not enough resources. We all get the time investment and limits. I’d rather have time restrictions then inventory expansions per character like most ftp games or a monthly sub that gives auction house access and what not. Criticizing the free to play model isn’t saying the game isn’t worth it or saying it’s a rip off. But to ignore the pay model flaws and white knight it is just as silly."
Genshin_Impact,"When I strted I thought the Gacha rates were the problem. Then, I leveled and played and thought resources were the problem. Then, I thought resin was the problem. Further down the road at ar36 , resin was the problem. Lastly, rng artifacts are the problem.

I’ve realized that this game has some sort of hurdle for each and every aspect.

Want a new character? Fuck you, pay mi 

Need more resources? Fuck you, pay mi

Need more domain runs? Fuck you, pay mi

The whole game is a test in patience and planning, realizing time invested isn’t nearly as important as micro managing and planning. For example, my jean need 3 days of play to ascend her weapon , and ascend the character. I can’t do anything else outside of that. When your character are 70, the resources , moras, and resin are just not there and it becomes a little bit each day and one day you get there. 

I don’t have a problem with the progression, I have a problem with the lack of other activities you can’t do while doing this. 

You add rng artifact farming and mora into, and it’s just too much to handle."
politics,The fact a vaccine for a virus that’s killing a thousand a day in our country is somehow political makes me sick.
politics,"You know what people are sick of? Not standing by your convictions, when you say these people are doing terrible things to our country and then laugh, hug, and have outings with them we wonder if you are lying to us or to them."
eagles,"pass rush against shitty o-lines and bad offenses. Against the rams they were torched, against the steelers they were torched. Having good defense against the bengals and a rookie qb, or san fran with their struggles doesn't make the eagles defense anything to be happy about.

they're average at best, much like the offense. They aren't terrible, they aren't good, they're just kinda there."
eagles,"til, thank you."
eagles,"just out of curiosity and not a eagles financial analyst.. So, if he lights it up the rest of the year , what's keeping him here? How would we be able to pay him if he wants to go?"
Genshin_Impact,"when you get to ar 35+, the resources and mora look real nice in the battle pass. The only reason i have not got it, is i am waiting to max it first. If i don't max it, I am not getting it but i really do look at it at least a few times per session salivating over the additional resources."
Genshin_Impact,"i see , through the day tons and tons of useful hidden chests and cool secrets. is there a repository of all this information somewhere?"
Genshin_Impact,"55$ at release. the 49$$ gems and the 5$ monthly. I'll probably only do the 5$ monthly going forward. The battle pass, is just to much work for me. I don't like the checklist aspect of gameplay , so i take the rewards as I get them. I am ar 35 and haven't even hit level 20 on the battle pass. 

If i could do it all over again, i'd had just spent the 5$. The gems aren't worth it but i'd had paid 50$ for this game anyways."
Genshin_Impact,"i can do some things like my dailies and what not on my mobile, but when it comes to boss fights and jumping puzzles, i have to log into my pc."
Genshin_Impact,how did you get the mora to do this?
Genshin_Impact,"not saying the traveler is bad, but jean is one of the best 5 stars in the game. She has good scaling, self sustain, and not only provides those bonuses, she also has an incredible burst ability."
eagles,"i watched the highlights yesterday, since i was out of town. One thing really stood out to me, and it infuriates me so much, this watch the hands coverage of our cb's since the chip kelly days. There was a pass from ben that was in the air for like 20 seconds, lobbed ball, and our cb is just staring directly at the wr. I think there's a chip plant, on the cb coaching staff that still thinks just running in stride with a receiver is enough. The only int's we've gotten in the past decade have been passes qb's throw directly to our secondary. 

our defense has been inconsistent and often times overrated since schwartz got here."
Genshin_Impact,"getting an assload of characters matters little since you'll be begging for mora and resources to get 2 to 3 characters end game ready. 

pay attention to the anemoculus/geoculus you collect, so you don't have 1 left and have to scavenge the whole map looking for one.

artifacts matter, more than your weapon and hero. Level up any artifact 1 level you may want to keep since you can't lock or flag for trash. 

save important locations. 

all resources are important in some way, don't skip any. 

understand how the elements work , team building is more important than anything else. If you have someone that is designed to trigger burst, build them to trigger burst. 

Look up, down, and all around every where you go. There's so many things in this game hidden right above you. 

some general tips:

get your statues upgraded as fast as possible, and explore a lot in between the story doing it. Stamina abundance is a godsend later in the game. 

save your resin, until you have a plan. Don't use it just to use it. Think about what you are using it on first and where that resin will go. Again, character progression is the biggest hurdle in this game not the gacha. 

make a few team builds. Don't force yourself into one comp. you may be in the southern continent and need geo for everything, so make a geo team instead of stopping to switch out characters.

use the adventurer's handbook 

think for yourself before taking advice. some people will tell you things like , the 3 star weapon is better than the 5 star. Don't blindly listen to those things. Base stats on 4 and 5 stars are higher, and check that the % increase of a 3 star is actually better. 

do your expeditions on 24 hour with characters you have absolutely no intention of using, and keep up with it."
nfl,It’s a shame that he suffered an injury during such an incredible start. Dallas is an average defense away from being a powerhouse.
Genshin_Impact,"

I would go venti, keqing, fischl, xiang or chong, keqing, fischl and whatever you elemental reaction you want for your fourth.

chong then keqing/fischl is fun as hell."
Genshin_Impact,lol anyone that does damage.
Genshin_Impact,"I play on ps4, it's brutal with the load times."
