subreddit,body
Genshin_Impact,"i know, i know, gacha world problems....incoming. I wanted to enjoy this on my ps4, all my rolls yielding 4 fischl's , 2 xiangs, and 2 barbara. AR 20, and all i really wanted was jean or razor to be honest. 

Since i did all the pre-reg stuff, decided to derp around on my phone a bit here and there. first rolls got me fischl and razor. I hit level 10 a few minutes ago, to my second beginner banner. Get jean and the geo mage girl. Have around 7 intertwined left and 2 acquaints. 3rd pull, venti.. 

I really wanted to play on my ps4, but i have a godlike team on mobile :\ 

actually used money on my ps4 account also..feels bad man."
Genshin_Impact,"Unpopular opinion but I’d go traveler, xiang, Barbara, razor. Get everything wet with Barbara, switch to razor , and use xiang and traveler as need."
Genshin_Impact,Ar 20. That was my goal first week. Just beat the storm terror quest. I’m going to focus on just getting my characters optimized now and getting all the little things done /found in the opening area this week. I’ve touched maybe 20% of the map so far.
Genshin_Impact,"gonna try this when i get home. genshin wanted me to have fischl really bad, and it's really all i got (1 dupe left until max'd constellation and not even ar 20 yet). Pulled barbara with my last pull, and wondered how to fit them in. thank you"
Genshin_Impact,"I didn't think i'd like it at first, but i think of the characters as abilities now. Instead of a normal rpg with one character and 900 abilities and keybinding your foot to a pedal under your desk, you have tons of characters with just a couple abilities. makes managing what you do much easier."
Genshin_Impact,"I came so close to grabbing avengers, but then remembered i preordered desitny 2, borderlands 3, the division 2, and im just waiting now on games. Hopefully avengers finds an identity for itself, it looks visually stunning."
Genshin_Impact,"i like that i went to do a quest, got sidetracked by chests, mob camps, and puzzles for 2 hours and then forgot what quest i was going to do. The immersion of the world is incredible. 

whatever characters i get i get, i did the ps4 pre-order, will get the battle pass and the monthly purchase for daily gems. that's really it for me, until another content pre-order. It's all i really need to enjoy the game."
Genshin_Impact,"to each their own. I am in my 40's, get maybe 2 hours at most a day to play games. I find genshin to be relaxing, and enjoyable. I am tired of competitive games, games where they play themselves, games where money spent is the only form of enjoyment you get. It's huge, it's got tons to explore, tons of quests, and fun mechanics. 

Bringing something like this to mobile is absolutely unreal. 

I don't want something that feels like another job, i am sick of pre-ordering games that are supposed to be AAA yet come out broken. Genshin is free, and it's just enjoyable to play. People approaching this like there is some sort of ""best"" you can be, realizing the game is just mean to be a game you play for yourself not for some sort of e-peen measuring stick. 

I fucking love this game, everything about it. Sure I am hoping for better co-op stuff, guilds, and more social features but the last thing i want this to turn into is WoW, or epic 7, or any of the other games that turn the game into chores. Don't feel like doing dailies in genshin? you aren't going to get kicked from a raid, or suck at pvp, or w/e."
Genshin_Impact,"I’m on a standard ps4 and it’s not good but it’s not unplayable for me. 

What blows my mind is my new iPad can’t play it but 4 year old iPhone can and it runs better on that than the ps4. Hoping they tweak the games performance."
eagles,"we are in a bad situation across the board. You bench wentz, it's acknowledging that the person you just threw all your money at is a wasted investment. You don't bench him and he continues to eclipse winston's int record this year, you look like idiots for giving him the money. 

Listen, wentz is not good right now but neither is the entire offense. I am not sticking up for him, I really don't think he's any sort of eagles legend 5 years in. 2017 was the exception and not the rule, pretty much for him and the coaching staff.

That said, it's not a knee jerk reaction. There are plays to be made that he is not making week in and week out. Each game i've seen at the very least 3 bad passes that were game changers, 2 int's week 1 that cost us the game, 1 int week 2 that took us out of the game, and we only tied yesterday because of PI calls, not because of carson's incredible drive. 

I am able to count his good throw on one hand now in games, opposed to running out of fingers and toes on his bad passes. 

The eagles are a health risk to the players, which, let's really talk about that. How the fuck are we out of receivers ....again?!

I made it 40 years in my life without seeing a championship, so i'll be eternally grateful to all those guys. I don't know what magic it was. Chris long? Blount? Reich? Leadership elevates people in any work environment. good leaders get better productivity. The fact these people can't seem to point the finger at themselves is just another year of excuses, no accountability, and an overall depressing season again. This team really hasn't been fun to watch in 3 years. Because this shit keeps happening, is it a knee jerk reaction to play like this three years after a superbowl win? I don't know, to me, definitely not."
Genshin_Impact,"same, let me know if you can figure it out."
Genshin_Impact,I have a 2 year old iPad and have the same exact issue
eagles,"Nick hits that wide open sanders throw, I know that."
eagles,"Those last three plays on offense did Elliot absolutely no favors and dough was content to give his kicker a 60 yard attempt over even trying to get yards. They have zero passion or heart. I can count wentz good passes on one hand. But what really fucking gets me, what absolutely blew my fucking mind. Dougs playcalling was so bad , I mean trust the process levels of what looks like intentional losing.

The def has its problems but gave us 5 chances to put this away. If not for Cincinnati committing to pi’s on one drive we don’t break 20.

Something is wrong with this team and it’s not just the players. They look like a team , the offense, at least, that doesn’t care. 

I can take a loss when the team fights. This offense is t even competitive."
eagles,"A healthy ir scratch or something. They had it on the broadcast , think that was it."
eagles,Nice sticks defense
eagles,"We may go 0 and 16 , and that’s not an exaggeration. Browns are playing better than us vs Washington"
eagles,"God, another td wipes out by wentz"
eagles,Alright guys. Is it safe to start hoping for some hurts playtime? Or do we need another int?
eagles,Hamstring
bengals,Don’t think you are good! We are just that bad. The best insult I could come up with.
eagles,"If I were a player, and philly wanted me to play. The eagles sucking wouldn’t even cross my mind, I’d be scared of just surviving a fucking season."
eagles,It’s comical at this point.
bengals,"I’m an eagles fan but dropping in to say, burrows has “it”. Dude is legit."
eagles,Burrow throws a beautiful ball.
eagles,Play calling ruined a drive. Shocked.
eagles,A td opening drive here would do a ton for this teams confidence.
eagles,There we go! Signs of fucking life!
eagles,"Well, bad team is bad. News at 11, I guess."
eagles,People don’t realize how much Jenkins masked our absolutely horrid linebackers.
Genshin_Impact,Yes
eagles,Bench him. Now. Just so I can get excited about something.
eagles,"I started wentz over Watson, thinking no way wentz could do bad three weeks in a row. Getting the boot on my fantasy team wentz."
eagles,This the type of game you expect from two of the worst teams in football this year.
eagles,"Have jp carry wentz to the bench and they can both sit there . Jfc, this team is out there looking like they don’t give a shit."
eagles,"Cheap today ,  rolling rock."
Genshin_Impact,PS4 and mobile. I’ll login first on my pc though.
eagles,He had a easy td on 2nd down. Have no clue what is wrong with his decision making skills but this is just hard to watch .
eagles,He had a wide open receiver when he tucked it and ran on second. The announcers even showed it.
eagles,"If wentz turds it up this drive, I may start jumping on the hurts wagon pretty hard. Just a heads before you all start getting on my ass."
eagles,5 picks in two games he’s on track to break winstons record.
eagles,Lol
Genshin_Impact,"My goal is to max out every character they give me. So, there are some characters I really want but I’m setting my expectations low and will just do the best with what I pull."
Genshin_Impact,"I think it's , the fine line, for this game to maintain. A lot of this will probably depend on the rotational heroes in the dust shop as well. If the only way to unlock constellations for 5 stars is through banner pulls....it could take years or thousands to get 1 to full constellation. If they make it too easy to obtain the dupes, then they won't make much profit. 

Getting 4 star constellations, will be much easier, but 5's , whew, what a pain in the arse."
Genshin_Impact,"I plan to play on both mobile using pc credentials and on my ps4. not sure we can really even think about re-rolling on console. On my pc account, i may do it a few times , if i get fischi or beidou i'll stop. Definitely will do the AR 7 route though, by the time you get to 5 you might as well just put one foot in front of the other and do 7."
Genshin_Impact,"This is a question to the mods. With the game's launch coming, and an abundance of traffic probably coming with it, are there any plans for some of the following?

Daily, weekly  megathreads? 

Also, the amount of youtube spam is getting out of control in my opinion. Can we just have a content creator megathread?"
eagles,"one of the few bright spots, he looks good on the field. was open several times on nothing but daylight to the end zone plays, if wentz saw him. Outside of the really costly fumble, he had a productive game. really excited to see him grow, i think he's going to be a great back for years to come."
Genshin_Impact,meanwhile i've gotten nothing but turkey dinners in like 4 days of doing this.
Genshin_Impact,"It's a free to play game, with it's only real source of income being the characters. you can do everything in this game without paying a penny, everything. There is no fee for expanded inventory, or character slots, or pvp access, or anything like that. They make their money off of characters. So, they're gonna be the most expensive aspect of the game. 

Save your fates for your favorite characters, and if you want more then buy more. if you absolutely feel like you can't play the video game without the characters and it's too much , then quit. 

This game has no guilds, no social features, and no competitive aspect of any kind. Co-op is hardly beneficial outside of some achievements. So, it's not a p2w kind of game. 

i feel like people complaining about this haven't played gacha's before. 

The real issue here isn't the generosity itself, it's that you need copies of the heroes. Now, that will suck and will cost extreme amounts of money. There needs to be an alternative to getting constellations on  a hero outside of banner pulling. That will probably force me to leave ultimately."
DissidiaFFOO,"Still new and grinding. I’m on chapter 9 just using noctis to 1 shot everything so far.

I had about 35k saved for this banner and have had pretty horrible luck only pulling one 75cp now as the highest item. It takes me about an hour to clear a chapter which is close to enough for another 10 pulls and I’m on chapter 9 now. Will I get enough to pity this banner or am I running out of the free crystals soon? I still have almost all the lost chapters to complete as well."
eagles,A great qb makes that throw in the small window of time the wr was open. A good qb doesn’t attempt that throw. A bad qb makes that throw thinking they’re a great qb.
nfl,"We had someone post a picture of their vandalized flag on next door. My wife already thinks that biden will build prisons in our neighborhood and the dems will take away every American freedom. 

Somehow someone knew the truth and ultimately the guy said he did it himself so people could see what the democrats will do, lol."
nfl,Then the opposing new station sets headlines that you dont know what your doing. I’m hoping to just a return to real journalism in our lifetime.
eagles,"If I’m in the race for worst qb in the league, I’m not going to say my teammates are bad. That’s seems counterproductive and will just make things worse. Did he really deny that? 

Looking at some of the tape the past two weeks, it seems our receivers aren’t nearly as bad as we think."
EpicSeven,"Lucky , got her on 20th pull. Limited banners have been good to me the last two, it’s nice to not stress over skystones, gold and bookmarks."
eagles,"One important thing to realize through this comparison is that even 20 years ago and we still suck at having good wr on this team. The year we get t.o we go to the Super Bowl and the year we get alshon we go. 

I’m not taking anything away from foles post season run but I don’t think we get to the spot we were in , in 2017 without wentz. 

I also think wentz was grossly overrated when drafted and outside of 1 year has been slightly above average at best. 

Mcnabb did far more with far less on offense for a lot more years."
Wasteland,"Only real issue I’ve experienced is the game closing when I’m messing with inventory sometimes and just randomly closing. 

Is this addressed on Xbox one a? I’m at work and can’t see the notes."
DissidiaFFOO,i am new and feel awful because i am probably annoying people. i just press x ability because more numbers.
DissidiaFFOO,"haven't gotten to that point yet, so don't know what that is. I can't even get ifrit to 10 yet to unlock the bingo."
DissidiaFFOO,"even though you get the characters, they're kinda worthless since you don't get their gear though right?"
DissidiaFFOO,"well that makes sense on the cecil issue. 

Chapter 8, make vanille an ally, make setzer an ally."
DissidiaFFOO,"Only about a week into the game. I got noctis and all his cp weapons but wasn't lucky enough to get the tokens or 90 cp weapon for cecil ( have 15, 30, 75). 

Do i bench cecil until i am able to get the weapon again? 

Right now, i just finished chapter 7 of the main story. My noctis is just soloing everything with his aoe's and nothing has really challenged me that much. However, I can't activate chapter 8 because i am missing two characters and the game doesn't tell me where to find them. 

Are there any suggested comps built around noctis? Since he's my only character worth anything, I am a little confused still on who does what, and this game doesn't seem to have an easy to read character graph of what they do.

Is there a guide on what I am supposed to do with artifacts? I tried some co-op and got tons of artifacts but have absolutely no idea what they do. Do i limit, them and they provide a passive buff to the unit on the portrait of the card?

On the noctis banner, i got the mostly fang stuff for duplicates. I have 3 of her weapons limit broken, but was told she was kinda bad so I haven't used her. SHould i sell these off to limit break notcis' weapons or just hold off and keep them in case she's buffed and the power stones will come with time?

I have a ton more questions but don't want to overload anyone with them."
eagles,"im in my 40's , at this rate i'll be in my 80's by the time they win another. 

i think sanders was a bright spot today, minus the fumble, the dude is a great pick up, dg is a going to be a great tight end, and raegor seems like a good pick as well. Along with hurts , that's a future to build on.

there's really no urgency or heart on the team. doug will get through this year, but the team isn't on a level to compete even if they miraculously make the playoffs again for a 3rd straight year. We had no business being in there 2 years in a row and foles came in and one our last playoff game. 

They have issues top to bottom, from conditioning, to players, to coaching and i think with the 4 i listed above it may be time to think about some drastic changes if we stink it up the rest of the year. 

i see 7-9 as the ceiling of this team, and honestly that's pretty much what we've been since the superbowl."
eagles,"they're just not a good football team and I don't think the vikings failing,  a double doink or bad all around divisional play will mask it 3 years in a row for the eagles."
eagles,They’re not a good football team .
eagles,Djax shoulda been starting and getting more looks both games. Only wr out there that can play.
eagles,"Cause he was having an mvp season that 1 year and the other 4 , now, are someone else’s fault"
eagles,Double coverage throw while driving to have a chance at a come back. Who’s fault is it this week? Another bad throw that will probably cost the game.
eagles,They just aren’t enjoyable to watch. They look heartless out there.
DissidiaFFOO,"Question on auto, my units never use anything outside of default brv and hp attack? is that normal?"
DissidiaFFOO,i got a ton of fang weapons in this pull like 3 15's and 2 35's. do i use those to limit break them or sell them?
DissidiaFFOO,"reading the guide, the power stones are 1 per week and 4 per limit break? So, it'll take a 16 weeks to upgrade 1 weapon?"
DissidiaFFOO,"i got his 15, 35, 70, and 90. not much luck on cecil though"
DissidiaFFOO,"got it, i pulled on that and got a a few copies of the  15 and 35 cp weapons and one of the 90cp one for noctis"
DissidiaFFOO,"that's good to know, and thank you. what banner is the one i should pull on for the weapon? I have nine, noctis, and paladin and not sure which banner is the correct one."
DissidiaFFOO,thank you. this may be a stupid question but are there any farming characters? like aoe type characters?
DissidiaFFOO,"good to know, i thought i was done pulling the 15cp weapons . there's 5 banners and since i am learning what is the title of the banner i should pull on?"
DissidiaFFOO,"I am only a couple days in but enjoying the game so far. I was having some problems and realized instead of moving on to chapter 2 i did some super hard side chapter, when i got back on track i was way over geared for everything. 

I am not really pulling on much, i used the free tickets and got noctis and cecil (paladin) cp 15 weapons. 

I am currently using squall, cecil, and noctis.

The gacha mechanics on weapons are still a little unclear to me. is there anything i should be pulling on right now? think I have around 50k crystals/shards or w/e they are called."
DissidiaFFOO,"awesome thank you, i love the game but it's really confusing the heck out of me. I made it to chapter two and got wrecked on a sidequest so, trying to just find some simple stuff for me to understand and get going with."
DissidiaFFOO,"> Tonberrytroupe.com

thanks, i'll be reading this for a few days. I am just using the squall, cloud that i got off the beginner pull. Are they worth investing in or does it not matter?"
DissidiaFFOO,"i just grabbed this a day ago, and it's really been addictive but also overwhelming. is there an up to date new player guide? or are the older ones still relevant to current content?"
EpicSeven,"good to know, I am glad I invested her now. Even if she's banned if someone picks ssb it gives me a chance to use her as a forced ban which is a nice psychological advantage to have. thank you."
wotv_ffbe,"oh, didn't know that. thanks, i'll try to wrap up the story tonight."
wotv_ffbe,"so far i've gotten around 40k vis i estimate. i used one bundle on the anniversary event. Everything else has been pulled from what's been given to me. So still sitting at around 30k vis. I've bought the shards as they appear for SR's i use, or may use in the future."
EpicSeven,"great thanks, i was keeping her around 175 speed with 14k hp. I can probably get some more hp/er/def out of that and remove some speed. 

I'll pop her on my gw def team and see, but will definitely use her on offense against ssb. I am getting to a point where i can actually select units to counter where before i had only certain units geared to even attempt to fight and had to be restrictive on who i challenged.

how is roana in rta?"
wotv_ffbe,"I am only about a week in so far. Have pulled a crapton of UR's , gilgamesh, rain, etc.. over the past couple days.

I am currently using a party of mont, mediena, lu'cia, and shadowlynx. 

I've noticed that I am basically stuck on resource farming these units now. The only way i see getting this is randomly through the shop or 1-5 at a time through their respective story mission, correct?

Is this the grindwall? Upgrading units? Some of this seems like it'll take 6months just to upgrade my starting team.

I really enjoy the character art, and the overall activities in the game but the past day or so i find myself seeing this game less tactical and the animations extremely limited. The enemies don't have much variety through the story either, doing a final fight with the same enemy units just seemed pretty anti-climatic. Does this change? is there some more aesthetics outside of the big purple shard and simple auto attack animations? Does the game become more ""tactical"" in end game. I've literally just grabbed a 99 friend, and auto'd everything so far."
EpicSeven,"was getting bored holding onto 5* fodders for six starring and decided to six star a few heroes. One of those was my recently acquired roana. I slapped on a speed set with some health , awakened, and mola'd her s2 and s3. My arena defense went from 20% to 65% with roana, ssb, charles, lilia . 

I'd like to use her for as much as i can, she's my favorite hero in the game now. Should i just keep pumping, speed, health, and effective resist into her? Is she useful in any pve, if so what? Can i use her effectively in gw defense, offense?"
politics,Florida had 3 voting districts hacked in 2016.
eagles,"I’m honestly just not excited. They looked the same today as the past 2 years, average. Only reason we got into the playoffs was other people choking harder than us. 

They’re reminding me of a chip kelly team but slow."
eagles,"I want to rag on wentz but I don’t need to, this really is who he is outside of one year."
eagles,"3 timeouts left, give em the field goal position. Gg."
eagles,What’s even more sad is we are one of the worst in salary cap and fielding this lineup
eagles,"This isn’t a good football team top to bottom. Secondary is improved but outside of that they look just like last year but slightly worse on offense. I’d like to not count on other teams sucking to make it to the playoffs but if this is a sign of things to come, we should all be a little concerned."
eagles,Obviously the duck trick isn’t working wentz
eagles,Wentz looked so good for the first few series but the game is going to be lost on him.
eagles,"Only reason this game is close is because of wentz.

And the only reason we are winning."
eagles,"I grabbed him late, gonna start next week."
eagles,Regret drafting djax already
eagles,Should I start him on my fantasy teams my flex? Have cole Beasley in there now.
eagles,I’m looking at it the same way. 6-2 fantastic and 5-3 a very good possibility.
wotv_ffbe,"Being so new, I don’t know if I could even get her to lb 3/4 so I guess I’ll pass and wait until/if the event returns."
wotv_ffbe,"Thanks, I’m probably too new to even have the resources and I’d waste all the vis on a character I may be unable to use. Sucks, really wish I’d started a few weeks ago. Thanks for the details though, saved a risk I probably should take this early in the game."
wotv_ffbe,im only about 3 days into the game and agrias is one of my favorite characters is there any way to get her and all the shards etc? I don't want to be able to only half ass her progression.
wotv_ffbe,"Another question, I've told not to waste the visiore i am getting on summons this early, so i've just been hoarding it. Over 20k now, what and when will i need to start using this on?"
wotv_ffbe,good stuff thanks. Can you have multiple formations?
wotv_ffbe,ahh awesome. when you select the job does leveling it give you new abilities? All my jobs are at level 1 except shadowlynx. I've learned enough from these games to not use resources unless i have a total understanding of what they are and how rare they are.
wotv_ffbe,"couple days in now.

I have shadowlynx at around level 60 trying to do the challenges and what not. The game isn't coming to me much faster, because I am left with more questions after each answer through the tutorials.

I noticed i unlocked jobs, but also haven't invested any points in abilities or job enhancing outside of just doing it for missions. There's a ton of abilities, and i guess the big concern i have is screwing that up. can i screw that up or do you just get all the abilities anyways? Second, and more specific, what should i be focusing on ability wise for shadowlynx?

I am running mont, frederika, lu'cia, miranda, and of course shadowlynx. are there suggested abilities? Is this a solid starting team?

I also have for UR's - sterne leonis, rain, oldoa, robb hourne, kitone, whisper, aileen, macherie, .

Are there better MR's to include in my team? I have:

gaffgarion, lilyth, schuzelt, margritte, khury, seymore, fina, dario, grace, rairyuu, vistralle, helena, ramada, lorenzo.

thanks."
