subreddit,body
worldnews,If trump had dealt with Covid effectively he would have won in an actual landslide not his cults make belive one.
worldnews,"We  are living a normal life  and have been for months now  , and are on track for a normal Christmas and New Years because we went hard and early.

Kiwis complied with our lock down orders as a part of our civic duty and got it done."
worldnews,"He did worse than jack shit he deliberately down played the virus.

He's on tape he knew better he just chose to ignore it for political reasons."
TopMindsOfReddit,Trump being in the white house gives them the confidence to be racists out loud and in public.
newzealand,So next post will mean we officially eradicated it in the community again.
SubredditDrama,Meanwhile they stab and shoot the left.
newzealand,To the moon!
SubredditDrama,It's thread hits r/all the rest of the reddit sees them flipping the fuck out and laughs at them copping it's all it is.
SubredditDrama,"Now they want us to be the better ones and go easy on them cause Trump lost. 

Fuck that we are allowed to gloat and rub it in after the last 4 years."
politics,The clown coup is over.
newzealand,You'll be much happier in Jail.
politics,"There were 7 in 2016

https://www.cbsnews.com/news/which-candidates-did-the-seven-faithless-electors-support-election-2016/"
SubredditDrama,It's the victim complex kicking in.
SubredditDrama,Comments that disagree with me = being brigaded.
newzealand,"It really feels like Christmas is on the way now. Lawns got mowed , its 23 and now I'm having a beer after Nachos for tea."
TopMindsOfReddit,When people spread bullshit for so long they tend to start believing it.
newzealand,Oh I speak it fine just cant spell for shit.
politics,And not a single faithless elector was found.
newzealand,It was always a myth it was just National voters who desperately  wanted the Greens to go with them despite the fact they never had an anything in common.
australia,Yeah suppose to be 1000 years before hand or something like that.
politics,The Copeium in all the Trump subs is off the charts.
newzealand,I speak English and bad English.
newzealand,Well had the meeting with the plumber and builder last night all booked on for Jan 10th to start renovating my bathroom. They said it take about a week to rip it all out and extend it so I've got them to do it while ill be dog sitting at mums and dads for 10 days I can't wait.
australia,There is the Amazon TV show being filmed.
australia,"Yeah the sub is extremely left and this government is painfully center. 

I am interested to see what its like in a year cause in reality parliament was only back for two months after the election and then they went on leave for Christmas break not a lot of time to do much. 

But she did increase sick leave from 5 to 10 days and legalize pill testing at the summer festivals stuff Labour did campaign on this time round."
newzealand,Some of them considered our essential workers to during lockdown and if your working at pack n save or countdown you are on minimum wage or just above at best.
australia,"Its mainly what she won't do which is whats pissed of some on r/NZ the weed referendum failed buy two points and she said she respect the will of the voter's.

The other big thing is the housing crisis campaigned in 2017 on being a transformational government to bring in a capital gains tax etc to try and calm the market now she's governing alone with out NZ First has no interest in doing it since she's won the middle class from National."
newzealand,If you have Covid just wear a mask what could go wrong. /s
TopMindsOfReddit,Admins might want to ban that site if the Conspiracy mods are making money off it.
newzealand,How long since community transmission
newzealand,So 4 or 5 pm this afternoon then?
politics,Its almost as if the QAnnon cult is a front to distract people from the real pedophiles.
newzealand,So systems working as intend then.
SubredditDrama,And Trumps on video partying with Epstein and one of his cabinet members got the job because they were rewarded when Epstein with a sweet heart deal the first time he got arrested.
newzealand,Judith Collins is Jacinda Ardern's best advert for reelection in 2023.
politics,"I will raise my glass to that America cheers.

Now what will the next lot of Copeium claims be?"
politics,The red states are telling the swing states there elections are invalid because they had the gall to vote for a Democrat.
TopMindsOfReddit,And in real life Liberals will shut up around the cult because they don't want to set them off.
politics,P is for Projection
newzealand,With the Disney stuff today and the Warner Brothers announcement this week really looking like Covid killed the block buster
newzealand,If we listened to these idiot's we'd would have had a travel bubble when both countries still had community transmission. I'm fine with playing it safe till next year so we can have a Covid free Christmas.
newzealand,Hyped for the Ahsoka show and The Bad Batch trailer looks amazing.
newzealand,https://www.stuff.co.nz/national/politics/121169737/coronavirus-simon-bridges-receives-huge-backlash-to-facebook-post-criticising-lockdown-extension
newzealand,"Crazy to think our lockdown was all the way back in March it feels like a lifetime ago. 

Pepperidge  farm remembers Simon Bridges night after night on the news whining the lock down was to hard on the economy and we can't let the cure be worse than the disease and then the facebook post which effectively ended his time as leader."
politics,"Not just America they deny 

Covid 

Climate Change 

And they prop up third world dictators they find useful when countries stand up to America."
newzealand,The humidity is starting to feel like Samoa.
newzealand,Never been to the south island on the to do list. Summer will arrive it will just be in Jan.
newzealand,I'm really starting to get sick and tired of this constant rain its supposed to be summer dam it.
newzealand,Seems we get two sunny days and the rest of the week is rain right now.
politics,That will be the third sigh of relief. First was when they called the election for Joe Biden second will be when Joe is sworn in.
politics,Texas is suing the swing states now
politics,So Texas is the new Kraken then? Them moving goal posts Trump lost they need to get over it.
newzealand,"Thanks /u/timmyhate and /u/KezzaNZ you guys provided a valuable community service that helped us through these times.

Heres hoping we stay Covid free over Christmas and New Years."
politics,"Republicans ""These votes are invalid why cause they voted for democrats."" 

Judge: ""That is not a legal reason to throw them out.""

Republicans: ""I mean its all the fraud yes fraud.""

Judge: ""Do you have any evidence of that?""

Republicans: ""No.""

Judge: ""Get the fuck out of here."""
newzealand,"They were factors sure but the main reason was Kiwis just don't like you Judith. 

You staying on will give Labour another 3 years easy even when they do bugger all this term."
newzealand,"""We cant find kiwis willing to work for us!""

Because you pay under minimum wage which the industry has a history of doing."
newzealand,"Labour the we will do fuck all party.

National the fuck you party."
TopMindsOfReddit,Id put good money on he was on zero hedges pay then got suspended for approving there links after the admins banned them site wide
newzealand,"""The gun owners are the real victims here."" /s"
newzealand,National are polling at 26 percent and shes at 12 the only question is when does she get rolled.
newzealand,Mods really need to ban this bad faith troll
newzealand,There was what 4 or 5 Christian Conservative parties last election that got one percent or under youd think that would be a signal to them kiwis don't want that in politics.
newzealand,Apparently and the conspiracy theorists on facebook.
newzealand,Judith is never going to hit 30 she needs to quit so the party can re build.
newzealand,Getting so few cases that we only need to report them 4 days a week nice.
politics,Can Trumps Lawyers start being disbarred and sanctioned for wasting the courts time.
newzealand,If youve got kids its a pretty good way to burn through it in a hurrry.
newzealand,National are going to learn the hard way being Opposition for Opposition sake is a good way to stay there.
newzealand,And what another 7 days and its 28 days since community transmission
newzealand,Nice to see consistently high levels of testing means we dont have to worry about it being undetected in the community.
newzealand,If you are under 30 and dont have the bank of mum and dad good luck ever owning a home.
newzealand,"Make a law that ignores the will of the people seems real smart.

Kiwis rewarded Jacinda Ardern and Labour for getting us through Covid they punished Judith Collins and National for acting like complete fucktards and fighting amongst them selfs thats all."
newzealand,I'm going to be real interested to see what happens to this shit when Trumps out of office.
TopMindsOfReddit,Why do they have this thing about Cali being red? At least make a Trump win believable.
newzealand,On the plus side The Conservatives under Colin Craig got what 4 percent when National is doing well if they cant get anywhere during a bad cycle for the Nats they wont make it into parliament.
politics,Cant pardon state crimes Donny boy.
newzealand,Come on secrete service perp walk
politics,You'd think a Lawyer would know its just a joke is not a legal defense.
newzealand,Lawn freshly mowed Christmas carols playing at Countdown really feels like Christmas now.
politics,Obama telling the centrists to behave.
newzealand,Mum asked me what I wanted for Christmas and I said new bedding now I feel old.
newzealand,The amount of testing we are doing should rule that out.
politics,Cohen has a cushy gig on MSNBC now it wont be him.
politics,The Q cult if Trump pardoned her on the way out theyd form a black hole of denial.
newzealand,How long has it been since our last community case?
newzealand,"Labour token gesture while nothing substantial will change.

National fuck the token gestures."
newzealand,Both major parties its in there best interests to keep this bubble growing and for a correction to happen at this point we would need something like the crash of the 1930's since the 2007 - 8 crisis we kept on going up.
politics,Anyone notice how the right get treated with kid gloves and the left get tear gassed and shot it or is it just me?
politics,Look how hard the FBI etc has gone after civil rights activists over the decades these guys are getting treated with kids gloves.
TopMindsOfReddit,AXO has lived so long in his own echo chamber its breaking him that reality is hitting home.
politics,So much turn out that checks notes caused Joe Biden to win the election.
newzealand,Labour will tinker around the edges while doing nothing substantial National will add gas to the fire.
newzealand,When both major parties MPS for the most part have at least two or three houses each spoilers they wont be doing anything about it.
TopMindsOfReddit,I guess innocent until proven guilty is a foreign concept to them?
StarWars,They did an amazing job with Ahsoka also that Thrawn name drop big bad for season 3?
politics,He who has to say I am the king is no king.
TopMindsOfReddit,AXO is taking a lot of Copeium
politics,"Always has been. The radical left want checks notes affordable healthcare and college education and to get paid enough to actually be able to live off it. 

The far right want Trump to be there God Emperor for life and to send all the people who don't think like them to the camps."
newzealand,ACT had a seat in parliament and New Conservatives don't.
newzealand,"Only 20? It took me a year of constiently looking for work to get a job after I had injured my back and recovered in 2007.

Its a slog and dealing with the shit show that was WINZ made it absolutely miserable."
SubredditDrama,Anything left of facisim they consider communism
politics,I honestly don't think he thinks he will actually be charged with something. His biggest fear would be going bankrupt and no one is going to bail him out this time Deutsche Bank was his last bail out and they are going to collect because they dont want Congress breathing down there necks.
newzealand,There is Te Aro as well which does a nice beer called Double Dragon there all in the same area in Upper Hutt called Brewtown its a good place to drink at.
newzealand,"Panhead and Boneface you can buy on direct on there sites.

They are my local when I want to go out for a drink Panhead I like the super charger and bone face the unit if you like hops."
politics,Cohen thought the same thing but he only got what a year.
worldnews,Trump and Barr need to tie up this lose end before their out of office.
TopMindsOfReddit,I mean r/Conspiracy invited T_D in the first time they got a telling of from the admins.
SubredditDrama,The walls be closing in on them soon they will have to face reality that Joe Biden will be the next President
newzealand,None
newzealand,Good news she will likely be up against Judith Collins again and be in for an easy win because they have learnt nothing from their humalting loss.
politics,"Narrator: ""It was."""
worldnews,Going buy the election results they were an extremely vocal minority.
newzealand,I mean thats a great way to keep Labour in power and lose more of there party to ACT.
newzealand,Given the only change they have made is getting rid of Gerry Brownlee they clearly have learnt nothing from 2020 and just want to blame Covid and the media.
politics,So much winning.
politics,Yes do it now destroy your own.
newzealand,John Key was right about one thing if National don't change and just expect the media and the public to be bored of Jacinda they will be in opposition to 2029.
politics,It's a dry run for when they don't have someone who pisses of over half the country.
politics,He will lose his dam mind it will be glorious.
newzealand,Pretty good lots of family stuff coming up over Christmas and New Years so looking forward to that.
newzealand,"There is a way to have a healthy and constructive debate about our Cornavirus  response without devolving into everything Labour does is bad because fascism.

When the vast majority of kiwis support the governments response."
newzealand,Very telling they need John Key to tell them to stop leaking its a strong team lol.
newzealand,Today might be a house work day then pick up some more beer for the afternoon should be a pretty chill day.
newzealand,Starting to feel like Summer got the apartment opened up drinking Heineken a good night.
newzealand,There back to 2000 dead a day from the Rona. But half the country thinks its over or fake and time to open up again.
politics,At the end of all this hopefully Rudy gets disbarred and charged as an unregistered foreign agent.
politics,"This fucker should have gone to prison when Bush SR when left the white house. 

Democrats wonder why Republicans keep on getting worse every administration its because you let them get away with shit unpunished."
newzealand,Its free for them to charge want they want not for us to get a choice.
newzealand,People just want a place to live that's affordable crazy I know.
newzealand,Covid bitch slapped out of NZ again good stuff.
newzealand,New AMD cards sound great on paper but Nvida has the TI cards waiting in the wing.
newzealand,Invest in kiwis and pay them what they are worth every industry hell no we are to addicted to importing cheap labour from over seas.
newzealand,Id wait til next year cause it will be a shit show
politics,So it cant be he's just gay to go this far for Trump it has to be he likes the teenage boys much like how Trump likes the teenage girls.
politics,Now imagine if the Republican party was doing this with someone competent at the helm and didn't piss of half the country every time he opened his mouth or tweeted.
newzealand,Had Indian from a local place was yum.
newzealand,No anyone who's worked for Trump has enabled him so they can not be trusted.
politics,The evidence that's getting thrown out of court because it's not actually evidence you mean that evidence?
politics,And they will be promptly thrown out of court due to no evidence.
newzealand,Yup I still go to my local there are people there who have been there for decades.
newzealand,My first job out of 7th form shit hours shit money split shift work never again.
politics,His base can go fraud to there blue in the face but it will but it will bite the Republicans in the ass when they stay home.
StarWars,So looking like the leaks were spot on for everything so far.
politics,"Trump is now thinking to him self ill run again in 2024 with Trump TV giving me the coverage Fox never did.

He's going to be in for a rude awakening when his debts come due and no one wants to bail out a loser and all going well SDNY charges him to."
newzealand,Tonight I dine in hell.
newzealand,Even something simple like rasing the benefit around Christmas time when we are at record unemployment Labour lol no.
newzealand,No fun protesting in winter.
newzealand,Yes lets dick over workers who get paid the least the most and even better lets do it during the middle of a global pandemic.
TopMindsOfReddit,whats AXO going to do when Joe Biden is sworn in as the 46th President
newzealand,Well goes to show you how fried my sense of time is.
newzealand,Manager are you actually dying?  If so you still come into work anyways.
newzealand,First time at countdown this year I have heard Christmas carols  was today as well they are normally earlier.
newzealand,Honestly feels later this year than it normally does.
newzealand,So we learnt nothing from Victoria then?
newzealand,"https://twitter.com/rarahsobson/status/1326604451029741568

> Shout out to the mortgage broker on @NZMorningReport who acknowledged it’s near impossible for single people to buy a house on their own.

As a single guy I had a lot of help and got really lucky to be able to buy my place its not just Auckland were the housing market is fucked and more and more people are getting completely locked out of it even if you make good money."
politics,"I prefer facts not feelings. 

Joe Biden is The President Elect and will be the 46th President of America."
newzealand,I missed out on all the things PS5 Xbox and 3080 Im not bitter youre the one whos bitter.
politics,Hes right as a kiwi we all think its pretty fucking pathetic and cringey.
newzealand,Almost if both major parties have a vested interested in keeping the system going as intend.
newzealand,These one of border worker cases we get don't seem to spark of any clusters thanks to the systems we have in place which is great
lastweektonight,"Such a long ass week a great re cap of it.

Trump and his brood will cry and scream but Jan 20th 2021 they will be out of the white house and the world will sleep a little easier."
politics,Trump doesn't want the humiliation of being dragged all though that would be a great way to start 2021.
newzealand,Fringe right in NZ  continuing to show how irrelevant they are to NZ and the world.
southpark,Whens the next special?
politics,Goes to show you how actually bankrupt they are.
newzealand,Its not been a good year for them.
politics,I like to think our election was a sign shit was getting back to the adults being back in charge.
politics,Drones are cool but we did it we survived the 2020 election.
politics,The cult is already turning hard on Fox News the rest its only a matter of time.
politics,Seeing Trump wold implode and start turning on each other is very cathartic.
politics,I am so looking forward to SDNY going ham as soon as Biden is sworn in no more protection for Trump and his goons.
politics,I am drinking 8 percent IPA
politics,Call it while I'm at the pub please.
politics,Hoping the networks are just waiting for prime time to call it but man its been a long ass week.
newzealand,"Officially mortgage free today final payment went out last night boo yeah.

Of to Te Aro Brewery for lunch since its my cousins birthday so its a really great day."
politics,"What a long week but a good way to end it. 

President Elect Joe Biden feels real good to say."
politics,alleged child rapist.
politics,Hes thinking now the work really begins.
newzealand,With no Senate and A Republican Supreme court Joe wont be able to do shit.
politics,Really hoping it gets called before then.
politics,Im thinking if it diddnt call the election for Biden they would have.
politics,I really want this to be called tonight but part of me wants to make it to 69 discussion threads lol.
newzealand,Judith Collins and Gerry Brownlee soon to be a foot note.
politics,Ill be picking up some IPAs from my local brewery Panhead supercharger.
politics,Its 12PM in NZ haven't started drinking yet and wont till after work but it's been a long week.
politics,"Seeing how hard they are turning on Fox is fun. I half expect them to turn on the Republican establishment to for not fighting hard enough for Trump. 

But please let it called tonight my liver is taking a beating."
politics,Diddnt Bush V Gore work for Bush because they stopped the re count not started them?
newzealand,When do the specials come in?
politics,I went to bed very angry last night.
newzealand,There free to host whatever party they want and customers are free to drink else where if they don't like it.
politics,When there is 15k comments ish new thread.
politics,Is Donald Trump going to shit on the floor in the white house on the way out.
politics,She will be a bit busy with her third term as PM.
politics,Threads tend to break when they get over 15K comments.
politics,I never voted for Trump. Whats this picture of you wearing a MAGA hat and shirt? I was wearing it Ironically.
politics,Ill give you 3.50 for it.
politics,To old for Rudy though.
politics,Poor house then jail house.
politics,"Only a Republican would be chanting stop the count.

They should really travel some when there is no longer a plague and see how the rest of the world actually views them."
politics,Rules only apply to democrats.
newzealand,He will get another supreme court pick that will rubber stamp everything America is done.
newzealand,I mean his health wont last that long but then its time for Ivanka
newzealand,American why does the world hate us? Because you inflict Republicans on us every 8 years and fuck over progress for that decade?
newzealand,I should have put that 100 on trump.
politics,It sucked.
politics,Come on America you can do prove Trump was a once in life time perfect storm of events and kick him to the curb.
newzealand,Judith Collins soon to be a foot note
newzealand,Cant have the housing market go down now can we? The boomers might get upset.
newzealand,Where do I do it? It be nice to make some money after my Melbourne cup picks.
newzealand,"Id put a 100 bucks on Trump winning thanks to the 
Supreme Court."
newzealand,Got a test because of my sniuses akward but not to bad
worldnews,Grant Robertson as Deputy PM is the first time NZ has had an openly Gay Deputy PM so that cool.
newzealand,Looking like the systems we have in place are working as intended.
newzealand,"""We voted Labour to keep the Greens out"""
worldnews,Its so people don't freak out about being under lock down for Christmas.
politics,Police on there of hours.
politics,Ask them what about the kids at the border they dont care cause they are brown or they just go Obama did it.
newzealand,Hes not just actively doing nothing and ignoring it hes pouring gas on the fire and making it worse.
newzealand,"NZ is a binge drinking nation. 

Some of the rants I've heard about weed from people who are functioning alcoholics."
newzealand,1 week with no community transmission.
newzealand,!movetonz
politics,The same Tucker Carlson the courts said no sane or reasonable thinking person should take seriously?
newzealand,The people that would do this if it's legal to smoke are already doing it when its illegal.
newzealand,Hopefully will be a covid free Christmas as France and Germany are back in lockdown
newzealand,And the court agreed to even better.
newzealand,Rupert Murdoch just taking his dogs for a walk.
newzealand,"I love being able to go out and be free from catching a deadly virus. 

Got to love how its the Australian , UK and American media all having a go what do they have in common its Rupert Murdoch."
newzealand,She will try to take as many of them as she can down with her.
newzealand,Lockdown rules are airport rules you can drink in the morning if you want to.
newzealand,Rupert Murdoch really hates the fact we beat Covid 3 times.
newzealand,He was the campaign manager he's got to go.
newzealand,No one knows.
newzealand,Its a good thing National are in opposition for the next there years.
politics,This is how democracy dies stolen buy an evil turtle.
newzealand,It also helped that National was completely un electable and had a circular firing squad aiming inwards.
politics,Vote Trump out before the Republican Supreme Court takes it away.
newzealand,Hopefully a wrap on Season 2.5
newzealand,Dont spread dumb shit online.
politics,The one thing Trump is really good at spending other peoples money.
newzealand,Its a toss up if it passed or not the polls did tighten up on election day to favor yes just depends on who turned out.
newzealand,Great news for the long weekend this thing follows the same pattern each time we eliminate it.
newzealand,They still might lose a few seats when all the special votes are counted
newzealand,Well booked in for lunch at panhead today with some mates should be a pretty good day.
